[
    {
        "Title": "Administrateur de bases de données (DBA) (m/f) (réf. F00036235)",
        "Link": "https://govjobs.public.lu/fr/postuler/postes-ouverts/postes-vacants/fonctionnaires/2025/A1/Juin/20250612-administrateurdebasesdedonnesd-373337.html",
        "Education Level": "Master",
        "Job Category": "Technologie de l'information et de la communication",
        "Status": "Fonctionnaire",
        "Task": "Tâche complète",
        "Ministry": "Ministère de la Santé et de la Sécurité sociale",
        "Administration/Organization": "Centre commun de la sécurité sociale",
        "Application Deadline": "30/06/2025",
        "Nationality": "Être ressortissant UE",
        "Number of Vacancies": "1",
        "Contract Type": "CDI",
        "Full Description": "Informations générales Statut Fonctionnaire Groupe de traitement A1 Date limite de candidature 30/06/2025 Ministère Ministère de la Santé et de la Sécurité sociale Administration/Organisme Centre commun de la sécurité sociale Lieu Luxembourg-Gare Tâche Tâche complète Nombre de postes vacants 1 Type de contrat CDI Nationalité Être ressortissant UE Catégorie de métiers Technologie de l'information et de la communication Réf. F00036235 Qui recrute ? Le Centre commun de la sécurité sociale (CCSS) est un établissement public en charge notamment : de l'affiliation à la sécurité sociale des salariés, travailleurs indépendants et assurés volontaires ; du calcul, de la perception et du recouvrement des cotisations sociales ; de la répartition des cotisations sociales entre les différentes institutions de la sécurité sociale telles que l’AAA, la CNS, la CNAP. Le CCSS offre un cadre de travail motivant : en mettant en œuvre une mission légale essentielle pour le Luxembourg ; en étant installé dans un bâtiment moderne ; en étant localisé idéalement en face de la gare de Luxembourg à proximité immédiate de tous les moyens de transports, dans un quartier en renouveau et facile d'accès ; en offrant la formation initiale complétée par la formation continue offerte à tous les agents du service public ; en offrant une rémunération en ligne avec les conditions de la Fonction publique. Missions Le département informatique du Centre commun de la sécurité sociale a comme mission principale de fournir aux institutions de la sécurité sociale les applications de gestion spécifiques à la législation en la matière. Vous serez intégrés dans une de nos équipes et vos missions principales seront: La gestion d'un parc de base de données \"Oracle\" au sein d'une équipe déjà existante; Le support DB pour les équipes développeurs; La conduite de projets de migration de grande envergure; La participation dans des projets de sécurisation des données et accès; La sauvegarde et la restauration des données; La mise en place de solutions à haute disponibilité; La surveillance et optimisation des performances; La gestion d'outils pour les environnements de type \"Datawarehouse\". Profil Compétences techniques Expériences dans la gestion de bases de données \"Oracle\"; Maîtrise des modèles relationnels de données; Développements en langage PL/SQL; Automatisation de tâches via des scripts BASH/Python et Ansible; Bonne connaissance des environnements Linux/Shell; Bonnes capacités rédactionnelles et orales en français et en anglais. Compétences comportementales Sens de la rigueur, de la logique et de l'organisation; Sens de l'initiative; Capacité à travailler en autonome, tout en étant capable de travailler en équipe; Capacité à communiquer et à rédiger. Atouts Notions sur les bases de type \"Datawarehouse\" (datamart, star schéma, etc.); Expériences dans le domaine de la sécurité informatique; Expériences avec l'approche \"DevOps\". Conditions d’admission Le poste est réservé aux lauréats de l’examen-concours Les candidats ayant réussi à la partie générale de l’examen-concours restent admissibles aux épreuves spéciales pendant une durée de 5 ans (à compter à partir de la décision de la commission d’examen). Les candidats postulant au poste vacant devront participer à une épreuve spéciale organisée par l’administration qui recrute. Obtenez plus de détails sur les conditions d'admission des fonctionnaires de l'État . Diplômes Vous êtes titulaire d’un grade ou diplôme délivré par un établissement d’enseignement supérieur reconnu par l’Etat du siège de l’établissement et sanctionnant l’accomplissement avec succès d’un master en informatique, diplôme d’ingénieur ou de son équivalent. Expérience Vous avez une expérience d'au moins 3 ans dans le domaine. Langues Vous répondez aux exigences des connaissances de 3 langues administratives pour le groupe de traitement A1. Nationalité Vous êtes ressortissant d’un État membre de l’Union européenne. Documents à fournir Lettre de motivation, copie du diplôme, lettre de réussite à l’examen-concours (document complet avec le relevé des notes par test et les annexes) et CV renseignant les informations suivantes: Nom(s) et prénom(s) Numéro d’identification (càd. le numéro de matricule nationale ou, à défaut, la date de naissance) Nationalité Adresse électronique Liste des établissements d’enseignement fréquentés et leur pays d’implantation (veuillez indiquer le nom complet des établissements, les abréviations n'étant pas permises) Diplômes (veuillez indiquer l'intitulé des diplômes) Expérience professionnelle Connaissances en langues parlées et écrites Pour ce poste, vous devez obligatoirement postuler en ligne via MyGuichet, les candidatures via courriel ou via courrier postal n’étant pas acceptées. Les documents sont à introduire via MyGuichet en format pdf (taille maximale 20 Mo).",
        "Informations générales": "StatutFonctionnaireGroupe de traitementA1Date limite de candidature30/06/2025MinistèreMinistère de la Santé et de la Sécurité socialeAdministration/OrganismeCentre commun de la sécurité socialeLieuLuxembourg-GareTâcheTâche complèteNombre de postes vacants1Type de contratCDINationalitéÊtre ressortissant UECatégorie de métiersTechnologie de l'information et de la communicationRéf.F00036235",
        "Qui recrute ?": " Le Centre commun de la sécurité sociale (CCSS) est un établissement public en charge notamment :de l'affiliation à la sécurité sociale des salariés, travailleurs indépendants et assurés volontaires ;du calcul, de la perception et du recouvrement des cotisations sociales ;de la répartition des cotisations sociales entre les différentes institutions de la sécurité sociale telles que l’AAA, la CNS, la CNAP.Le CCSS offre un cadre de travail motivant :en mettant en œuvre une mission légale essentielle pour le Luxembourg ;en étant installé dans un bâtiment moderne ;en étant localisé idéalement en face de la gare de Luxembourg à proximité immédiate de tous les moyens de transports, dans un quartier en renouveau et facile d'accès ;en offrant la formation initiale complétée par la formation continue offerte à tous les agents du service public ;en offrant une rémunération en ligne avec les conditions de la Fonction publique. ",
        "Missions": "Le département informatique du Centre commun de la sécurité sociale a comme mission principale de fournir aux institutions de la sécurité sociale les applications de gestion spécifiques à la législation en la matière. Vous serez intégrés dans une de nos équipes et vos missions principales seront:La gestion d'un parc de base de données \"Oracle\" au sein d'une équipe déjà existante;Le support DB pour les équipes développeurs;La conduite de projets de migration de grande envergure;La participation dans des projets de sécurisation des données et accès;La sauvegarde et la restauration des données;La mise en place de solutions à haute disponibilité;La surveillance et optimisation des performances;La gestion d'outils pour les environnements de type \"Datawarehouse\".",
        "Profil": "Compétences techniques Expériences dans la gestion de bases de données \"Oracle\";Maîtrise des modèles relationnels de données;Développements en langage PL/SQL;Automatisation de tâches via des scripts BASH/Python et Ansible;Bonne connaissance des environnements Linux/Shell;Bonnes capacités rédactionnelles et orales en français et en anglais. Compétences comportementales Sens de la rigueur, de la logique et de l'organisation;Sens de l'initiative;Capacité à travailler en autonome, tout en étant capable de travailler en équipe;Capacité à communiquer et à rédiger. Atouts Notions sur les bases de type \"Datawarehouse\" (datamart, star schéma, etc.);Expériences dans le domaine de la sécurité informatique;Expériences avec l'approche \"DevOps\".",
        "Conditions d’admission": "Le poste est réservé aux lauréats de l’examen-concours Les candidats ayant réussi à la partie générale de l’examen-concours restent admissibles aux épreuves spéciales pendant une durée de 5 ans (à compter à partir de la décision de la commission d’examen). Les candidats postulant au poste vacant devront participer à une épreuve spéciale organisée par l’administration qui recrute. Obtenez plus de détails sur lesconditions d'admission des fonctionnaires de l'État. Diplômes Vous êtes titulaire d’un grade ou diplôme délivré par un établissement d’enseignement supérieur reconnu par l’Etat du siège de l’établissement et sanctionnant l’accomplissement avec succès d’un master en informatique, diplôme d’ingénieur ou de son équivalent. Expérience Vous avez une expérience d'au moins 3 ans dans le domaine. Langues Vous répondez aux exigences des connaissances de 3 langues administratives pour le groupe de traitement A1. Nationalité Vous êtes ressortissant d’un État membre de l’Union européenne.",
        "Documents à fournir": "Lettre de motivation, copie du diplôme, lettre de réussite à l’examen-concours (document complet avec le relevé des notes par test et les annexes) et CV renseignant les informations suivantes: Nom(s) et prénom(s)Numéro d’identification (càd. le numéro de matricule nationale ou, à défaut, la date de naissance)NationalitéAdresse électroniqueListe des établissements d’enseignement fréquentés et leur pays d’implantation (veuillez indiquer le nom complet des établissements, les abréviations n'étant pas permises)Diplômes (veuillez indiquer l'intitulé des diplômes)Expérience professionnelleConnaissances en langues parlées et écrites Pour ce poste, vous devez obligatoirement postuler en ligne via MyGuichet, les candidatures via courriel ou via courrier postal n’étant pas acceptées. Les documents sont à introduire via MyGuichet en format pdf (taille maximale 20 Mo).",
        "Group Classification": "A1",
        "adding_date": "2025-06-13T02:00:16.278607"
    },
    {
        "Title": "Spécialiste en sciences humaines (m/f)",
        "Link": "https://govjobs.public.lu/fr/postuler/postes-ouverts/postes-vacants/decentralise/2025/A2/Juin/20250612-spcialisteenscienceshumainesmf-373090.html",
        "Education Level": "Bachelor",
        "Job Category": "Education et Formation tout au long de la vie",
        "Status": "Employé de l'État",
        "Task": "Tâche à temps partiel (50%)",
        "Ministry": "Ministère de l'Éducation nationale, de l'Enfance et de la Jeunesse",
        "Administration/Organization": "Centre pour le développement des apprentissages Grande-Duchesse Maria Teresa",
        "Application Deadline": "19/06/2025",
        "Nationality": "Être ressortissant UE",
        "Number of Vacancies": "1",
        "Contract Type": "CDI",
        "Full Description": "Informations générales Statut Employé de l'État Groupe d'indemnité A2 Date limite de candidature 19/06/2025 Ministère Ministère de l'Éducation nationale, de l'Enfance et de la Jeunesse Administration/Organisme Centre pour le développement des apprentissages Grande-Duchesse Maria Teresa Lieu Marnach Tâche Tâche à temps partiel (50%) Nombre de postes vacants 1 Type de contrat CDI Nationalité Être ressortissant UE Catégorie de métiers Education et Formation tout au long de la vie Qui recrute ? Centre pour le développement des apprentissages Grande-Duchesse Maria Teresa Missions Bilans et suivis thérapeutiques individuels et en groupe en psychomotricité; Tenue d'ateliers de psychomotricité; Tenue d'ateliers de frappe sur clavier (Tipptraining); Consultations pour parents, enseignants et autres professionnels; Organisation de groupes thérapeutiques d'enfants ou d'adolescents; Coordination de dossiers individuels en collaboration avec l'équipe pluridisciplinaire et les partenaires externes au service. Profil Compétences comportementales Savoir travailler de façon coopérative, autonome, flexible et créative dans une équipe multidisciplinaire; Avoir le sens de responsabilité et de l'organisation; Faire preuve de fiabilité et d’empathie; Engagement actif dans le domaine des formations professionnelles spécifiques. Atouts Expérience professionnelle antérieure dans le domaine de la rééducation motrice; Avoir travaillé dans le domaine des troubles des apprentissages. Conditions d’admission Poste d'employé de l'État Obtenez plus de détails sur les conditions d'admission des employés de l'État . Diplômes Vous êtes titulaire d’un grade ou diplôme délivré par un établissement d’enseignement supérieur reconnu par l’Etat du siège de l’établissement et sanctionnant l’accomplissement avec succès d’un bachelor en ergothérapie ou de son équivalent. Langues Vous répondez aux exigences des connaissances de 3 langues administratives pour le groupe d'indemnité A2. Nationalité Vous êtes ressortissant d’un État membre de l’Union européenne. Postuler Si vous êtes intéressé par cette fonction, portez-vous candidat jusqu'au 19 juin 2025 et envoyez les documents demandés par courriel à alex.kockhans@cc-cda.lu . Documents à fournir Lettre de motivation, copie du diplôme et CV renseignant les informations suivantes: Nom(s) et prénom(s) Numéro d’identification (càd. le numéro de matricule nationale ou, à défaut, la date de naissance) Nationalité Adresse électronique Liste des établissements d’enseignement fréquentés et leur pays d’implantation (veuillez indiquer le nom complet des établissements, les abréviations n'étant pas permises) Diplômes (veuillez indiquer l'intitulé des diplômes) Expérience professionnelle Connaissances en langues parlées et écrites Pour ce poste, vous devez obligatoirement postuler via courriel, les candidatures via MyGuichet ou via courrier postal n’étant pas acceptées.",
        "Informations générales": "StatutEmployé de l'ÉtatGroupe d'indemnitéA2Date limite de candidature19/06/2025MinistèreMinistère de l'Éducation nationale, de l'Enfance et de la JeunesseAdministration/OrganismeCentre pour le développement des apprentissages Grande-Duchesse Maria TeresaLieuMarnachTâcheTâche à temps partiel (50%)Nombre de postes vacants1Type de contratCDINationalitéÊtre ressortissant UECatégorie de métiersEducation et Formation tout au long de la vie",
        "Qui recrute ?": " Centre pour le développement des apprentissages Grande-Duchesse Maria Teresa ",
        "Missions": "Bilans et suivis thérapeutiques individuels et en groupe en psychomotricité;Tenue d'ateliers de psychomotricité;Tenue d'ateliers de frappe sur clavier (Tipptraining);Consultations pour parents, enseignants et autres professionnels;Organisation de groupes thérapeutiques d'enfants ou d'adolescents;Coordination de dossiers individuels en collaboration avec l'équipe pluridisciplinaire et les partenaires externes au service.",
        "Profil": "Compétences comportementales Savoir travailler de façon coopérative, autonome, flexible et créative dans une équipe multidisciplinaire;Avoir le sens de responsabilité et de l'organisation;Faire preuve de fiabilité et d’empathie;Engagement actif dans le domaine des formations professionnelles spécifiques. Atouts Expérience professionnelle antérieure dans le domaine de la rééducation motrice;Avoir travaillé dans le domaine des troubles des apprentissages.",
        "Conditions d’admission": "Poste d'employé de l'État Obtenez plus de détails sur lesconditions d'admission des employés de l'État. Diplômes Vous êtes titulaire d’un grade ou diplôme délivré par un établissement d’enseignement supérieur reconnu par l’Etat du siège de l’établissement et sanctionnant l’accomplissement avec succès d’un bachelor en ergothérapie ou de son équivalent. Langues Vous répondez aux exigences des connaissances de 3 langues administratives pour le groupe d'indemnité A2. Nationalité Vous êtes ressortissant d’un État membre de l’Union européenne.",
        "Postuler": "Si vous êtes intéressé par cette fonction, portez-vous candidat jusqu'au 19 juin 2025 et envoyez les documents demandés par courriel àalex.kockhans@cc-cda.lu.",
        "Documents à fournir": "Lettre de motivation, copie du diplôme et CV renseignant les informations suivantes: Nom(s) et prénom(s)Numéro d’identification (càd. le numéro de matricule nationale ou, à défaut, la date de naissance)NationalitéAdresse électroniqueListe des établissements d’enseignement fréquentés et leur pays d’implantation (veuillez indiquer le nom complet des établissements, les abréviations n'étant pas permises)Diplômes (veuillez indiquer l'intitulé des diplômes)Expérience professionnelleConnaissances en langues parlées et écrites Pour ce poste, vous devez obligatoirement postuler via courriel, les candidatures via MyGuichet ou via courrier postal n’étant pas acceptées.",
        "Group Classification": "A2",
        "adding_date": "2025-06-13T02:00:16.278733"
    },
    {
        "Title": "Agent de rétention (m/f) (réf. E00036239)",
        "Link": "https://govjobs.public.lu/fr/postuler/postes-ouverts/postes-vacants/employes/2025/D1/Juin/20250612-agentdertentionmfrfe00036239-373348.html",
        "Education Level": "3 années ES",
        "Job Category": "Population, Défense et Sécurité",
        "Status": "Employé de l'État",
        "Task": "Tâche complète",
        "Ministry": "Ministère des Affaires intérieures",
        "Administration/Organization": "Centre de rétention",
        "Application Deadline": "19/06/2025",
        "Nationality": "Être ressortissant UE",
        "Number of Vacancies": "1",
        "Contract Type": "CDD jusqu'au 28 février 2026",
        "Full Description": "Informations générales Statut Employé de l'État Groupe d'indemnité D1 Date limite de candidature 19/06/2025 Ministère Ministère des Affaires intérieures Administration/Organisme Centre de rétention Lieu Centre de rétention Tâche Tâche complète Nombre de postes vacants 1 Type de contrat CDD jusqu'au 28 février 2026 Nationalité Être ressortissant UE Catégorie de métiers Population, Défense et Sécurité Réf. E00036239 Qui recrute ? Centre de rétention Missions Encadrer des personnes placées sous la responsabilité du Centre de rétention; Collaborer à la prévention des incidents et à la gestion de risque; Gérer le déroulement quotidien dans les établissements placés sous la responsabilité du Centre de rétention. Profil Compétences techniques Appliquer les règles de sécurité et avoir les gestes et postures adaptés; Maîtriser les techniques d'intervention en cas d'incidents; Savoir manier les moyens techniques d'intervention et de contrainte. Compétences comportementales Analyser : Vous évaluez les informations, données et contenus de manière critique, le cas échéant dans un environnement digital, vous identifiez les liens logiques et restituez l’information dans une synthèse complète et cohérente; Mettre en œuvre des solutions : Vous prenez l’initiative de résoudre les problèmes, vous mettez en oeuvre les solutions et vous agissez pour améliorer les processus et les méthodes de travail en tenant compte des évolutions technologiques; Soutenir : Vous agissez comme référence, vous accompagnez les collègues, vous les guidez et les soutenez en stimulant la coopération autour de l’objectif commun; Servir le client-usager : Vous accompagnez le client-usager de manière personnalisée, vous entretenez des contacts réguliers et constructifs, vous appliquez les lignes de bonne conduite administrative; Faire preuve d'ouverture : Vous êtes ouvert au changement et à l’innovation, vous vous ouvrez à la diversité et vous vous intéressez à d’autres disciplines que les vôtres; Gérer le stress : Vous gardez votre calme face à la pression, vous restez constructif face à la critique et vous agissez de façon constante malgré les difficultés; S'autodévelopper : Vous vous remettez en question de façon régulière, vous apprenez de vos erreurs et vous apprenez continuellement; S'impliquer : Vous vous engagez pour générer des résultats, vous assumez la responsabilité et la qualité des actions entreprises, vous vous engagez pour le bien commun. Atouts Maîtrise d'une ou de plusieurs langues autres que les langues officielles. Conditions d’admission Poste d'employé de l'État Obtenez plus de détails sur les conditions d'admission des employés de l'État . Diplômes Vous avez accompli avec succès 3 années d'études dans l'enseignement public luxembourgeois, soit dans l'enseignement secondaire, soit dans l'enseignement secondaire technique ou présentez un certificat reconnu comme équivalent. Langues Vous répondez aux exigences des connaissances de 3 langues administratives pour le groupe d'indemnité D1. Nationalité Vous êtes ressortissant d’un État membre de l’Union européenne. Documents à fournir Lettre de motivation, copie du diplôme et CV renseignant les informations suivantes: Nom(s) et prénom(s) Numéro d’identification (càd. le numéro de matricule nationale ou, à défaut, la date de naissance) Nationalité Adresse électronique Liste des établissements d’enseignement fréquentés et leur pays d’implantation (veuillez indiquer le nom complet des établissements, les abréviations n'étant pas permises) Diplômes (veuillez indiquer l'intitulé des diplômes) Expérience professionnelle Connaissances en langues parlées et écrites Pour ce poste, vous devez obligatoirement postuler en ligne via MyGuichet, les candidatures via courriel ou via courrier postal n’étant pas acceptées. Les documents sont à introduire via MyGuichet en format pdf (taille maximale 20 Mo).",
        "Informations générales": "StatutEmployé de l'ÉtatGroupe d'indemnitéD1Date limite de candidature19/06/2025MinistèreMinistère des Affaires intérieuresAdministration/OrganismeCentre de rétentionLieuCentre de rétentionTâcheTâche complèteNombre de postes vacants1Type de contratCDD jusqu'au 28 février 2026NationalitéÊtre ressortissant UECatégorie de métiersPopulation, Défense et SécuritéRéf.E00036239",
        "Qui recrute ?": " Centre de rétention ",
        "Missions": "Encadrer des personnes placées sous la responsabilité du Centre de rétention;Collaborer à la prévention des incidents et à la gestion de risque;Gérer le déroulement quotidien dans les établissements placés sous la responsabilité du Centre de rétention.",
        "Profil": "Compétences techniques Appliquer les règles de sécurité et avoir les gestes et postures adaptés;Maîtriser les techniques d'intervention en cas d'incidents;Savoir manier les moyens techniques d'intervention et de contrainte. Compétences comportementales Analyser : Vous évaluez les informations, données et contenus de manière critique, le cas échéant dans un environnement digital, vous identifiez les liens logiques et restituez l’information dans une synthèse complète et cohérente;Mettre en œuvre des solutions : Vous prenez l’initiative de résoudre les problèmes, vous mettez en oeuvre les solutions et vous agissez pour améliorer les processus et les méthodes de travail en tenant compte des évolutions technologiques;Soutenir : Vous agissez comme référence, vous accompagnez les collègues, vous les guidez et les soutenez en stimulant la coopération autour de l’objectif commun;Servir le client-usager : Vous accompagnez le client-usager de manière personnalisée, vous entretenez des contacts réguliers et constructifs, vous appliquez les lignes de bonne conduite administrative;Faire preuve d'ouverture : Vous êtes ouvert au changement et à l’innovation, vous vous ouvrez à la diversité et vous vous intéressez à d’autres disciplines que les vôtres;Gérer le stress : Vous gardez votre calme face à la pression, vous restez constructif face à la critique et vous agissez de façon constante malgré les difficultés;S'autodévelopper : Vous vous remettez en question de façon régulière, vous apprenez de vos erreurs et vous apprenez continuellement;S'impliquer : Vous vous engagez pour générer des résultats, vous assumez la responsabilité et la qualité des actions entreprises, vous vous engagez pour le bien commun. Atouts Maîtrise d'une ou de plusieurs langues autres que les langues officielles.",
        "Conditions d’admission": "Poste d'employé de l'État Obtenez plus de détails sur lesconditions d'admission des employés de l'État. Diplômes Vous avez accompli avec succès 3 années d'études dans l'enseignement public luxembourgeois, soit dans l'enseignement secondaire, soit dans l'enseignement secondaire technique ou présentez un certificat reconnu comme équivalent. Langues Vous répondez aux exigences des connaissances de 3 langues administratives pour le groupe d'indemnité D1. Nationalité Vous êtes ressortissant d’un État membre de l’Union européenne.",
        "Documents à fournir": "Lettre de motivation, copie du diplôme et CV renseignant les informations suivantes: Nom(s) et prénom(s)Numéro d’identification (càd. le numéro de matricule nationale ou, à défaut, la date de naissance)NationalitéAdresse électroniqueListe des établissements d’enseignement fréquentés et leur pays d’implantation (veuillez indiquer le nom complet des établissements, les abréviations n'étant pas permises)Diplômes (veuillez indiquer l'intitulé des diplômes)Expérience professionnelleConnaissances en langues parlées et écrites Pour ce poste, vous devez obligatoirement postuler en ligne via MyGuichet, les candidatures via courriel ou via courrier postal n’étant pas acceptées. Les documents sont à introduire via MyGuichet en format pdf (taille maximale 20 Mo).",
        "Group Classification": "D1",
        "adding_date": "2025-06-13T02:00:16.278878"
    },
    {
        "Title": "Analyste Business Intelligence (m/f) (réf. E00036212) (réf. F00036213)",
        "Link": "https://govjobs.public.lu/fr/postuler/postes-ouverts/postes-vacants/fonctionnaires/2025/A1/Juin/20250612-analystebusinessintelligencemf-372921.html",
        "Education Level": "Master",
        "Job Category": "Justice",
        "Status": "Fonctionnaire, Employé de l'État",
        "Task": "Tâche complète",
        "Ministry": "Ministère de la Justice",
        "Administration/Organization": "Administration judiciaire",
        "Application Deadline": "27/06/2025",
        "Nationality": "Être ressortissant UE",
        "Number of Vacancies": "1",
        "Contract Type": "Admission au stage (fonctionnaire) ou CDI (employé de l’État)",
        "Full Description": "Informations générales Statut Fonctionnaire, Employé de l'État Groupe A1 Date limite de candidature 27/06/2025 Ministère Ministère de la Justice Administration/Organisme Administration judiciaire Lieu Luxembourg Tâche Tâche complète Nombre de postes vacants 1 Nationalité Être ressortissant UE Catégorie de métiers Justice Réf. F00036213 Qui recrute ? L’Administration judiciaire recrute un Analyste Business Intelligence pour le service statistique de la justice. Au sein d’une équipe dynamique, vous participerez à des projets de mise en place d’outils fiables, sûrs et standardisés pour exploiter les informations. Le service statistique de la justice travaille en étroite collaboration avec le service de gestion de projets informatiques ainsi que le Centre des technologies de l’information de l’État (CTIE) pour garantir des services fiables aux différentes entités de l’Administration judiciaire. Missions L’analyste business intelligence (BI) fera partie du service de statistiques de la justice. Sous la conduite de la Direction de l’information et de la digitalisation, ce service est chargé de la l'ensemble des activités liées à la collecte, au traitement, au stockage, au partage et à l'utilisation des données de l’Administration judiciaire. En tant qu’analyste Business Intelligence (BI) votre mission principale sera: Réaliser de tableaux de bord et rapports sur base des indicateurs définis par les différents services de l’administration judiciaire et des demandes nationales et internationales; Suivre les projets BI en tant qu’analyste et assurer que la solution réalisée corresponde aux besoins et respecte les exigences et contraintes définies; Garantir l’implication du métier dans la conception des solutions BI, depuis l’expression des besoins jusqu’à la livraison afin de construire des tableaux de bord et convertir les données en information; Prendre en charge le développement des nouvelles demandes évolutives et/ou correctives (intégration de nouvelles données, rapports); Préparation des tableaux de bord pour le suivi des activités de la Justice; Assurer la maintenance des tableaux de bord (corrective, y compris la détection de problèmes liés à la qualité de la donnée, ou évolutive), l’analyse des incidents et des demandes de changement(s); Faire évoluer et améliorer les processus et systèmes décisionnels en effectuant de la veille technologique; Travailler en collaboration avec les data analystes et les équipes du CTIE. Profil Compétences techniques Connaissances des systèmes décisionnels ‘Business Intelligence’; Connaissances en matière d’analyse et contrôle de données; Connaissances des bonnes pratiques en data visualisation; Connaissance des outils et méthodes d’analyse, de collecte, de modélisation et de restitution d’information décisionnelle; Maîtriser le français et/ou l’anglais. Compétences comportementales Capacité solide en matière d’analyses, de synthèses et de résolutions des problèmes; Capacité de l’organisation; Capacité de l’initiative et des responsabilités; Capacité de la discrétion et des responsabilités; Capacité de travailler de façon autonome ainsi qu’en équipe; Capacité à proposer des idées, à développer des concepts et à les défendre; Capacité à gérer plusieurs projets simultanément et à respecter les délais dans un environnement dynamique; Être passionné de nouvelles technologies et avoir le sens de l’innovation. Atouts Connaissances des outils de reporting (Qlik Sense, Power BI, etc.); Connaissances en langage d’exploitation de bases de données (SQL); Expérience professionnelle prouvée dans un domaine similaire. Conditions d’admission Le poste peut être brigué sous le statut du fonctionnaire ou de l’employé de l’État. Si vous souhaitez postuler sous le statut du fonctionnaire, vous devrez au préalable avoir réussi l’épreuve d’aptitude générale (EAG). Les candidats ayant réussi à l’EAG restent admissibles aux épreuves spéciales pendant une durée de 5 ans (à compter à partir de la décision de la commission d’examen). Obtenez plus de détails sur les conditions d'admission des fonctionnaires de l'État ainsi que sur les conditions d'admission des employés de l'État . Diplômes Vous êtes titulaire d’un grade ou diplôme délivré par un établissement d’enseignement supérieur reconnu par l’Etat du siège de l’établissement et sanctionnant l’accomplissement avec succès d’un master en informatique, ingénieur ou de son équivalent. Langues Vous répondez aux exigences des connaissances de 3 langues administratives pour le groupe A1. Nationalité Vous êtes ressortissant d’un État membre de l’Union européenne. Documents à fournir Lettre de motivation, copie du diplôme, lettre de réussite à l’épreuve d’aptitude générale (uniquement pour le statut du fonctionnaire : joindre le document complet avec le relevé des notes par test et les annexes) et CV renseignant les informations suivantes: Nom(s) et prénom(s) Numéro d’identification (càd. le numéro de matricule nationale ou, à défaut, la date de naissance) Nationalité Adresse électronique Liste des établissements d’enseignement fréquentés et leur pays d’implantation (veuillez indiquer le nom complet des établissements, les abréviations n'étant pas permises) Diplômes (veuillez indiquer l'intitulé des diplômes) Expérience professionnelle Connaissances en langues parlées et écrites Pour ce poste, vous devez obligatoirement postuler en ligne via MyGuichet, les candidatures via courriel ou via courrier postal n’étant pas acceptées. Les documents sont à introduire via MyGuichet en format pdf (taille maximale 20 Mo).",
        "Informations générales": "StatutFonctionnaire, Employé de l'ÉtatGroupeA1Date limite de candidature27/06/2025MinistèreMinistère de la JusticeAdministration/OrganismeAdministration judiciaireLieuLuxembourgTâcheTâche complèteNombre de postes vacants1NationalitéÊtre ressortissant UECatégorie de métiersJusticeRéf.F00036213",
        "Qui recrute ?": " L’Administration judiciaire recrute un Analyste Business Intelligence pour le service statistique de la justice.Au sein d’une équipe dynamique, vous participerez à des projets de mise en place d’outils fiables, sûrs et standardisés pour exploiter les informations.Le service statistique de la justice travaille en étroite collaboration avec le service de gestion de projets informatiques ainsi que le Centre des technologies de l’information de l’État (CTIE) pour garantir des services fiables aux différentes entités de l’Administration judiciaire. ",
        "Missions": "L’analyste business intelligence (BI) fera partie du service de statistiques de la justice.Sous la conduite de la Direction de l’information et de la digitalisation, ce service est chargé de la l'ensemble des activités liées à la collecte, au traitement, au stockage, au partage et à l'utilisation des données de l’Administration judiciaire.En tant qu’analyste Business Intelligence (BI) votre mission principale sera:Réaliser de tableaux de bord et rapports sur base des indicateurs définis par les différents services de l’administration judiciaire et des demandes nationales et internationales;Suivre les projets BI en tant qu’analyste et assurer que la solution réalisée corresponde aux besoins et respecte les exigences et contraintes définies;Garantir l’implication du métier dans la conception des solutions BI, depuis l’expression des besoins jusqu’à la livraison afin de construire des tableaux de bord et convertir les données en information;Prendre en charge le développement des nouvelles demandes évolutives et/ou correctives (intégration de nouvelles données, rapports);Préparation des tableaux de bord pour le suivi des activités de la Justice;Assurer la maintenance des tableaux de bord (corrective, y compris la détection de problèmes liés à la qualité de la donnée, ou évolutive), l’analyse des incidents et des demandes de changement(s);Faire évoluer et améliorer les processus et systèmes décisionnels en effectuant de la veille technologique;Travailler en collaboration avec les data analystes et les équipes du CTIE.",
        "Profil": "Compétences techniques Connaissances des systèmes décisionnels ‘Business Intelligence’;Connaissances en matière d’analyse et contrôle de données;Connaissances des bonnes pratiques en data visualisation;Connaissance des outils et méthodes d’analyse, de collecte, de modélisation et de restitution d’information décisionnelle;Maîtriser le français et/ou l’anglais. Compétences comportementales Capacité solide en matière d’analyses, de synthèses et de résolutions des problèmes;Capacité de l’organisation;Capacité de l’initiative et des responsabilités;Capacité de la discrétion et des responsabilités;Capacité de travailler de façon autonome ainsi qu’en équipe;Capacité à proposer des idées, à développer des concepts et à les défendre;Capacité à gérer plusieurs projets simultanément et à respecter les délais dans un environnement dynamique;Être passionné de nouvelles technologies et avoir le sens de l’innovation. Atouts Connaissances des outils de reporting (Qlik Sense, Power BI, etc.);Connaissances en langage d’exploitation de bases de données (SQL);Expérience professionnelle prouvée dans un domaine similaire.",
        "Conditions d’admission": "Le poste peut être brigué sous le statut du fonctionnaire ou de l’employé de l’État. Si vous souhaitez postuler sous le statut du fonctionnaire, vous devrez au préalable avoir réussi l’épreuve d’aptitude générale (EAG). Les candidats ayant réussi à l’EAG restent admissibles aux épreuves spéciales pendant une durée de 5 ans (à compter à partir de la décision de la commission d’examen). Obtenez plus de détails sur lesconditions d'admission des fonctionnaires de l'Étatainsi que sur lesconditions d'admission des employés de l'État. Diplômes Vous êtes titulaire d’un grade ou diplôme délivré par un établissement d’enseignement supérieur reconnu par l’Etat du siège de l’établissement et sanctionnant l’accomplissement avec succès d’un master en informatique, ingénieur ou de son équivalent. Langues Vous répondez aux exigences des connaissances de 3 langues administratives pour le groupe A1. Nationalité Vous êtes ressortissant d’un État membre de l’Union européenne.",
        "Documents à fournir": "Lettre de motivation, copie du diplôme, lettre de réussite à l’épreuve d’aptitude générale (uniquement pour le statut du fonctionnaire : joindre le document complet avec le relevé des notes par test et les annexes) et CV renseignant les informations suivantes: Nom(s) et prénom(s)Numéro d’identification (càd. le numéro de matricule nationale ou, à défaut, la date de naissance)NationalitéAdresse électroniqueListe des établissements d’enseignement fréquentés et leur pays d’implantation (veuillez indiquer le nom complet des établissements, les abréviations n'étant pas permises)Diplômes (veuillez indiquer l'intitulé des diplômes)Expérience professionnelleConnaissances en langues parlées et écrites Pour ce poste, vous devez obligatoirement postuler en ligne via MyGuichet, les candidatures via courriel ou via courrier postal n’étant pas acceptées. Les documents sont à introduire via MyGuichet en format pdf (taille maximale 20 Mo).",
        "Group Classification": "A1",
        "adding_date": "2025-06-13T02:00:16.278932"
    },
    {
        "Title": "Expert en finance digitale (m/f) (réf. E00036230)",
        "Link": "https://govjobs.public.lu/fr/postuler/postes-ouverts/postes-vacants/employes/2025/A1/Juin/20250612-experteenfinancedigitalemfmfrf-373232.html",
        "Education Level": "Master",
        "Job Category": "Finances",
        "Status": "Employé de l'État",
        "Task": "Tâche complète",
        "Ministry": "Ministère des Finances",
        "Administration/Organization": "Département ministériel",
        "Application Deadline": "04/07/2025",
        "Nationality": "Être ressortissant UE",
        "Number of Vacancies": "1",
        "Contract Type": "CDI",
        "Full Description": "Informations générales Statut Employé de l'État Groupe d'indemnité A1 Date limite de candidature 04/07/2025 Ministère Ministère des Finances Administration/Organisme Département ministériel Lieu Luxembourg Tâche Tâche complète Nombre de postes vacants 1 Type de contrat CDI Nationalité Être ressortissant UE Catégorie de métiers Finances Réf. E00036230 Qui recrute ? Ministère des Finances - Département ministériel Missions Veille thématique et réglementaire sur les innovations numériques (fintech, blockchain, actifs numériques, cryptomonnaies, intelligence artificielle…) dans le secteur financier et à l’internationale ; Préparation, élaboration et rédaction de notes et de rapports sur des sujets numériques présentant un intérêt pour la place financière ; Expliquer de manière claire et accessible des concepts techniques à un public non-spécialiste. Interagir avec les parties prenantes concernées du centre financier sur les développements de la finance numérique, identifiant des opportunités pour le Luxembourg ; Participation à l’élaboration et au suivi d’initiatives dans le cadre de partenariats public-privé dans le domaine de la finance digitale et de l’innovation; Disposition à travailler sur des sujets en dehors du domaine direct d'expertise, selon les besoins du service. Profil Compétences techniques Bonne compréhension du cadre réglementaire européen applicable aux innovations financières (MiCA, DORA, etc.) ; Aptitudes de gestion de projets ; Excellentes compétences rédactionnelles; Excellentes capacités d’analyse et de synthèse; Aptitudes à l’écoute et à la communication orale; Capacité à établir et à entretenir un réseau des relations professionnelles ; Habileté à identifier les problématiques et à proposer des solutions; Excellente maîtrise à l’oral et à l’écrit de l’anglais. Compétences comportementales Travail méthodique et rigoureux; Esprit critique développé; Aisance relationelle ; Capacité d’adaptation et réactivité; Respect des délais et atteinte des objectifs; Capacité à fixer les priorités et à organiser le travail; Sens de l’initiative et des responsabilités; Aptitude à travailler de manière autonome ou en équipe; Disponibilité et flexibilité; Fiabilité. Atouts Expérience professionnelle confirmée de quelques années auprès d’un acteur de la place financière. Connaissances du fonctionnement de l’Etat; Connaissances de la finance durable et innovante; Conditions d’admission Poste d'employé de l'État Obtenez plus de détails sur les conditions d'admission des employés de l'État . Diplômes Vous êtes titulaire d’un grade ou diplôme délivré par un établissement d’enseignement supérieur reconnu par l’Etat du siège de l’établissement et sanctionnant l’accomplissement avec succès d’un master ou de son équivalent. Expérience Vous avez une expérience d'au moins 3 ans dans le domaine. Langues Vous répondez aux exigences des connaissances de 3 langues administratives pour le groupe d'indemnité A1. Nationalité Vous êtes ressortissant d’un État membre de l’Union européenne. Documents à fournir Lettre de motivation, copie du diplôme et CV renseignant les informations suivantes: Nom(s) et prénom(s) Numéro d’identification (càd. le numéro de matricule nationale ou, à défaut, la date de naissance) Nationalité Adresse électronique Liste des établissements d’enseignement fréquentés et leur pays d’implantation (veuillez indiquer le nom complet des établissements, les abréviations n'étant pas permises) Diplômes (veuillez indiquer l'intitulé des diplômes) Expérience professionnelle Connaissances en langues parlées et écrites Pour ce poste, vous devez obligatoirement postuler en ligne via MyGuichet, les candidatures via courriel ou via courrier postal n’étant pas acceptées. Les documents sont à introduire via MyGuichet en format pdf (taille maximale 20 Mo).",
        "Informations générales": "StatutEmployé de l'ÉtatGroupe d'indemnitéA1Date limite de candidature04/07/2025MinistèreMinistère des FinancesAdministration/OrganismeDépartement ministérielLieuLuxembourgTâcheTâche complèteNombre de postes vacants1Type de contratCDINationalitéÊtre ressortissant UECatégorie de métiersFinancesRéf.E00036230",
        "Qui recrute ?": " Ministère des Finances - Département ministériel ",
        "Missions": "Veille thématique et réglementaire sur les innovations numériques (fintech, blockchain, actifs numériques, cryptomonnaies, intelligence artificielle…) dans le secteur financier et à l’internationale ;Préparation, élaboration et rédaction de notes et de rapports sur des sujets numériques présentant un intérêt pour la place financière ;Expliquer de manière claire et accessible des concepts techniques à un public non-spécialiste.Interagir avec les parties prenantes concernées du centre financier sur les développements de la finance numérique, identifiant des opportunités pour le Luxembourg ;Participation à l’élaboration et au suivi d’initiatives dans le cadre de partenariats public-privé dans le domaine de la finance digitale et de l’innovation;Disposition à travailler sur des sujets en dehors du domaine direct d'expertise, selon les besoins du service.",
        "Profil": "Compétences techniques Bonne compréhension du cadre réglementaire européen applicable aux innovations financières (MiCA, DORA, etc.) ;Aptitudes de gestion de projets ;Excellentes compétences rédactionnelles;Excellentes capacités d’analyse et de synthèse;Aptitudes à l’écoute et à la communication orale;Capacité à établir et à entretenir un réseau des relations professionnelles ;Habileté à identifier les problématiques et à proposer des solutions;Excellente maîtrise à l’oral et à l’écrit de l’anglais. Compétences comportementales Travail méthodique et rigoureux;Esprit critique développé;Aisance relationelle ;Capacité d’adaptation et réactivité;Respect des délais et atteinte des objectifs;Capacité à fixer les priorités et à organiser le travail;Sens de l’initiative et des responsabilités;Aptitude à travailler de manière autonome ou en équipe;Disponibilité et flexibilité;Fiabilité. Atouts Expérience professionnelle confirmée de quelques années auprès d’un acteur de la place financière.Connaissances du fonctionnement de l’Etat;Connaissances de la finance durable et innovante;",
        "Conditions d’admission": "Poste d'employé de l'État Obtenez plus de détails sur lesconditions d'admission des employés de l'État. Diplômes Vous êtes titulaire d’un grade ou diplôme délivré par un établissement d’enseignement supérieur reconnu par l’Etat du siège de l’établissement et sanctionnant l’accomplissement avec succès d’un master ou de son équivalent. Expérience Vous avez une expérience d'au moins 3 ans dans le domaine. Langues Vous répondez aux exigences des connaissances de 3 langues administratives pour le groupe d'indemnité A1. Nationalité Vous êtes ressortissant d’un État membre de l’Union européenne.",
        "Documents à fournir": "Lettre de motivation, copie du diplôme et CV renseignant les informations suivantes: Nom(s) et prénom(s)Numéro d’identification (càd. le numéro de matricule nationale ou, à défaut, la date de naissance)NationalitéAdresse électroniqueListe des établissements d’enseignement fréquentés et leur pays d’implantation (veuillez indiquer le nom complet des établissements, les abréviations n'étant pas permises)Diplômes (veuillez indiquer l'intitulé des diplômes)Expérience professionnelleConnaissances en langues parlées et écrites Pour ce poste, vous devez obligatoirement postuler en ligne via MyGuichet, les candidatures via courriel ou via courrier postal n’étant pas acceptées. Les documents sont à introduire via MyGuichet en format pdf (taille maximale 20 Mo).",
        "Group Classification": "A1",
        "adding_date": "2025-06-13T02:00:16.279177"
    },
    {
        "Title": "Expert en prix de transfert (m/f) (réf. E00036232) (réf. F00036233)",
        "Link": "https://govjobs.public.lu/fr/postuler/postes-ouverts/postes-vacants/fonctionnaires/2025/A1/Juin/20250612-expertenprixdetransfertmfrfe00-373251.html",
        "Education Level": "Master",
        "Job Category": "Fiscalité",
        "Status": "Fonctionnaire, Employé de l'État",
        "Task": "Tâche complète",
        "Ministry": "Ministère des Finances",
        "Administration/Organization": "Administration des contributions directes",
        "Application Deadline": "27/06/2025",
        "Nationality": "Avoir la nationalité luxembourgeoise",
        "Number of Vacancies": "2",
        "Contract Type": "Admission au stage (fonctionnaire) ou CDI (employé de l’État)",
        "Full Description": "Informations générales Statut Fonctionnaire, Employé de l'État Groupe A1 Date limite de candidature 27/06/2025 Ministère Ministère des Finances Administration/Organisme Administration des contributions directes Lieu Hesperange Tâche Tâche complète Nombre de postes vacants 2 Nationalité Avoir la nationalité luxembourgeoise Catégorie de métiers Fiscalité Réf. F00036233 Qui recrute ? Vous êtes passionné(e) par la fiscalité internationale, vous disposez d’une solide expertise en matière de prix de transfert et vous êtes prêt(e) à relever des défis techniques et stratégiques dans un environnement en constante évolution ? Rejoignez l’Administration des contributions directes et participez à la création d’un centre de compétence novateur en matière de prix de transfert. Dans un contexte de mondialisation croissante et de complexification des opérations transfrontalières, ce nouveau centre de compétence jouera un rôle central dans le renforcement de l’expertise interne et dans l’assurance d’une application cohérente, rigoureuse et équitable des règles en matière de prix de transfert. Ce poste offre une opportunité unique de contribuer activement à l’élaboration d’une approche nationale structurée et à la gestion de dossiers complexes, tout en travaillant en étroite collaboration avec les bureaux d’imposition, les divisions contentieuse et juridique, ainsi que les partenaires internationaux. En participant à la création de ce centre de compétences, vous serez au cœur des enjeux fiscaux actuels, dans un cadre stimulant, où expertise technique, rigueur analytique et esprit de collaboration sont les maîtres-mots. Ce centre de compétence sera composé de 3 à 4 experts issus de parcours divers (fiscalité, finance, audit), animés par un objectif commun : veiller à l’application rigoureuse et équitable des règles TP, tout en fournissant un appui stratégique aux bureaux d’imposition, ainsi qu’aux divisions contentieuse et juridique. Missions Analyse et traitement de dossiers complexes relatifs aux transactions intragroupes; Rédaction, revue critique et validation de rapports de prix de transfert; Conseil et accompagnement des agents des bureaux d’imposition sur les problématiques TP; Assistance technique dans le cadre de procédures contentieuses liées aux ajustements TP; Participation à des contrôles fiscaux ciblés, y compris sur place; Point de contact pour toute communication externe sur l’approche générale en matière TP (p.ex. LTPA); Suivi régulier de l’évolution des pratiques internationales et des techniques de vérification; Contribution active à la documentation, la structuration et la diffusion du savoir-faire au sein de l’ACD; Échanges périodiques avec les autres cellules spécialisées (y compris la division économique) pour assurer une cohérence des approches et partager les retours d’expérience; Déplacements à l’étranger non périodiques dans le cadre de contrôles multilatéraux. Profil Compétences techniques Connaissance approfondie du droit fiscal et/ou de la fiscalité internationale; Solide maîtrise des normes comptables nationales et internationales; Connaissance approfondie des principes de prix de transfert (OCDE, BEPS) et des pratiques de documentation; Maîtrise de l’anglais; Bonne maîtrise de la comptabilité et de l’analyse financière; Très bonne maîtrise d’Excel. Compétences comportementales Sens de l’analyse, de la rigueur et de la synthèse; Très bonnes capacités rédactionnelles; Autonomie et sens du travail collaboratif. Atouts Avoir travaillé sur l’analyse de rapports TP, la mise en œuvre de contrôles fiscaux sur opérations intragroupes, ou l’appui juridique lié à des ajustements TP; Connaissances de logiciels professionnels dans le domaine des prix de transfert. Conditions d’admission Le poste peut être brigué sous le statut du fonctionnaire ou de l’employé de l’État. Si vous souhaitez postuler sous le statut du fonctionnaire, vous devrez au préalable avoir réussi l’épreuve d’aptitude générale (EAG). Les candidats ayant réussi à l’EAG restent admissibles aux épreuves spéciales pendant une durée de 5 ans (à compter à partir de la décision de la commission d’examen). Obtenez plus de détails sur les conditions d'admission des fonctionnaires de l'État ainsi que sur les conditions d'admission des employés de l'État . Diplômes Vous êtes titulaire d’un grade ou diplôme délivré par un établissement d’enseignement supérieur reconnu par l’Etat du siège de l’établissement et sanctionnant l’accomplissement avec succès d’un master dans le domaine droit ou économie avec spécialisation en droit fiscal ou de son équivalent. Expérience Vous avez une expérience d'au moins 3 ans dans le domaine. Langues Vous répondez aux exigences des connaissances de 3 langues administratives pour le groupe A1. Nationalité Vous avez la nationalité luxembourgeoise. Documents à fournir Lettre de motivation, copie du diplôme, lettre de réussite à l’épreuve d’aptitude générale (uniquement pour le statut du fonctionnaire : joindre le document complet avec le relevé des notes par test et les annexes) et CV renseignant les informations suivantes: Nom(s) et prénom(s) Numéro d’identification (càd. le numéro de matricule nationale ou, à défaut, la date de naissance) Nationalité Adresse électronique Liste des établissements d’enseignement fréquentés et leur pays d’implantation (veuillez indiquer le nom complet des établissements, les abréviations n'étant pas permises) Diplômes (veuillez indiquer l'intitulé des diplômes) Expérience professionnelle Connaissances en langues parlées et écrites Pour ce poste, vous devez obligatoirement postuler en ligne via MyGuichet, les candidatures via courriel ou via courrier postal n’étant pas acceptées. Les documents sont à introduire via MyGuichet en format pdf (taille maximale 20 Mo).",
        "Informations générales": "StatutFonctionnaire, Employé de l'ÉtatGroupeA1Date limite de candidature27/06/2025MinistèreMinistère des FinancesAdministration/OrganismeAdministration des contributions directesLieuHesperangeTâcheTâche complèteNombre de postes vacants2NationalitéAvoir la nationalité luxembourgeoiseCatégorie de métiersFiscalitéRéf.F00036233",
        "Qui recrute ?": " Vous êtes passionné(e) par la fiscalité internationale, vous disposez d’une solide expertise en matière de prix de transfert et vous êtes prêt(e) à relever des défis techniques et stratégiques dans un environnement en constante évolution ?Rejoignez l’Administration des contributions directes et participez à la création d’un centre de compétence novateur en matière de prix de transfert.Dans un contexte de mondialisation croissante et de complexification des opérations transfrontalières, ce nouveau centre de compétence jouera un rôle central dans le renforcement de l’expertise interne et dans l’assurance d’une application cohérente, rigoureuse et équitable des règles en matière de prix de transfert.Ce poste offre une opportunité unique de contribuer activement à l’élaboration d’une approche nationale structurée et à la gestion de dossiers complexes, tout en travaillant en étroite collaboration avec les bureaux d’imposition, les divisions contentieuse et juridique, ainsi que les partenaires internationaux.En participant à la création de ce centre de compétences, vous serez au cœur des enjeux fiscaux actuels, dans un cadre stimulant, où expertise technique, rigueur analytique et esprit de collaboration sont les maîtres-mots.Ce centre de compétence sera composé de 3 à 4 experts issus de parcours divers (fiscalité, finance, audit), animés par un objectif commun : veiller à l’application rigoureuse et équitable des règles TP, tout en fournissant un appui stratégique aux bureaux d’imposition, ainsi qu’aux divisions contentieuse et juridique. ",
        "Missions": "Analyse et traitement de dossiers complexes relatifs aux transactions intragroupes;Rédaction, revue critique et validation de rapports de prix de transfert;Conseil et accompagnement des agents des bureaux d’imposition sur les problématiques TP;Assistance technique dans le cadre de procédures contentieuses liées aux ajustements TP;Participation à des contrôles fiscaux ciblés, y compris sur place;Point de contact pour toute communication externe sur l’approche générale en matière TP (p.ex. LTPA);Suivi régulier de l’évolution des pratiques internationales et des techniques de vérification;Contribution active à la documentation, la structuration et la diffusion du savoir-faire au sein de l’ACD;Échanges périodiques avec les autres cellules spécialisées (y compris la division économique) pour assurer une cohérence des approches et partager les retours d’expérience;Déplacements à l’étranger non périodiques dans le cadre de contrôles multilatéraux.",
        "Profil": "Compétences techniques Connaissance approfondie du droit fiscal et/ou de la fiscalité internationale;Solide maîtrise des normes comptables nationales et internationales;Connaissance approfondie des principes de prix de transfert (OCDE, BEPS) et des pratiques de documentation;Maîtrise de l’anglais;Bonne maîtrise de la comptabilité et de l’analyse financière;Très bonne maîtrise d’Excel. Compétences comportementales Sens de l’analyse, de la rigueur et de la synthèse;Très bonnes capacités rédactionnelles;Autonomie et sens du travail collaboratif. Atouts Avoir travaillé sur l’analyse de rapports TP, la mise en œuvre de contrôles fiscaux sur opérations intragroupes, ou l’appui juridique lié à des ajustements TP;Connaissances de logiciels professionnels dans le domaine des prix de transfert.",
        "Conditions d’admission": "Le poste peut être brigué sous le statut du fonctionnaire ou de l’employé de l’État. Si vous souhaitez postuler sous le statut du fonctionnaire, vous devrez au préalable avoir réussi l’épreuve d’aptitude générale (EAG). Les candidats ayant réussi à l’EAG restent admissibles aux épreuves spéciales pendant une durée de 5 ans (à compter à partir de la décision de la commission d’examen). Obtenez plus de détails sur lesconditions d'admission des fonctionnaires de l'Étatainsi que sur lesconditions d'admission des employés de l'État. Diplômes Vous êtes titulaire d’un grade ou diplôme délivré par un établissement d’enseignement supérieur reconnu par l’Etat du siège de l’établissement et sanctionnant l’accomplissement avec succès d’un master dans le domaine droit ou économie avec spécialisation en droit fiscal ou de son équivalent. Expérience Vous avez une expérience d'au moins 3 ans dans le domaine. Langues Vous répondez aux exigences des connaissances de 3 langues administratives pour le groupe A1. Nationalité Vous avez la nationalité luxembourgeoise.",
        "Documents à fournir": "Lettre de motivation, copie du diplôme, lettre de réussite à l’épreuve d’aptitude générale (uniquement pour le statut du fonctionnaire : joindre le document complet avec le relevé des notes par test et les annexes) et CV renseignant les informations suivantes: Nom(s) et prénom(s)Numéro d’identification (càd. le numéro de matricule nationale ou, à défaut, la date de naissance)NationalitéAdresse électroniqueListe des établissements d’enseignement fréquentés et leur pays d’implantation (veuillez indiquer le nom complet des établissements, les abréviations n'étant pas permises)Diplômes (veuillez indiquer l'intitulé des diplômes)Expérience professionnelleConnaissances en langues parlées et écrites Pour ce poste, vous devez obligatoirement postuler en ligne via MyGuichet, les candidatures via courriel ou via courrier postal n’étant pas acceptées. Les documents sont à introduire via MyGuichet en format pdf (taille maximale 20 Mo).",
        "Group Classification": "A1",
        "adding_date": "2025-06-13T02:00:16.279206"
    },
    {
        "Title": "Agent de nettoyage (m/f)",
        "Link": "https://govjobs.public.lu/fr/postuler/postes-ouverts/salaries/2025/B/Juin/20250612-agentdenettoyagemf-372895.html",
        "Job Category": "Technique et infrastructure",
        "Status": "Salarié",
        "Task": "Tâche à temps partiel (75%)",
        "Ministry": "Ministère de l'Éducation nationale, de l'Enfance et de la Jeunesse",
        "Administration/Organization": "École de commerce et de gestion - School of business and management",
        "Application Deadline": "19/06/2025",
        "Number of Vacancies": "1",
        "Contract Type": "CDI",
        "Full Description": "Informations générales Statut Salarié Groupe de salaire B Date limite de candidature 19/06/2025 Ministère Ministère de l'Éducation nationale, de l'Enfance et de la Jeunesse Administration/Organisme École de commerce et de gestion - School of business and management Lieu Luxembourg Tâche Tâche à temps partiel (75%) Nombre de postes vacants 1 Type de contrat CDI Catégorie de métiers Technique et infrastructure Qui recrute ? École de commerce et de gestion - School of business and management Missions Assurer la sécurité sanitaire de l'école; Nettoyage des locaux du bâtiment; Désinfection des outils critiques. Profil Compétences techniques Connaissances approfondies en une des trois langues administratives au moins; Connaissances en matière d'hygiène; Bonne motricité. Compétences comportementales Esprit de travail en équipe; Flexibilité; Rigueur. Atouts Permis de conduire Cat. B. Conditions d’admission Poste de salarié de l'État Obtenez plus de détails sur les conditions d'admission des salariés de l'État . Langues Vous répondez aux exigences des connaissances de 3 langues administratives pour le groupe de salaire B. Nationalité Vous êtes ressortissant d’un État membre de l’Union européenne. Postuler Si vous êtes intéressé par cette fonction, portez-vous candidat jusqu'au 19 juin 2025 et envoyez les documents demandés par courriel à info@ecg.lu ou par courrier postal à l’adresse : Rue Marguerite De Brabant, 21 L-1254 Luxembourg Luxembourg Documents à fournir Lettre de motivation, copie du diplôme et CV renseignant les informations suivantes: Nom(s) et prénom(s) Numéro d’identification (càd. le numéro de matricule nationale ou, à défaut, la date de naissance) Nationalité Adresse électronique Liste des établissements d’enseignement fréquentés et leur pays d’implantation (veuillez indiquer le nom complet des établissements, les abréviations n'étant pas permises) Diplômes (veuillez indiquer l'intitulé des diplômes) Expérience professionnelle Connaissances en langues parlées et écrites Pour ce poste, vous devez obligatoirement postuler via courriel ou via courrier postal, les candidatures via MyGuichet n’étant pas acceptées.",
        "Informations générales": "StatutSalariéGroupe de salaireBDate limite de candidature19/06/2025MinistèreMinistère de l'Éducation nationale, de l'Enfance et de la JeunesseAdministration/OrganismeÉcole de commerce et de gestion - School of business and managementLieuLuxembourgTâcheTâche à temps partiel (75%)Nombre de postes vacants1Type de contratCDICatégorie de métiersTechnique et infrastructure",
        "Qui recrute ?": " École de commerce et de gestion - School of business and management ",
        "Missions": "Assurer la sécurité sanitaire de l'école;Nettoyage des locaux du bâtiment;Désinfection des outils critiques.",
        "Profil": "Compétences techniques Connaissances approfondies en une des trois langues administratives au moins;Connaissances en matière d'hygiène;Bonne motricité. Compétences comportementales Esprit de travail en équipe;Flexibilité;Rigueur. Atouts Permis de conduire Cat. B.",
        "Conditions d’admission": "Poste de salarié de l'État Obtenez plus de détails sur lesconditions d'admission des salariés de l'État. Langues Vous répondez aux exigences des connaissances de 3 langues administratives pour le groupe de salaire B. Nationalité Vous êtes ressortissant d’un État membre de l’Union européenne.",
        "Postuler": "Si vous êtes intéressé par cette fonction, portez-vous candidat jusqu'au 19 juin 2025 et envoyez les documents demandés par courriel àinfo@ecg.luou par courrier postal à l’adresse :Rue Marguerite De Brabant, 21L-1254 LuxembourgLuxembourg",
        "Documents à fournir": "Lettre de motivation, copie du diplôme et CV renseignant les informations suivantes: Nom(s) et prénom(s)Numéro d’identification (càd. le numéro de matricule nationale ou, à défaut, la date de naissance)NationalitéAdresse électroniqueListe des établissements d’enseignement fréquentés et leur pays d’implantation (veuillez indiquer le nom complet des établissements, les abréviations n'étant pas permises)Diplômes (veuillez indiquer l'intitulé des diplômes)Expérience professionnelleConnaissances en langues parlées et écrites Pour ce poste, vous devez obligatoirement postuler via courriel ou via courrier postal, les candidatures via MyGuichet n’étant pas acceptées.",
        "Group Classification": "B",
        "adding_date": "2025-06-13T02:00:16.279278"
    },
    {
        "Title": "Fonctionnaire - sous-groupe administratif (m/f)",
        "Link": "https://govjobs.public.lu/fr/secteur-communal/postes-ouverts/postes-vacants/fonctionnaires/2025/B1/Juin/20250612-fonctionnairedugroupedetraitem-373173.html",
        "Education Level": "Diplôme de fin d’études secondaires ou diplôme de technicien",
        "Status": " Fonctionnaire",
        "Task": "Tâche complète",
        "Application Deadline": "04/07/2025",
        "Nationality": "Avoir la nationalité luxembourgeoise",
        "Number of Vacancies": "1",
        "Contract Type": "CDI",
        "Full Description": "Informations générales Statut Fonctionnaire Groupe de traitement B1 Date limite de candidature 04/07/2025 Commune/Syndicat de communes Administration communale de Käerjeng Circonscription Sud Lieu Käerjeng Service/Département Secrétariat général Tâche Tâche complète Nombre de postes vacants 1 Type de contrat CDI Nationalité Avoir la nationalité luxembourgeoise Détail du poste Pour toute informations complémentaire concernant le poste ou pour postuler, nous vous invitons à visiter le site de l’administration communale de / du syndicat à l’adresse : https://bit.ly/45klwrJ",
        "Informations générales": "StatutFonctionnaireGroupe de traitementB1Date limite de candidature04/07/2025Commune/Syndicat de communesAdministration communale de KäerjengCirconscriptionSudLieuKäerjengService/DépartementSecrétariat généralTâcheTâche complèteNombre de postes vacants1Type de contratCDINationalitéAvoir la nationalité luxembourgeoise",
        "Détail du poste": "Pour toute informations complémentaire concernant le poste ou pour postuler, nous vous invitons à visiter le site de l’administration communale de / du syndicat à l’adresse :https://bit.ly/45klwrJ",
        "Group Classification": "B1",
        "Location": "Sud",
        "adding_date": "2025-06-13T02:00:16.279308"
    },
    {
        "Title": "Project Management Officer (m/f) (réf. M00036225) - Recrutement interne",
        "Link": "https://govjobs.public.lu/fr/postuler/mobilite-interne/changement-administration/2025/A1/Juin/20250612-projectmanagementofficermfrfm0-373170.html",
        "Education Level": "Master",
        "Job Category": "Personnel et Organisation",
        "Status": "Fonctionnaire",
        "Task": "Tâche complète",
        "Ministry": "Ministère de l'Environnement, du Climat et de la Biodiversité",
        "Administration/Organization": "Administration de la gestion de l'eau",
        "Application Deadline": "04/07/2025",
        "Nationality": "Être ressortissant UE",
        "Number of Vacancies": "1",
        "Full Description": "Informations générales Statut Fonctionnaire Groupe de traitement A1 Date limite de candidature 04/07/2025 Ministère Ministère de l'Environnement, du Climat et de la Biodiversité Administration/Organisme Administration de la gestion de l'eau Lieu Esch-sur-Alzette (Belval) Tâche Tâche complète Nombre de postes vacants 1 Nationalité Être ressortissant UE Catégorie de métiers Personnel et Organisation Réf. M00036225 Qui recrute ? Administration de la gestion de l'eau - Service Projet et coordination Administration de la gestion de l'eau Missions Implémenter et suivre le programme de travail de l’administration; Veiller à la cohérence des projets y figurant avec les différents plans de gestion développés par l’administration et les priorités gouvernementales; Accompagner les chefs de projet dans la conduite de leurs projets ainsi que dans l'application de la méthode de gestion de projets; Définir et exécuter les processus de sélection des projets et conseiller la direction; Consolider et présenter les analyses des projets du programme de travail pour la présentation régulière à la direction et au ministère de tutelle; Initier les revues de projet et coordonner l'évaluation des indicateurs de performance des projets; Supporter les équipes dans la résolution des difficultés rencontrées par la recherche de synergies, de coordination et compréhension fine du contexte; Coordonner les différentes unités et services dans l'optique d'une gestion optimale de projets; Faire le lien entre les différentes parties prenantes pour l'atteinte des objectifs de l'administration. Profil Compétences techniques Comprendre la vision et la stratégie de l’administration déclinée à travers le programme de travail; Savoir appliquer l'ensemble des techniques de la gestion de portefeuille de projets; Savoir décliner une stratégie au niveau de l’organisation des projets; Se prévaloir d'une expérience professionnelle confirmée en gestion de projets; Avoir de l'expérience dans le développement et la dispense de formations internes; Maîtriser la suite Microsoft Office; Savoir utiliser de manière avancée les feuilles de calculs afin d’élaborer des matrices d’analyse. Compétences comportementales Organiser et maintenir un échange constructif avec les parties prenantes internes et externes de l’administration et travailler en réseau; Avoir une appétence pour les matières techniques et scientifiques; Savoir fédérer et motiver les parties prenantes internes autour d'un objectif commun; Disposer d'une capacité d'analyse critique et de synthèse; Savoir travailler en équipe avec le PMO existant tout en sachant travailler de façon autonome, proactive, efficace et pragmatique; Montrer de la rigueur et un sens d'organisation pour la conduite simultanée de plusieurs projets ; Savoir gérer les changements et les priorités; Avoir une culture du résultat solidement ancrée. Atouts Avoir une certification en gestion de projet; Avoir une expérience en matière d'organisation administrative et procédurale. Conditions d’admission Diplômes Vous êtes titulaire d’un grade ou diplôme délivré par un établissement d’enseignement supérieur reconnu par l’Etat du siège de l’établissement et sanctionnant l’accomplissement avec succès d’un master en gestion de projets ou de son équivalent. Expérience Vous avez une expérience d'au moins 3 ans dans le domaine. Nationalité Vous êtes ressortissant d’un État membre de l’Union européenne. Documents à fournir Lettre de motivation pour le poste brigué et CV; La lettre de motivation et le CV sont à introduire via MyGuichet en format pdf (taille maximale 20 Mo).",
        "Informations générales": "StatutFonctionnaireGroupe de traitementA1Date limite de candidature04/07/2025MinistèreMinistère de l'Environnement, du Climat et de la BiodiversitéAdministration/OrganismeAdministration de la gestion de l'eauLieuEsch-sur-Alzette (Belval)TâcheTâche complèteNombre de postes vacants1NationalitéÊtre ressortissant UECatégorie de métiersPersonnel et OrganisationRéf.M00036225",
        "Qui recrute ?": "Administration de la gestion de l'eau - Service Projet et coordination",
        "Missions": "Implémenter et suivre le programme de travail de l’administration;Veiller à la cohérence des projets y figurant avec les différents plans de gestion développés par l’administration et les priorités gouvernementales;Accompagner les chefs de projet dans la conduite de leurs projets ainsi que dans l'application de la méthode de gestion de projets;Définir et exécuter les processus de sélection des projets et conseiller la direction;Consolider et présenter les analyses des projets du programme de travail pour la présentation régulière à la direction et au ministère de tutelle;Initier les revues de projet et coordonner l'évaluation des indicateurs de performance des projets;Supporter les équipes dans la résolution des difficultés rencontrées par la recherche de synergies, de coordination et compréhension fine du contexte;Coordonner les différentes unités et services dans l'optique d'une gestion optimale de projets;Faire le lien entre les différentes parties prenantes pour l'atteinte des objectifs de l'administration.",
        "Profil": "Compétences techniques Comprendre la vision et la stratégie de l’administration déclinée à travers le programme de travail;Savoir appliquer l'ensemble des techniques de la gestion de portefeuille de projets;Savoir décliner une stratégie au niveau de l’organisation des projets;Se prévaloir d'une expérience professionnelle confirmée en gestion de projets;Avoir de l'expérience dans le développement et la dispense de formations internes;Maîtriser la suite Microsoft Office;Savoir utiliser de manière avancée les feuilles de calculs afin d’élaborer des matrices d’analyse. Compétences comportementales Organiser et maintenir un échange constructif avec les parties prenantes internes et externes de l’administration et travailler en réseau;Avoir une appétence pour les matières techniques et scientifiques;Savoir fédérer et motiver les parties prenantes internes autour d'un objectif commun;Disposer d'une capacité d'analyse critique et de synthèse;Savoir travailler en équipe avec le PMO existant tout en sachant travailler de façon autonome, proactive, efficace et pragmatique;Montrer de la rigueur et un sens d'organisation pour la conduite simultanée de plusieurs projets ;Savoir gérer les changements et les priorités;Avoir une culture du résultat solidement ancrée. Atouts Avoir une certification en gestion de projet;Avoir une expérience en matière d'organisation administrative et procédurale.",
        "Conditions d’admission": "Diplômes Vous êtes titulaire d’un grade ou diplôme délivré par un établissement d’enseignement supérieur reconnu par l’Etat du siège de l’établissement et sanctionnant l’accomplissement avec succès d’un master en gestion de projets ou de son équivalent. Expérience Vous avez une expérience d'au moins 3 ans dans le domaine. Nationalité Vous êtes ressortissant d’un État membre de l’Union européenne.",
        "Documents à fournir": "Lettre de motivation pour le poste brigué et CV;La lettre de motivation et le CV sont à introduire via MyGuichet en format pdf (taille maximale 20 Mo). ",
        "Group Classification": "A1",
        "adding_date": "2025-06-13T02:00:16.279538"
    },
    {
        "Title": "Administrateur de bases de données (DBA) (m/f)",
        "Link": "https://govjobs.public.lu/fr/postuler/postes-ouverts/postes-vacants/decentralise/2025/A1/Juin/20250612-administrateurdebasesdedonnesd-373346.html",
        "Education Level": "Master",
        "Job Category": "Technologie de l'information et de la communication",
        "Status": "Employé de l'État",
        "Task": "Tâche complète",
        "Ministry": "Ministère de la Santé et de la Sécurité sociale",
        "Administration/Organization": "Centre commun de la sécurité sociale",
        "Application Deadline": "30/06/2025",
        "Nationality": "Être ressortissant UE",
        "Number of Vacancies": "1",
        "Contract Type": "CDI",
        "Full Description": "Informations générales Statut Employé de l'État Groupe d'indemnité A1 Date limite de candidature 30/06/2025 Ministère Ministère de la Santé et de la Sécurité sociale Administration/Organisme Centre commun de la sécurité sociale Lieu Luxembourg-Gare Tâche Tâche complète Nombre de postes vacants 1 Type de contrat CDI Nationalité Être ressortissant UE Catégorie de métiers Technologie de l'information et de la communication Qui recrute ? Le Centre commun de la sécurité sociale (CCSS) est un établissement public en charge notamment : de l'affiliation à la sécurité sociale des salariés, travailleurs indépendants et assurés volontaires ; du calcul, de la perception et du recouvrement des cotisations sociales ; de la répartition des cotisations sociales entre les différentes institutions de la sécurité sociale telles que l’AAA, la CNS, la CNAP. Le CCSS offre un cadre de travail motivant : en mettant en œuvre une mission légale essentielle pour le Luxembourg ; en étant installé dans un bâtiment moderne ; en étant localisé idéalement en face de la gare de Luxembourg à proximité immédiate de tous les moyens de transports, dans un quartier en renouveau et facile d'accès ; en offrant la formation initiale complétée par la formation continue offerte à tous les agents du service public ; en offrant une rémunération en ligne avec les conditions de la Fonction publique. Missions Le département informatique du Centre commun de la sécurité sociale a comme mission principale de fournir aux institutions de la sécurité sociale les applications de gestion spécifiques à la législation en la matière. Vous serez intégrés dans une de nos équipes et vos missions principales seront: La gestion d'un parc de base de données \"Oracle\" au sein d'une équipe déjà existante; Le support DB pour les équipes développeurs; La conduite de projets de migration de grande envergure; La participation dans des projets de sécurisation des données et accès; La sauvegarde et la restauration des données; La mise en place de solutions à haute disponibilité; La surveillance et optimisation des performances; La gestion d'outils pour les environnements de type \"Datawarehouse\". Profil Compétences techniques Expériences dans la gestion de bases de données \"Oracle\"; Maîtrise des modèles relationnels de données; Développements en langage PL/SQL; Automatisation de tâches via des scripts BASH/Python et Ansible; Bonne connaissance des environnements Linux/Shell; Bonnes capacités rédactionnelles et orales en français et en anglais. Compétences comportementales Sens de la rigueur, de la logique et de l'organisation; Sens de l'initiative; Capacité à travailler en autonomie, tout en étant capable de travailler en équipe; Capacité à communiquer et à rédiger. Atouts Notions sur les bases de type \"Datawarehouse\" (datamart, star schéma, etc.); Expériences dans le domaine de la sécurité informatique; Expériences avec l'approche \"DevOps\". Conditions d’admission Poste d'employé de l'État Obtenez plus de détails sur les conditions d'admission des employés de l'État . Diplômes Vous êtes titulaire d’un grade ou diplôme délivré par un établissement d’enseignement supérieur reconnu par l’Etat du siège de l’établissement et sanctionnant l’accomplissement avec succès d’un master en informatique, diplôme d’ingénieur ou de son équivalent. Expérience Vous avez une expérience d'au moins 3 ans dans le domaine. Langues Vous répondez aux exigences des connaissances de 3 langues administratives pour le groupe d'indemnité A1. Nationalité Vous êtes ressortissant d’un État membre de l’Union européenne. Postuler Si vous êtes intéressé par cette fonction, portez-vous candidat jusqu'au 30 juin 2025 et envoyez les documents demandés par courriel à admin.ciss@secu.lu . Documents à fournir Lettre de motivation, copie du diplôme et CV renseignant les informations suivantes: Nom(s) et prénom(s) Numéro d’identification (càd. le numéro de matricule nationale ou, à défaut, la date de naissance) Nationalité Adresse électronique Liste des établissements d’enseignement fréquentés et leur pays d’implantation (veuillez indiquer le nom complet des établissements, les abréviations n'étant pas permises) Diplômes (veuillez indiquer l'intitulé des diplômes) Expérience professionnelle Connaissances en langues parlées et écrites Pour ce poste, vous devez obligatoirement postuler via courriel, les candidatures via MyGuichet ou via courrier postal n’étant pas acceptées.",
        "Informations générales": "StatutEmployé de l'ÉtatGroupe d'indemnitéA1Date limite de candidature30/06/2025MinistèreMinistère de la Santé et de la Sécurité socialeAdministration/OrganismeCentre commun de la sécurité socialeLieuLuxembourg-GareTâcheTâche complèteNombre de postes vacants1Type de contratCDINationalitéÊtre ressortissant UECatégorie de métiersTechnologie de l'information et de la communication",
        "Qui recrute ?": " Le Centre commun de la sécurité sociale (CCSS) est un établissement public en charge notamment :de l'affiliation à la sécurité sociale des salariés, travailleurs indépendants et assurés volontaires ;du calcul, de la perception et du recouvrement des cotisations sociales ;de la répartition des cotisations sociales entre les différentes institutions de la sécurité sociale telles que l’AAA, la CNS, la CNAP.Le CCSS offre un cadre de travail motivant :en mettant en œuvre une mission légale essentielle pour le Luxembourg ;en étant installé dans un bâtiment moderne ;en étant localisé idéalement en face de la gare de Luxembourg à proximité immédiate de tous les moyens de transports, dans un quartier en renouveau et facile d'accès ;en offrant la formation initiale complétée par la formation continue offerte à tous les agents du service public ;en offrant une rémunération en ligne avec les conditions de la Fonction publique. ",
        "Missions": "Le département informatique du Centre commun de la sécurité sociale a comme mission principale de fournir aux institutions de la sécurité sociale les applications de gestion spécifiques à la législation en la matière. Vous serez intégrés dans une de nos équipes et vos missions principales seront:La gestion d'un parc de base de données \"Oracle\" au sein d'une équipe déjà existante;Le support DB pour les équipes développeurs;La conduite de projets de migration de grande envergure;La participation dans des projets de sécurisation des données et accès;La sauvegarde et la restauration des données;La mise en place de solutions à haute disponibilité;La surveillance et optimisation des performances;La gestion d'outils pour les environnements de type \"Datawarehouse\".",
        "Profil": "Compétences techniques Expériences dans la gestion de bases de données \"Oracle\";Maîtrise des modèles relationnels de données;Développements en langage PL/SQL;Automatisation de tâches via des scripts BASH/Python et Ansible;Bonne connaissance des environnements Linux/Shell;Bonnes capacités rédactionnelles et orales en français et en anglais. Compétences comportementales Sens de la rigueur, de la logique et de l'organisation;Sens de l'initiative;Capacité à travailler en autonomie, tout en étant capable de travailler en équipe;Capacité à communiquer et à rédiger. Atouts Notions sur les bases de type \"Datawarehouse\" (datamart, star schéma, etc.);Expériences dans le domaine de la sécurité informatique;Expériences avec l'approche \"DevOps\".",
        "Conditions d’admission": "Poste d'employé de l'État Obtenez plus de détails sur lesconditions d'admission des employés de l'État. Diplômes Vous êtes titulaire d’un grade ou diplôme délivré par un établissement d’enseignement supérieur reconnu par l’Etat du siège de l’établissement et sanctionnant l’accomplissement avec succès d’un master en informatique, diplôme d’ingénieur ou de son équivalent. Expérience Vous avez une expérience d'au moins 3 ans dans le domaine. Langues Vous répondez aux exigences des connaissances de 3 langues administratives pour le groupe d'indemnité A1. Nationalité Vous êtes ressortissant d’un État membre de l’Union européenne.",
        "Postuler": "Si vous êtes intéressé par cette fonction, portez-vous candidat jusqu'au 30 juin 2025 et envoyez les documents demandés par courriel àadmin.ciss@secu.lu.",
        "Documents à fournir": "Lettre de motivation, copie du diplôme et CV renseignant les informations suivantes: Nom(s) et prénom(s)Numéro d’identification (càd. le numéro de matricule nationale ou, à défaut, la date de naissance)NationalitéAdresse électroniqueListe des établissements d’enseignement fréquentés et leur pays d’implantation (veuillez indiquer le nom complet des établissements, les abréviations n'étant pas permises)Diplômes (veuillez indiquer l'intitulé des diplômes)Expérience professionnelleConnaissances en langues parlées et écrites Pour ce poste, vous devez obligatoirement postuler via courriel, les candidatures via MyGuichet ou via courrier postal n’étant pas acceptées.",
        "Group Classification": "A1",
        "adding_date": "2025-06-13T02:00:16.279545"
    },
    {
        "Title": "Chef de projet informatique (m/f)",
        "Link": "https://govjobs.public.lu/fr/postuler/mobilite-interne/carriere-ouverte/fonctionnaires/2025/B1/Juin/20250612-chefdeprojetinformatiquemf-373245.html",
        "Education Level": "Diplôme de fin d’études secondaires ou diplôme de technicien",
        "Job Category": "Technologie de l'information et de la communication",
        "Status": "Fonctionnaire",
        "Task": "Tâche complète",
        "Ministry": "Ministère des Finances",
        "Administration/Organization": "Administration des contributions directes",
        "Application Deadline": "24/06/2025",
        "Nationality": "Avoir la nationalité luxembourgeoise",
        "Number of Vacancies": "1",
        "Full Description": "Informations générales Statut Fonctionnaire Groupe de traitement B1 Date limite de candidature 24/06/2025 Ministère Ministère des Finances Administration/Organisme Administration des contributions directes Lieu Hesperange Tâche Tâche complète Nombre de postes vacants 1 Nationalité Avoir la nationalité luxembourgeoise Catégorie de métiers Technologie de l'information et de la communication Qui recrute ? Administration des contributions directes Missions Analyse et modélisation de processus métiers RTS; Analyste fonctionnel; Participation aux travaux de conception; Rédaction de spécifications fonctionnelles; Veille au respect des spécifications fonctionnelles lors de la mise en oeuvre; Participation à la détermination de l’impact sur les spécifications fonctionnelles par d’éventuels événements externes au projet (p.ex. changements réglementaires); Contribution à la définition de la stratégie de test et à sa mise en oeuvre; Participation à la rédaction de la documentation; Participation à la formation des agents de l’ACD; Maintien d’une communication étroite avec les experts métier et autres intervenants internes et externes (p.ex. autres administrations) de l’ACD; Élaboration et suivi du planning des projets. Profil Compétences techniques Capacité d'analyse et de compréhension de textes législatifs en matière fiscale, notamment RTS; Expérience dans un bureau d’imposition RTS; Expérience dans le domaine de la gestion de projets informatiques; Bonnes capacités rédactionnelles en français. Compétences comportementales Excellentes capacités relationnelles; Excellentes capacités d’écoute; Excellente aptitude de travailler en équipe mais aussi de façon autonome; Excellentes capacités organisationnelles. Conditions d’admission Le poste est réservé au fonctionnaire au service de l’Etat qui compte au moins 10 années de service depuis la date de sa nomination ou de son début de carrière; a réussi à l'examen de promotion de son sous-groupe de traitement initial, si un tel examen est prévu; a suivi et passé avec succès les cours et épreuves du cycle de formation préparatoire au groupe de traitement et d'indemnité supérieur organisés par l'INAP. Documents à fournir Le poste sera occupé en application de la procédure de la carrière ouverte et conformément aux dispositions de la loi du 25 mars 2015 ﬁxant les conditions et modalités de l’accès du fonctionnaire à un groupe de traitement supérieur au sien et de l’employé de l’Etat à un groupe d’indemnité supérieur au sien. Si vous êtes intéressé par cette fonction, portez-vous candidat jusqu’au 12 juillet 2025 avec CV et lettre de motivation en adressant votre demande à Monsieur le Ministre de la Fonction publique - Carrière ouverte - B.P. 1807 L-1018 Luxembourg et en copie par courriel à l'adresse : wingka.yuen@co.etat.lu ainsi qu’au ministre du ressort et au chef d’administration dont fait partie le fonctionnaire.",
        "Informations générales": "StatutFonctionnaireGroupe de traitementB1Date limite de candidature24/06/2025MinistèreMinistère des FinancesAdministration/OrganismeAdministration des contributions directesLieuHesperangeTâcheTâche complèteNombre de postes vacants1NationalitéAvoir la nationalité luxembourgeoiseCatégorie de métiersTechnologie de l'information et de la communication",
        "Qui recrute ?": " Administration des contributions directes ",
        "Missions": "Analyse et modélisation de processus métiers RTS;Analyste fonctionnel;Participation aux travaux de conception;Rédaction de spécifications fonctionnelles;Veille au respect des spécifications fonctionnelles lors de la mise en oeuvre;Participation à la détermination de l’impact sur les spécifications fonctionnelles par d’éventuels événements externes au projet (p.ex. changements réglementaires);Contribution à la définition de la stratégie de test et à sa mise en oeuvre;Participation à la rédaction de la documentation;Participation à la formation des agents de l’ACD;Maintien d’une communication étroite avec les experts métier et autres intervenants internes et externes (p.ex. autres administrations) de l’ACD;Élaboration et suivi du planning des projets.",
        "Profil": "Compétences techniques Capacité d'analyse et de compréhension de textes législatifs en matière fiscale, notamment RTS;Expérience dans un bureau d’imposition RTS;Expérience dans le domaine de la gestion de projets informatiques;Bonnes capacités rédactionnelles en français. Compétences comportementales Excellentes capacités relationnelles;Excellentes capacités d’écoute;Excellente aptitude de travailler en équipe mais aussi de façon autonome;Excellentes capacités organisationnelles.",
        "Conditions d’admission": "Le poste est réservé au fonctionnaire au service de l’Etat qui compte au moins 10 années de service depuis la date de sa nomination ou de son début de carrière;a réussi à l'examen de promotion de son sous-groupe de traitement initial, si un tel examen est prévu;a suivi et passé avec succès les cours et épreuves du cycle de formation préparatoire au groupe de traitement et d'indemnité supérieur organisés par l'INAP.",
        "Documents à fournir": "Le poste sera occupé en application de la procédure de la carrière ouverte et conformément aux dispositions de la loi du 25 mars 2015 ﬁxant les conditions et modalités de l’accès du fonctionnaire à un groupe de traitement supérieur au sien et de l’employé de l’Etat à un groupe d’indemnité supérieur au sien. Si vous êtes intéressé par cette fonction, portez-vous candidat jusqu’au12 juillet 2025avec CV et lettre de motivation en adressant votre demande à Monsieur le Ministre de la Fonction publique- Carrière ouverte -B.P. 1807L-1018 Luxembourget en copie par courriel à l'adresse :wingka.yuen@co.etat.lu ainsi qu’au ministre du ressort et au chef d’administration dont fait partie le fonctionnaire.",
        "Group Classification": "B1",
        "adding_date": "2025-06-13T02:00:16.279569"
    },
    {
        "Title": "Métrologue et analyste de données (m/f) (réf. E00036215) (réf. F00036216)",
        "Link": "https://govjobs.public.lu/fr/postuler/postes-ouverts/postes-vacants/fonctionnaires/2025/A1/Juin/20250612-mtrologueetanalystededonnesmfr-372931.html",
        "Education Level": "Master",
        "Job Category": "Agriculture et Viticulture",
        "Status": "Fonctionnaire, Employé de l'État",
        "Task": "Tâche complète",
        "Ministry": "Ministère de l'Agriculture, de l'Alimentation et de la Viticulture",
        "Administration/Organization": "Administration luxembourgeoise vétérinaire et alimentaire",
        "Application Deadline": "27/06/2025",
        "Nationality": "Être ressortissant UE",
        "Number of Vacancies": "1",
        "Contract Type": "Admission au stage (fonctionnaire) ou CDI (employé de l’État)",
        "Full Description": "Informations générales Statut Fonctionnaire, Employé de l'État Groupe A1 Date limite de candidature 27/06/2025 Ministère Ministère de l'Agriculture, de l'Alimentation et de la Viticulture Administration/Organisme Administration luxembourgeoise vétérinaire et alimentaire Lieu Dudelange Tâche Tâche complète Nombre de postes vacants 1 Nationalité Être ressortissant UE Catégorie de métiers Agriculture et Viticulture Réf. F00036216 Qui recrute ? L'Administration luxembourgeoise vétérinaire et alimentaire (ALVA) a été créée en 2022 par le regroupement, au sein d'une administration unique, de la majeure partie des organes de contrôle de la chaîne alimentaire. Les missions de l'ALVA sont définies dans la loi du 8 septembre 2022 portant création et organisation de l'Administration luxembourgeoise vétérinaire et alimentaire. Lors de la mise en place du gouvernement actuel à la fin de l’année 2023, il avait été décidé de poursuivre la réforme de consolidation entamée par le gouvernement précédent dans le domaine du contrôle de la chaîne alimentaire avec la création de la nouvelle Administration luxembourgeoise vétérinaire et alimentaire (ALVA). Dans ce cadre, le gouvernement avait décidé que le Service de surveillance alimentaire (SSA) du Laboratoire national de santé (LNS), serait transféré vers l'ALVA afin de le fusionner avec le Laboratoire de médecine vétérinaire de l’État (LMVE). Cette fusion, effective depuis le 1er janvier 2025, a donné naissance au laboratoire vétérinaire et alimentaire (LVA), une division de l’ALVA placée sous la tutelle du ministère de l’Agriculture, de l’Alimentation et de la Viticulture. Elle constitue la dernière étape visant à centraliser l’ensemble du contrôle de la chaîne alimentaire, couvrant à la fois l’inspection, la surveillance et les analyses de laboratoire, sous l’autorité d’un seul ministère. Missions En tant que Métrologue et analyste de données, vous assurez la coordination, la supervision et la planification des activités de métrologie du laboratoire à Dudelange, en garantissant le bon fonctionnement quotidien et la conformité aux objectifs définis par la direction et le chef de division du laboratoire. Tâches prinicipales: Vous pilotez et encadrez l'ensemble de la métrologie du laboratoire de l'ALVA à Dudelange; Vous assurez le contrôle et la vérification régulière des équipements du laboratoire tels que les balances, thermomètres, masses de travail, pipettes/dispenseurs et enceintes; Vous établissez et maintenez à jour la documentation interne de métrologie en conformément à la norme ISO 17025; Vous identifiez les non conformités et veillez à la traçabilité des réclamations; Vous administrez les programmes informatiques utilisés en métrologie (par exemple Saveris) et gérez les droits d'accès du personnel; Vous organisez et suivez les vérifications et étalonnages réalisés par des prestataires externes et évaluez la qualité des fournisseurs; Vous assurez la gestion du parc d’instruments de la métrologie, planifiez les vérifications et pilotez le budget associé; Vous conseillez et assistez es services techniques dans le suivi métrologique de leurs équipements spécifiques (robots, etc.); Vos contribuez activement à la mise en œuvre, au maintien et amélioration du système qualité; Vous participez aux audits internes et externes et veillez à l’actualisation permanente de la documentation et à la conformité règlementaire; Vous réalisez des analyses de risque en métrologie et proposez des actions correctives et préventives adaptées; Vous animez les réunions métrologiques et contribuez à la communication interne et externe  du laboratoire;  Vous participez à la préparation  de la revue de direction en collaboration avec le service qualité; Vous organisez, analysez et exploitez les données du laboratoire en vue de leur utilisation (dossiers de vérification, divers rapports, etc.); Vous apportez votre expertise méthodologique et statistique; Vous développez, rédigez et évaluez des requêtes; Vous réalisez des analyses critiques, justifiez les résultats et proposez des pistes d’amélioration; Vous participez à l’activité métrologique de l’ALVA à Strassen. Profil Compétences techniques Vous êtes capable d’appliquer et de développer les procédures et processus internes; Vous conduisez des projets en assurant leur structuration, leur planification et leur suivi; Vous maîtrisez les outils de bureautique courants; Vous exploitez les logiciels et progiciels métiers mis en place au sein du le service; À court terme vous devrez être capable d’utiliser SharePoint et les outils de la gestion électronique des documents; A moyen terme, vous devrez connaître et appliquer la législation et la réglementation relatives à la métrologie; À terme, vous devrez maîtriser la norme ISO/IEC 17025:2017. Compétences comportementales Vous assurez la gestion des projets en définissant des objectifs clairs, en organisant les ressources et en garantissant la réalisation des livrables dans les délais et le cadre prévus; Vous savez gérer les priorités en organisant vos activités de manière méthodique et en vous adaptant aux imprévus pour préserver la qualité du travail réalisé; Vous faites preuve de rigueur en veillant à l’exactitude des données, au respect des procédures et à la fiabilité des résultats communiqués; Vous travaillez de manière collaborative en favorisant les échanges, le partage des connaissances et l’entraide au sein de l’équipe pour atteindre les objectifs communs. Atouts La connaissance de la norme ISO/IEC 17025:2017 constitue un avantage; La maîtrise de la législation et de la réglementation en lien avec la métrologie est également un atout. Conditions d’admission Le poste peut être brigué sous le statut du fonctionnaire ou de l’employé de l’État. Si vous souhaitez postuler sous le statut du fonctionnaire, vous devrez au préalable avoir réussi l’épreuve d’aptitude générale (EAG). Les candidats ayant réussi à l’EAG restent admissibles aux épreuves spéciales pendant une durée de 5 ans (à compter à partir de la décision de la commission d’examen). Obtenez plus de détails sur les conditions d'admission des fonctionnaires de l'État ainsi que sur les conditions d'admission des employés de l'État . Diplômes Vous êtes titulaire d’un grade ou diplôme délivré par un établissement d’enseignement supérieur reconnu par l’Etat du siège de l’établissement et sanctionnant l’accomplissement avec succès d’un master dans un domaine scientifique ou de son équivalent. Expérience Vous avez une expérience d'au moins 3 ans dans le domaine. Langues Vous répondez aux exigences des connaissances de 3 langues administratives pour le groupe A1. Une dispense de deux des trois langues administratives peut être accordée sous certaines conditions. Nationalité Vous êtes ressortissant d’un État membre de l’Union européenne. Documents à fournir Lettre de motivation, copie du diplôme, lettre de réussite à l’épreuve d’aptitude générale (uniquement pour le statut du fonctionnaire : joindre le document complet avec le relevé des notes par test et les annexes) et CV renseignant les informations suivantes: Nom(s) et prénom(s) Numéro d’identification (càd. le numéro de matricule nationale ou, à défaut, la date de naissance) Nationalité Adresse électronique Liste des établissements d’enseignement fréquentés et leur pays d’implantation (veuillez indiquer le nom complet des établissements, les abréviations n'étant pas permises) Diplômes (veuillez indiquer l'intitulé des diplômes) Expérience professionnelle Connaissances en langues parlées et écrites Pour ce poste, vous devez obligatoirement postuler en ligne via MyGuichet, les candidatures via courriel ou via courrier postal n’étant pas acceptées. Les documents sont à introduire via MyGuichet en format pdf (taille maximale 20 Mo).",
        "Informations générales": "StatutFonctionnaire, Employé de l'ÉtatGroupeA1Date limite de candidature27/06/2025MinistèreMinistère de l'Agriculture, de l'Alimentation et de la ViticultureAdministration/OrganismeAdministration luxembourgeoise vétérinaire et alimentaireLieuDudelangeTâcheTâche complèteNombre de postes vacants1NationalitéÊtre ressortissant UECatégorie de métiersAgriculture et ViticultureRéf.F00036216",
        "Qui recrute ?": " L'Administration luxembourgeoise vétérinaire et alimentaire (ALVA) a été créée en 2022 par le regroupement, au sein d'une administration unique, de la majeure partie des organes de contrôle de la chaîne alimentaire.Les missions de l'ALVA sont définies dans la loi du 8 septembre 2022 portant création et organisation de l'Administration luxembourgeoise vétérinaire et alimentaire.Lors de la mise en place du gouvernement actuel à la fin de l’année 2023, il avait été décidé de poursuivre la réforme de consolidation entamée par le gouvernement précédent dans le domaine du contrôle de la chaîne alimentaire avec la création de la nouvelle Administration luxembourgeoise vétérinaire et alimentaire (ALVA).Dans ce cadre, le gouvernement avait décidé que le Service de surveillance alimentaire (SSA) du Laboratoire national de santé (LNS), serait transféré vers l'ALVA afin de le fusionner avec le Laboratoire de médecine vétérinaire de l’État (LMVE).Cette fusion, effective depuis le 1er janvier 2025, a donné naissance au laboratoire vétérinaire et alimentaire (LVA), une division de l’ALVA placée sous la tutelle du ministère de l’Agriculture, de l’Alimentation et de la Viticulture. Elle constitue la dernière étape visant à centraliser l’ensemble du contrôle de la chaîne alimentaire, couvrant à la fois l’inspection, la surveillance et les analyses de laboratoire, sous l’autorité d’un seul ministère. ",
        "Missions": "En tant que Métrologue et analyste de données, vous assurez la coordination, la supervision et la planification des activités de métrologie du laboratoire à Dudelange, en garantissant le bon fonctionnement quotidien et la conformité aux objectifs définis par la direction et le chef de division du laboratoire. Tâches prinicipales:Vous pilotez et encadrez l'ensemble de la métrologie du laboratoire de l'ALVA à Dudelange;Vous assurez le contrôle et la vérification régulière des équipements du laboratoire tels que les balances, thermomètres, masses de travail, pipettes/dispenseurs et enceintes;Vous établissez et maintenez à jour la documentation interne de métrologie en conformément à la norme ISO 17025;Vous identifiez les non conformités et veillez à la traçabilité des réclamations;Vous administrez les programmes informatiques utilisés en métrologie (par exemple Saveris) et gérez les droits d'accès du personnel;Vous organisez et suivez les vérifications et étalonnages réalisés par des prestataires externes et évaluez la qualité des fournisseurs;Vous assurez la gestion du parc d’instruments de la métrologie, planifiez les vérifications et pilotez le budget associé;Vous conseillez et assistez es services techniques dans le suivi métrologique de leurs équipements spécifiques (robots, etc.);Vos contribuez activement à la mise en œuvre, au maintien et amélioration du système qualité;Vous participez aux audits internes et externes et veillez à l’actualisation permanente de la documentation et à la conformité règlementaire;Vous réalisez des analyses de risque en métrologie et proposez des actions correctives et préventives adaptées;Vous animez les réunions métrologiques et contribuez à la communication interne et externe  du laboratoire;  Vous participez à la préparation  de la revue de direction en collaboration avec le service qualité;Vous organisez, analysez et exploitez les données du laboratoire en vue de leur utilisation (dossiers de vérification, divers rapports, etc.);Vous apportez votre expertise méthodologique et statistique;Vous développez, rédigez et évaluez des requêtes;Vous réalisez des analyses critiques, justifiez les résultats et proposez des pistes d’amélioration;Vous participez à l’activité métrologique de l’ALVA à Strassen.",
        "Profil": "Compétences techniques Vous êtes capable d’appliquer et de développer les procédures et processus internes;Vous conduisez des projets en assurant leur structuration, leur planification et leur suivi;Vous maîtrisez les outils de bureautique courants;Vous exploitez les logiciels et progiciels métiers mis en place au sein du le service;À court terme vous devrez être capable d’utiliser SharePoint et les outils de la gestion électronique des documents;A moyen terme, vous devrez connaître et appliquer la législation et la réglementation relatives à la métrologie;À terme, vous devrez maîtriser la norme ISO/IEC 17025:2017. Compétences comportementales Vous assurez la gestion des projets en définissant des objectifs clairs, en organisant les ressources et en garantissant la réalisation des livrables dans les délais et le cadre prévus;Vous savez gérer les priorités en organisant vos activités de manière méthodique et en vous adaptant aux imprévus pour préserver la qualité du travail réalisé;Vous faites preuve de rigueur en veillant à l’exactitude des données, au respect des procédures et à la fiabilité des résultats communiqués;Vous travaillez de manière collaborative en favorisant les échanges, le partage des connaissances et l’entraide au sein de l’équipe pour atteindre les objectifs communs. Atouts La connaissance de la norme ISO/IEC 17025:2017 constitue un avantage;La maîtrise de la législation et de la réglementation en lien avec la métrologie est également un atout.",
        "Conditions d’admission": "Le poste peut être brigué sous le statut du fonctionnaire ou de l’employé de l’État. Si vous souhaitez postuler sous le statut du fonctionnaire, vous devrez au préalable avoir réussi l’épreuve d’aptitude générale (EAG). Les candidats ayant réussi à l’EAG restent admissibles aux épreuves spéciales pendant une durée de 5 ans (à compter à partir de la décision de la commission d’examen). Obtenez plus de détails sur lesconditions d'admission des fonctionnaires de l'Étatainsi que sur lesconditions d'admission des employés de l'État. Diplômes Vous êtes titulaire d’un grade ou diplôme délivré par un établissement d’enseignement supérieur reconnu par l’Etat du siège de l’établissement et sanctionnant l’accomplissement avec succès d’un master dans un domaine scientifique ou de son équivalent. Expérience Vous avez une expérience d'au moins 3 ans dans le domaine. Langues Vous répondez aux exigences des connaissances de 3 langues administratives pour le groupe A1. Une dispense de deux des trois langues administratives peut être accordée sous certaines conditions. Nationalité Vous êtes ressortissant d’un État membre de l’Union européenne.",
        "Documents à fournir": "Lettre de motivation, copie du diplôme, lettre de réussite à l’épreuve d’aptitude générale (uniquement pour le statut du fonctionnaire : joindre le document complet avec le relevé des notes par test et les annexes) et CV renseignant les informations suivantes: Nom(s) et prénom(s)Numéro d’identification (càd. le numéro de matricule nationale ou, à défaut, la date de naissance)NationalitéAdresse électroniqueListe des établissements d’enseignement fréquentés et leur pays d’implantation (veuillez indiquer le nom complet des établissements, les abréviations n'étant pas permises)Diplômes (veuillez indiquer l'intitulé des diplômes)Expérience professionnelleConnaissances en langues parlées et écrites Pour ce poste, vous devez obligatoirement postuler en ligne via MyGuichet, les candidatures via courriel ou via courrier postal n’étant pas acceptées. Les documents sont à introduire via MyGuichet en format pdf (taille maximale 20 Mo).",
        "Group Classification": "A1",
        "adding_date": "2025-06-13T02:00:16.279608"
    },
    {
        "Title": "Analyste Business Intelligence (m/f) (réf. M00036214) - Recrutement interne",
        "Link": "https://govjobs.public.lu/fr/postuler/mobilite-interne/changement-administration/2025/A1/Juin/20250612-analystebusinessintelligencemf-372922.html",
        "Education Level": "Master",
        "Job Category": "Justice",
        "Status": "Fonctionnaire",
        "Task": "Tâche complète",
        "Ministry": "Ministère de la Justice",
        "Administration/Organization": "Administration judiciaire",
        "Application Deadline": "27/06/2025",
        "Nationality": "Être ressortissant UE",
        "Number of Vacancies": "1",
        "Full Description": "Informations générales Statut Fonctionnaire Groupe de traitement A1 Date limite de candidature 27/06/2025 Ministère Ministère de la Justice Administration/Organisme Administration judiciaire Lieu Luxembourg Tâche Tâche complète Nombre de postes vacants 1 Nationalité Être ressortissant UE Catégorie de métiers Justice Réf. M00036214 Qui recrute ? L’Administration judiciaire recrute un Analyste Business Intelligence pour le service statistique de la justice. Au sein d’une équipe dynamique, vous participerez à des projets de mise en place d’outils fiables, sûrs et standardisés pour exploiter les informations. Le service statistique de la justice travaille en étroite collaboration avec le service de gestion de projets informatiques ainsi que le Centre des technologies de l’information de l’État (CTIE) pour garantir des services fiables aux différentes entités de l’Administration judiciaire. Missions L’analyste business intelligence (BI) fera partie du service de statistiques de la justice. Sous la conduite de la Direction de l’information et de la digitalisation, ce service est chargé de la l'ensemble des activités liées à la collecte, au traitement, au stockage, au partage et à l'utilisation des données de l’Administration judiciaire. En tant qu’analyste Business Intelligence (BI) votre mission principale sera: Réaliser de tableaux de bord et rapports sur base des indicateurs définis par les différents services de l’administration judiciaire et des demandes nationales et internationales; Suivre les projets BI en tant qu’analyste et assurer que la solution réalisée corresponde aux besoins et respecte les exigences et contraintes définies; Garantir l’implication du métier dans la conception des solutions BI, depuis l’expression des besoins jusqu’à la livraison afin de construire des tableaux de bord et convertir les données en information; Prendre en charge le développement des nouvelles demandes évolutives et/ou correctives (intégration de nouvelles données, rapports); Préparation des tableaux de bord pour le suivi des activités de la Justice; Assurer la maintenance des tableaux de bord (corrective, y compris la détection de problèmes liés à la qualité de la donnée, ou évolutive), l’analyse des incidents et des demandes de changement(s); Faire évoluer et améliorer les processus et systèmes décisionnels en effectuant de la veille technologique; Travailler en collaboration avec les data analystes et les équipes du CTIE. Profil Compétences techniques Connaissances des systèmes décisionnels ‘Business Intelligence’; Connaissances en matière d’analyse et contrôle de données; Connaissances des bonnes pratiques en data visualisation; Connaissance des outils et méthodes d’analyse, de collecte, de modélisation et de restitution d’information décisionnelle; Maîtriser le français et/ou l’anglais. Compétences comportementales Capacité solide en matière d’analyses, de synthèses et de résolutions des problèmes; Capacité de l’organisation; Capacité de l’initiative et des responsabilités; Capacité de la discrétion et des responsabilités; Capacité de travailler de façon autonome ainsi qu’en équipe; Capacité à proposer des idées, à développer des concepts et à les défendre; Capacité à gérer plusieurs projets simultanément et à respecter les délais dans un environnement dynamique; Être passionné de nouvelles technologies et avoir le sens de l’innovation. Atouts Connaissances des outils de reporting (Qlik Sense, Power BI, etc.); Connaissances en langage d’exploitation de bases de données (SQL); Expérience professionnelle prouvée dans un domaine similaire. Conditions d’admission Diplômes Vous êtes titulaire d’un grade ou diplôme délivré par un établissement d’enseignement supérieur reconnu par l’Etat du siège de l’établissement et sanctionnant l’accomplissement avec succès d’un master en informatique, ingénieur ou de son équivalent. Nationalité Vous êtes ressortissant d’un État membre de l’Union européenne. Documents à fournir Lettre de motivation pour le poste brigué et CV; La lettre de motivation et le CV sont à introduire via MyGuichet en format pdf (taille maximale 20 Mo).",
        "Informations générales": "StatutFonctionnaireGroupe de traitementA1Date limite de candidature27/06/2025MinistèreMinistère de la JusticeAdministration/OrganismeAdministration judiciaireLieuLuxembourgTâcheTâche complèteNombre de postes vacants1NationalitéÊtre ressortissant UECatégorie de métiersJusticeRéf.M00036214",
        "Qui recrute ?": " L’Administration judiciaire recrute un Analyste Business Intelligence pour le service statistique de la justice.Au sein d’une équipe dynamique, vous participerez à des projets de mise en place d’outils fiables, sûrs et standardisés pour exploiter les informations.Le service statistique de la justice travaille en étroite collaboration avec le service de gestion de projets informatiques ainsi que le Centre des technologies de l’information de l’État (CTIE) pour garantir des services fiables aux différentes entités de l’Administration judiciaire. ",
        "Missions": "L’analyste business intelligence (BI) fera partie du service de statistiques de la justice.Sous la conduite de la Direction de l’information et de la digitalisation, ce service est chargé de la l'ensemble des activités liées à la collecte, au traitement, au stockage, au partage et à l'utilisation des données de l’Administration judiciaire.En tant qu’analyste Business Intelligence (BI) votre mission principale sera:Réaliser de tableaux de bord et rapports sur base des indicateurs définis par les différents services de l’administration judiciaire et des demandes nationales et internationales;Suivre les projets BI en tant qu’analyste et assurer que la solution réalisée corresponde aux besoins et respecte les exigences et contraintes définies;Garantir l’implication du métier dans la conception des solutions BI, depuis l’expression des besoins jusqu’à la livraison afin de construire des tableaux de bord et convertir les données en information;Prendre en charge le développement des nouvelles demandes évolutives et/ou correctives (intégration de nouvelles données, rapports);Préparation des tableaux de bord pour le suivi des activités de la Justice;Assurer la maintenance des tableaux de bord (corrective, y compris la détection de problèmes liés à la qualité de la donnée, ou évolutive), l’analyse des incidents et des demandes de changement(s);Faire évoluer et améliorer les processus et systèmes décisionnels en effectuant de la veille technologique;Travailler en collaboration avec les data analystes et les équipes du CTIE.",
        "Profil": "Compétences techniques Connaissances des systèmes décisionnels ‘Business Intelligence’;Connaissances en matière d’analyse et contrôle de données;Connaissances des bonnes pratiques en data visualisation;Connaissance des outils et méthodes d’analyse, de collecte, de modélisation et de restitution d’information décisionnelle;Maîtriser le français et/ou l’anglais. Compétences comportementales Capacité solide en matière d’analyses, de synthèses et de résolutions des problèmes;Capacité de l’organisation;Capacité de l’initiative et des responsabilités;Capacité de la discrétion et des responsabilités;Capacité de travailler de façon autonome ainsi qu’en équipe;Capacité à proposer des idées, à développer des concepts et à les défendre;Capacité à gérer plusieurs projets simultanément et à respecter les délais dans un environnement dynamique;Être passionné de nouvelles technologies et avoir le sens de l’innovation. Atouts Connaissances des outils de reporting (Qlik Sense, Power BI, etc.);Connaissances en langage d’exploitation de bases de données (SQL);Expérience professionnelle prouvée dans un domaine similaire.",
        "Conditions d’admission": "Diplômes Vous êtes titulaire d’un grade ou diplôme délivré par un établissement d’enseignement supérieur reconnu par l’Etat du siège de l’établissement et sanctionnant l’accomplissement avec succès d’un master en informatique, ingénieur ou de son équivalent. Nationalité Vous êtes ressortissant d’un État membre de l’Union européenne.",
        "Documents à fournir": "Lettre de motivation pour le poste brigué et CV;La lettre de motivation et le CV sont à introduire via MyGuichet en format pdf (taille maximale 20 Mo). ",
        "Group Classification": "A1",
        "adding_date": "2025-06-13T02:00:16.279691"
    },
    {
        "Title": "Gestionnaire de finances et de loyers (m/f) (réf. E00036210) (réf. F00036211)",
        "Link": "https://govjobs.public.lu/fr/postuler/postes-ouverts/postes-vacants/fonctionnaires/2025/B1/Juin/20250611-gestionnairedefinancesetdeloye-372880.html",
        "Education Level": "Diplôme de fin d’études secondaires ou diplôme de technicien",
        "Job Category": "Finances",
        "Status": "Fonctionnaire, Employé de l'État",
        "Task": "Tâche à temps partiel (75%)",
        "Ministry": "Ministère de la Famille, des Solidarités, du Vivre ensemble et de l'Accueil",
        "Administration/Organization": "Office national de l'accueil",
        "Application Deadline": "26/06/2025",
        "Nationality": "Être ressortissant UE",
        "Number of Vacancies": "1",
        "Contract Type": "Admission au stage (fonctionnaire) ou CDI (employé de l’État)",
        "Full Description": "Informations générales Statut Fonctionnaire, Employé de l'État Groupe B1 Date limite de candidature 26/06/2025 Ministère Ministère de la Famille, des Solidarités, du Vivre ensemble et de l'Accueil Administration/Organisme Office national de l'accueil Lieu Luxembourg-Kirchberg Tâche Tâche à temps partiel (75%) Nombre de postes vacants 1 Nationalité Être ressortissant UE Catégorie de métiers Finances Réf. F00036211 Qui recrute ? Office national de l'accueil Missions Gestion des recettes d’indemnités d’occupation des bénéficiaires de la protection internationale: Enregistrement comptable; Gestion des rappels et recouvrement des créances; Suivi administratif en collaboration avec le service juridique et le service suivi social. Profil Compétences techniques Disposer de connaissances de l’outil informatique BOB50; Avoir une excellente maîtrise des outils bureautiques (Word, Excel, etc); Avoir d’excellentes capacités rédactionnelles et de synthèse; Maîtriser parfaitement l'anglais. Compétences comportementales Avoir le sens de l’organisation; Être capable de travailler de façon autonome et être rigoureux; Avoir une aisance dans les contacts et la capacité de travailler en équipe; Être discret et fiable. Conditions d’admission Le poste peut être brigué sous le statut du fonctionnaire ou de l’employé de l’État. Si vous souhaitez postuler sous le statut du fonctionnaire, vous devrez au préalable avoir réussi l’épreuve d’aptitude générale (EAG). Les candidats ayant réussi à l’EAG restent admissibles aux épreuves spéciales pendant une durée de 5 ans (à compter à partir de la décision de la commission d’examen). Obtenez plus de détails sur les conditions d'admission des fonctionnaires de l'État ainsi que sur les conditions d'admission des employés de l'État . Diplômes Vous êtes détenteur soit du diplôme luxembourgeois de fin d’études secondaires, soit du diplôme luxembourgeois de fin d’études secondaires techniques division administrative et commerciale, soit d’un certificat sanctionnant des études reconnues équivalentes. Langues Vous répondez aux exigences des connaissances de 3 langues administratives pour le groupe B1. Nationalité Vous êtes ressortissant d’un État membre de l’Union européenne. Documents à fournir Lettre de motivation, copie du diplôme, lettre de réussite à l’épreuve d’aptitude générale (uniquement pour le statut du fonctionnaire : joindre le document complet avec le relevé des notes par test et les annexes) et CV renseignant les informations suivantes: Nom(s) et prénom(s) Numéro d’identification (càd. le numéro de matricule nationale ou, à défaut, la date de naissance) Nationalité Adresse électronique Liste des établissements d’enseignement fréquentés et leur pays d’implantation (veuillez indiquer le nom complet des établissements, les abréviations n'étant pas permises) Diplômes (veuillez indiquer l'intitulé des diplômes) Expérience professionnelle Connaissances en langues parlées et écrites Pour ce poste, vous devez obligatoirement postuler en ligne via MyGuichet, les candidatures via courriel ou via courrier postal n’étant pas acceptées. Les documents sont à introduire via MyGuichet en format pdf (taille maximale 20 Mo).",
        "Informations générales": "StatutFonctionnaire, Employé de l'ÉtatGroupeB1Date limite de candidature26/06/2025MinistèreMinistère de la Famille, des Solidarités, du Vivre ensemble et de l'AccueilAdministration/OrganismeOffice national de l'accueilLieuLuxembourg-KirchbergTâcheTâche à temps partiel (75%)Nombre de postes vacants1NationalitéÊtre ressortissant UECatégorie de métiersFinancesRéf.F00036211",
        "Qui recrute ?": " Office national de l'accueil ",
        "Missions": "Gestion des recettes d’indemnités d’occupation des bénéficiaires de la protection internationale:Enregistrement comptable;Gestion des rappels et recouvrement des créances;Suivi administratif en collaboration avec le service juridique et le service suivi social.",
        "Profil": "Compétences techniques Disposer de connaissances de l’outil informatique BOB50;Avoir une excellente maîtrise des outils bureautiques (Word, Excel, etc);Avoir d’excellentes capacités rédactionnelles et de synthèse;Maîtriser parfaitement l'anglais. Compétences comportementales Avoir le sens de l’organisation;Être capable de travailler de façon autonome et être rigoureux;Avoir une aisance dans les contacts et la capacité de travailler en équipe;Être discret et fiable.",
        "Conditions d’admission": "Le poste peut être brigué sous le statut du fonctionnaire ou de l’employé de l’État. Si vous souhaitez postuler sous le statut du fonctionnaire, vous devrez au préalable avoir réussi l’épreuve d’aptitude générale (EAG). Les candidats ayant réussi à l’EAG restent admissibles aux épreuves spéciales pendant une durée de 5 ans (à compter à partir de la décision de la commission d’examen). Obtenez plus de détails sur lesconditions d'admission des fonctionnaires de l'Étatainsi que sur lesconditions d'admission des employés de l'État. Diplômes Vous êtes détenteur soit du diplôme luxembourgeois de fin d’études secondaires, soit du diplôme luxembourgeois de fin d’études secondaires techniques division administrative et commerciale, soit d’un certificat sanctionnant des études reconnues équivalentes. Langues Vous répondez aux exigences des connaissances de 3 langues administratives pour le groupe B1. Nationalité Vous êtes ressortissant d’un État membre de l’Union européenne.",
        "Documents à fournir": "Lettre de motivation, copie du diplôme, lettre de réussite à l’épreuve d’aptitude générale (uniquement pour le statut du fonctionnaire : joindre le document complet avec le relevé des notes par test et les annexes) et CV renseignant les informations suivantes: Nom(s) et prénom(s)Numéro d’identification (càd. le numéro de matricule nationale ou, à défaut, la date de naissance)NationalitéAdresse électroniqueListe des établissements d’enseignement fréquentés et leur pays d’implantation (veuillez indiquer le nom complet des établissements, les abréviations n'étant pas permises)Diplômes (veuillez indiquer l'intitulé des diplômes)Expérience professionnelleConnaissances en langues parlées et écrites Pour ce poste, vous devez obligatoirement postuler en ligne via MyGuichet, les candidatures via courriel ou via courrier postal n’étant pas acceptées. Les documents sont à introduire via MyGuichet en format pdf (taille maximale 20 Mo).",
        "Group Classification": "B1",
        "adding_date": "2025-06-13T02:00:16.279714"
    },
    {
        "Title": "Educateur diplomé (m/f) (réf. F00036229)",
        "Link": "https://govjobs.public.lu/fr/postuler/postes-ouverts/postes-vacants/fonctionnaires/2025/B1/Juin/20250612-educateurdiplommfmfrff00036229-373193.html",
        "Education Level": "Diplôme de fin d’études secondaires ou diplôme de technicien",
        "Job Category": "Education et Formation tout au long de la vie",
        "Status": "Fonctionnaire",
        "Task": "Tâche complète",
        "Ministry": "Ministère de l'Éducation nationale, de l'Enfance et de la Jeunesse",
        "Administration/Organization": "Centre de logopédie (Centre pour le développement des compétences langagières, auditives et communicatives)",
        "Application Deadline": "19/06/2025",
        "Nationality": "Être ressortissant UE",
        "Number of Vacancies": "1",
        "Contract Type": "CDI",
        "Full Description": "Informations générales Statut Fonctionnaire Groupe de traitement B1 Date limite de candidature 19/06/2025 Ministère Ministère de l'Éducation nationale, de l'Enfance et de la Jeunesse Administration/Organisme Centre de logopédie (Centre pour le développement des compétences langagières, auditives et communicatives) Lieu Strassen Tâche Tâche complète Nombre de postes vacants 1 Type de contrat CDI Nationalité Être ressortissant UE Catégorie de métiers Education et Formation tout au long de la vie Réf. F00036229 Qui recrute ? Centre de logopédie (Centre pour le développement des compétences langagières, auditives et communicatives) Missions La planification et la mise en œuvre d'une prise en charge spécialisée en fonction des besoins éducatifs des élèves ainsi que l’accueil, l’encadrement et l’accompagnement de groupes d’enfants; La concertation au sein de l'équipe pluridisciplinaire du CL et la participation aux réunions de service; Le conseil des parents dans les sujets ayant trait à l'éducation de leur enfant; La documentation des prises en charge spécialisées et la réalisation d'autres tâches administratives liées à l'activité; L'organisation et l'encadrement d'activités récréatives, culturelles et sportives, ainsi que l'élaboration et le déroulement des projets socio-éducatifs. Profil Compétences techniques Savoir organiser le fonctionnement et assurer la conduite d'une classe ou un groupe d'élève; Maîtriser les technologies de l'information et de la communication, savoir se servir des médias et outils didactiques. Compétences comportementales Être capable de travailler en autonomie et en groupe; Compétences en communication et coopération; Réflexion sur son propre travail; Faire preuve de conscience professionnelle et avoir le sens des responsabilités. Flexibilité. Atouts Avoir de l'expérience dans le travail avec des enfants à besoins spécifiques. Conditions d’admission Le poste est réservé aux lauréats de l’examen-concours Les candidats ayant réussi à la partie générale de l’examen-concours restent admissibles aux épreuves spéciales pendant une durée de 5 ans (à compter à partir de la décision de la commission d’examen). Les candidats postulant au poste vacant devront participer à une épreuve spéciale organisée par l’administration qui recrute. Obtenez plus de détails sur les conditions d'admission des fonctionnaires de l'État . Diplômes Vous êtes détenteur soit du diplôme luxembourgeois de fin d’études secondaires techniques, division des professions de santé et des professions sociales, section de la formation de l’éducateur ou de son équivalent Langues Vous répondez aux exigences des connaissances de 3 langues administratives pour le groupe de traitement B1. Nationalité Vous êtes ressortissant d’un État membre de l’Union européenne. Documents à fournir Lettre de motivation, copie du diplôme, lettre de réussite à l’examen-concours (document complet avec le relevé des notes par test et les annexes) et CV renseignant les informations suivantes: Nom(s) et prénom(s) Numéro d’identification (càd. le numéro de matricule nationale ou, à défaut, la date de naissance) Nationalité Adresse électronique Liste des établissements d’enseignement fréquentés et leur pays d’implantation (veuillez indiquer le nom complet des établissements, les abréviations n'étant pas permises) Diplômes (veuillez indiquer l'intitulé des diplômes) Expérience professionnelle Connaissances en langues parlées et écrites Pour ce poste, vous devez obligatoirement postuler en ligne via MyGuichet, les candidatures via courriel ou via courrier postal n’étant pas acceptées. Les documents sont à introduire via MyGuichet en format pdf (taille maximale 20 Mo).",
        "Informations générales": "StatutFonctionnaireGroupe de traitementB1Date limite de candidature19/06/2025MinistèreMinistère de l'Éducation nationale, de l'Enfance et de la JeunesseAdministration/OrganismeCentre de logopédie (Centre pour le développement des compétences langagières, auditives et communicatives)LieuStrassenTâcheTâche complèteNombre de postes vacants1Type de contratCDINationalitéÊtre ressortissant UECatégorie de métiersEducation et Formation tout au long de la vieRéf.F00036229",
        "Qui recrute ?": " Centre de logopédie (Centre pour le développement des compétences langagières, auditives et communicatives) ",
        "Missions": "La planification et la mise en œuvre d'une prise en charge spécialisée en fonction des besoins éducatifs des élèves ainsi que l’accueil, l’encadrement et l’accompagnement de groupes d’enfants;La concertation au sein de l'équipe pluridisciplinaire du CL et la participation aux réunions de service;Le conseil des parents dans les sujets ayant trait à l'éducation de leur enfant;La documentation des prises en charge spécialisées et la réalisation d'autres tâches administratives liées à l'activité;L'organisation et l'encadrement d'activités récréatives, culturelles et sportives, ainsi que l'élaboration et le déroulement des projets socio-éducatifs.",
        "Profil": "Compétences techniques Savoir organiser le fonctionnement et assurer la conduite d'une classe ou un groupe d'élève;Maîtriser les technologies de l'information et de la communication, savoir se servir des médias et outils didactiques. Compétences comportementales Être capable de travailler en autonomie et en groupe;Compétences en communication et coopération;Réflexion sur son propre travail;Faire preuve de conscience professionnelle et avoir le sens des responsabilités.Flexibilité. Atouts Avoir de l'expérience dans le travail avec des enfants à besoins spécifiques.",
        "Conditions d’admission": "Le poste est réservé aux lauréats de l’examen-concours Les candidats ayant réussi à la partie générale de l’examen-concours restent admissibles aux épreuves spéciales pendant une durée de 5 ans (à compter à partir de la décision de la commission d’examen). Les candidats postulant au poste vacant devront participer à une épreuve spéciale organisée par l’administration qui recrute. Obtenez plus de détails sur lesconditions d'admission des fonctionnaires de l'État. Diplômes Vous êtes détenteur soit du diplôme luxembourgeois de fin d’études secondaires techniques, division des professions de santé et des professions sociales, section de la formation de l’éducateur ou de son équivalent Langues Vous répondez aux exigences des connaissances de 3 langues administratives pour le groupe de traitement B1. Nationalité Vous êtes ressortissant d’un État membre de l’Union européenne.",
        "Documents à fournir": "Lettre de motivation, copie du diplôme, lettre de réussite à l’examen-concours (document complet avec le relevé des notes par test et les annexes) et CV renseignant les informations suivantes: Nom(s) et prénom(s)Numéro d’identification (càd. le numéro de matricule nationale ou, à défaut, la date de naissance)NationalitéAdresse électroniqueListe des établissements d’enseignement fréquentés et leur pays d’implantation (veuillez indiquer le nom complet des établissements, les abréviations n'étant pas permises)Diplômes (veuillez indiquer l'intitulé des diplômes)Expérience professionnelleConnaissances en langues parlées et écrites Pour ce poste, vous devez obligatoirement postuler en ligne via MyGuichet, les candidatures via courriel ou via courrier postal n’étant pas acceptées. Les documents sont à introduire via MyGuichet en format pdf (taille maximale 20 Mo).",
        "Group Classification": "B1",
        "adding_date": "2025-06-13T02:00:16.279721"
    },
    {
        "Title": "Administrateur Azure AD & AD on-premise (m/f) (réf. E00036228)",
        "Link": "https://govjobs.public.lu/fr/postuler/postes-ouverts/postes-vacants/employes/2025/A2/Juin/20250612-administrateurazureadadonpremi-373183.html",
        "Education Level": "Bachelor",
        "Job Category": "Technologie de l'information et de la communication",
        "Status": "Employé de l'État",
        "Task": "Tâche complète",
        "Ministry": "Ministère de la Digitalisation",
        "Administration/Organization": "Centre des technologies de l'information de l'État",
        "Application Deadline": "11/07/2025",
        "Nationality": "Être ressortissant UE",
        "Number of Vacancies": "1",
        "Contract Type": "CDI",
        "Full Description": "Informations générales Statut Employé de l'État Groupe d'indemnité A2 Date limite de candidature 11/07/2025 Ministère Ministère de la Digitalisation Administration/Organisme Centre des technologies de l'information de l'État Lieu Luxembourg-Neudorf Tâche Tâche complète Nombre de postes vacants 1 Type de contrat CDI Nationalité Être ressortissant UE Catégorie de métiers Technologie de l'information et de la communication Réf. E00036228 Qui recrute ? Le Centre des technologies de l'information de l'État (CTIE) est l'administration luxembourgeoise en charge des services IT pour le gouvernement, les ministères et les administrations luxembourgeoises et un des acteurs centraux en matière d'eGovernment. Nos services couvrent tous les domaines IT, découvrez nos missions sur notre site internet https://ctie.gouvernement.lu/fr/l-administration.html . Nous offrons : un environnement technologique varié et favorable à l’innovation ; des projets d’envergure nationale / européenne au service des citoyens ; des projets centrés sur les utilisateurs ; une atmosphère collégiale, dynamique et multilingue ; une administration qui valorise les compétences des collaborateurs et encourage la mobilité interne. Missions Vous intégrerez la cellule « Services d’Identité» de la division Systèmes distribué et Bureautique. Cette équipe multinationale et multi compétence est en charge de l’infrastructure Aciive Directory mais aussi des services Cloud Azure. Vos missions seront : Gérer et améliorer l’infrastructure Active Directory du CTIE, y compris les services de fédération Active Directory (ADFS) et les autorités de certification (ADCS); Synchroniser les utilisateurs via MS Entra Connect; Analyser, concevoir et standardiser les stratégies globales pour les services cloud mentionnés; Mettre en œuvre les politiques de sécurité conformément à la politique SMSI du CTIE, et rédiger les documents et manuels de procédures nécessaires pour s’y conformer; Implémenter la sécurité en suivant les recommandations de sécurité fournie par des organismes tiers reconnus et/ou de l’éditeur; Administrer Entra ID et effectuer les tâches nécessitant le rôle de « Global Admin »; Collaborer avec les autres administrations pour répondre à leurs besoins en matière d’infrastructure Windows; Gérer les incidents et les demandes de service liés à l’environnement géré par l’équipe. Profil Compétences techniques Connaissances avancées dans l’administration des plateformes On Premises Active Directory; Connaissances avancées dans l’administration et la gestion de Entra ID (Azure AD); Maîtrise des environnements Windows Server, incluant la configuration, la gestion et le dépannage, ainsi qu’une connaissance des technologies associées telles que ADFS, ADCS, DFS, etc; Expertise en sécurité informatique; Connaissance d’outils d’audit tels que ManageEngine, Varonis, PingCastle ou autres; Connaissances des réseaux et infrastructures d’entreprises; Gestion de l’infrastructure suivant la méthodologie ITIL. Compétences comportementales Polyvalence, Esprit d’équipe mais capacité à travailler en toute autonomie; Capacité d'analyse structurée; Approche méthodologique; Capacité d'organisation et de communication; Précision dans l'exécution des travaux; Très bonne capacité rédactionnelle. Atouts Connaissances d’autres produits Microsoft tels que SQL Server, SCOM, DSC; Connaissances générales sur les principes d’authentifications moderne type ADFS; Connaissance d’un ou plusieurs langages de Scripting (Idéalement PowerShell). Conditions d’admission Poste d'employé de l'État Obtenez plus de détails sur les conditions d'admission des employés de l'État . Diplômes Vous êtes titulaire d’un grade ou diplôme délivré par un établissement d’enseignement supérieur reconnu par l’Etat du siège de l’établissement et sanctionnant l’accomplissement avec succès d’un bachelor en informatique ou de son équivalent. Expérience Vous avez une expérience d'au moins 3 ans dans le domaine. Langues Vous répondez aux exigences des connaissances de 3 langues administratives pour le groupe d'indemnité A2. Une dispense de deux des trois langues administratives peut être accordée sous certaines conditions. Nationalité Vous êtes ressortissant d’un État membre de l’Union européenne. Documents à fournir Lettre de motivation, copie du diplôme et CV renseignant les informations suivantes: Nom(s) et prénom(s) Numéro d’identification (càd. le numéro de matricule nationale ou, à défaut, la date de naissance) Nationalité Adresse électronique Liste des établissements d’enseignement fréquentés et leur pays d’implantation (veuillez indiquer le nom complet des établissements, les abréviations n'étant pas permises) Diplômes (veuillez indiquer l'intitulé des diplômes) Expérience professionnelle Connaissances en langues parlées et écrites Pour ce poste, vous devez obligatoirement postuler en ligne via MyGuichet, les candidatures via courriel ou via courrier postal n’étant pas acceptées. Les documents sont à introduire via MyGuichet en format pdf (taille maximale 20 Mo).",
        "Informations générales": "StatutEmployé de l'ÉtatGroupe d'indemnitéA2Date limite de candidature11/07/2025MinistèreMinistère de la DigitalisationAdministration/OrganismeCentre des technologies de l'information de l'ÉtatLieuLuxembourg-NeudorfTâcheTâche complèteNombre de postes vacants1Type de contratCDINationalitéÊtre ressortissant UECatégorie de métiersTechnologie de l'information et de la communicationRéf.E00036228",
        "Qui recrute ?": "Le Centre des technologies de l'information de l'État (CTIE) est l'administration luxembourgeoise en charge des services IT pour le gouvernement, les ministères et les administrations luxembourgeoises et un des acteurs centraux en matière d'eGovernment.Nos services couvrent tous les domaines IT, découvrez nos missions sur notre site internethttps://ctie.gouvernement.lu/fr/l-administration.html.Nous offrons :un environnement technologique varié et favorable à l’innovation ;des projets d’envergure nationale / européenne au service des citoyens ;des projets centrés sur les utilisateurs ;une atmosphère collégiale, dynamique et multilingue ;une administration qui valorise les compétences des collaborateurs et encourage la mobilité interne.",
        "Missions": "Vous intégrerez la cellule « Services d’Identité» de la division Systèmes distribué et Bureautique.Cette équipe multinationale et multi compétence est en charge de l’infrastructure Aciive Directory mais aussi des services Cloud Azure. Vos missions seront :Gérer et améliorer l’infrastructure Active Directory du CTIE, y compris les services de fédération Active Directory (ADFS) et les autorités de certification (ADCS);Synchroniser les utilisateurs via MS Entra Connect;Analyser, concevoir et standardiser les stratégies globales pour les services cloud mentionnés;Mettre en œuvre les politiques de sécurité conformément à la politique SMSI du CTIE, et rédiger les documents et manuels de procédures nécessaires pour s’y conformer;Implémenter la sécurité en suivant les recommandations de sécurité fournie par des organismes tiers reconnus et/ou de l’éditeur;Administrer Entra ID et effectuer les tâches nécessitant le rôle de « Global Admin »;Collaborer avec les autres administrations pour répondre à leurs besoins en matière d’infrastructure Windows;Gérer les incidents et les demandes de service liés à l’environnement géré par l’équipe.",
        "Profil": "Compétences techniques Connaissances avancées dans l’administration des plateformes On Premises Active Directory;Connaissances avancées dans l’administration et la gestion de Entra ID (Azure AD);Maîtrise des environnements Windows Server, incluant la configuration, la gestion et le dépannage, ainsi qu’une connaissance des technologies associées telles que ADFS, ADCS, DFS, etc;Expertise en sécurité informatique;Connaissance d’outils d’audit tels que ManageEngine, Varonis, PingCastle ou autres;Connaissances des réseaux et infrastructures d’entreprises;Gestion de l’infrastructure suivant la méthodologie ITIL. Compétences comportementales Polyvalence, Esprit d’équipe mais capacité à travailler en toute autonomie;Capacité d'analyse structurée;Approche méthodologique;Capacité d'organisation et de communication;Précision dans l'exécution des travaux;Très bonne capacité rédactionnelle. Atouts Connaissances d’autres produits Microsoft tels que SQL Server, SCOM, DSC;Connaissances générales sur les principes d’authentifications moderne type ADFS;Connaissance d’un ou plusieurs langages de Scripting (Idéalement PowerShell).",
        "Conditions d’admission": "Poste d'employé de l'État Obtenez plus de détails sur lesconditions d'admission des employés de l'État. Diplômes Vous êtes titulaire d’un grade ou diplôme délivré par un établissement d’enseignement supérieur reconnu par l’Etat du siège de l’établissement et sanctionnant l’accomplissement avec succès d’un bachelor en informatique ou de son équivalent. Expérience Vous avez une expérience d'au moins 3 ans dans le domaine. Langues Vous répondez aux exigences des connaissances de 3 langues administratives pour le groupe d'indemnité A2. Une dispense de deux des trois langues administratives peut être accordée sous certaines conditions. Nationalité Vous êtes ressortissant d’un État membre de l’Union européenne.",
        "Documents à fournir": "Lettre de motivation, copie du diplôme et CV renseignant les informations suivantes: Nom(s) et prénom(s)Numéro d’identification (càd. le numéro de matricule nationale ou, à défaut, la date de naissance)NationalitéAdresse électroniqueListe des établissements d’enseignement fréquentés et leur pays d’implantation (veuillez indiquer le nom complet des établissements, les abréviations n'étant pas permises)Diplômes (veuillez indiquer l'intitulé des diplômes)Expérience professionnelleConnaissances en langues parlées et écrites Pour ce poste, vous devez obligatoirement postuler en ligne via MyGuichet, les candidatures via courriel ou via courrier postal n’étant pas acceptées. Les documents sont à introduire via MyGuichet en format pdf (taille maximale 20 Mo).",
        "Group Classification": "A2",
        "adding_date": "2025-06-13T02:00:16.279728"
    },
    {
        "Title": "Expert en prix de transfert (m/f) (réf. M00036234) - Recrutement interne",
        "Link": "https://govjobs.public.lu/fr/postuler/mobilite-interne/changement-administration/2025/A1/Juin/20250612-expertenprixdetransfertmfrfm00-373254.html",
        "Education Level": "Master",
        "Job Category": "Fiscalité",
        "Status": "Fonctionnaire",
        "Task": "Tâche complète",
        "Ministry": "Ministère des Finances",
        "Administration/Organization": "Administration des contributions directes",
        "Application Deadline": "27/06/2025",
        "Nationality": "Avoir la nationalité luxembourgeoise",
        "Number of Vacancies": "2",
        "Full Description": "Informations générales Statut Fonctionnaire Groupe de traitement A1 Date limite de candidature 27/06/2025 Ministère Ministère des Finances Administration/Organisme Administration des contributions directes Lieu Hesperange Tâche Tâche complète Nombre de postes vacants 2 Nationalité Avoir la nationalité luxembourgeoise Catégorie de métiers Fiscalité Réf. M00036234 Qui recrute ? Vous êtes passionné(e) par la fiscalité internationale, vous disposez d’une solide expertise en matière de prix de transfert et vous êtes prêt(e) à relever des défis techniques et stratégiques dans un environnement en constante évolution ? Rejoignez l’Administration des contributions directes et participez à la création d’un centre de compétence novateur en matière de prix de transfert. Dans un contexte de mondialisation croissante et de complexification des opérations transfrontalières, ce nouveau centre de compétence jouera un rôle central dans le renforcement de l’expertise interne et dans l’assurance d’une application cohérente, rigoureuse et équitable des règles en matière de prix de transfert. Ce poste offre une opportunité unique de contribuer activement à l’élaboration d’une approche nationale structurée et à la gestion de dossiers complexes, tout en travaillant en étroite collaboration avec les bureaux d’imposition, les divisions contentieuse et juridique, ainsi que les partenaires internationaux. En participant à la création de ce centre de compétences, vous serez au cœur des enjeux fiscaux actuels, dans un cadre stimulant, où expertise technique, rigueur analytique et esprit de collaboration sont les maîtres-mots. Ce centre de compétence sera composé de 3 à 4 experts issus de parcours divers (fiscalité, finance, audit), animés par un objectif commun : veiller à l’application rigoureuse et équitable des règles TP, tout en fournissant un appui stratégique aux bureaux d’imposition, ainsi qu’aux divisions contentieuse et juridique. Missions Analyse et traitement de dossiers complexes relatifs aux transactions intragroupes; Rédaction, revue critique et validation de rapports de prix de transfert; Conseil et accompagnement des agents des bureaux d’imposition sur les problématiques TP; Assistance technique dans le cadre de procédures contentieuses liées aux ajustements TP; Participation à des contrôles fiscaux ciblés, y compris sur place; Point de contact pour toute communication externe sur l’approche générale en matière TP (p.ex. LTPA); Suivi régulier de l’évolution des pratiques internationales et des techniques de vérification; Contribution active à la documentation, la structuration et la diffusion du savoir-faire au sein de l’ACD; Échanges périodiques avec les autres cellules spécialisées (y compris la division économique) pour assurer une cohérence des approches et partager les retours d’expérience; Déplacements à l’étranger non périodiques dans le cadre de contrôles multilatéraux. Profil Compétences techniques Connaissance approfondie du droit fiscal et/ou de la fiscalité internationale; Solide maîtrise des normes comptables nationales et internationales; Connaissance approfondie des principes de prix de transfert (OCDE, BEPS) et des pratiques de documentation; Maîtrise de l’anglais; Bonne maîtrise de la comptabilité et de l’analyse financière; Très bonne maîtrise d’Excel. Compétences comportementales Sens de l’analyse, de la rigueur et de la synthèse; Très bonnes capacités rédactionnelles; Autonomie et sens du travail collaboratif. Atouts Avoir travaillé sur l’analyse de rapports TP, la mise en œuvre de contrôles fiscaux sur opérations intragroupes, ou l’appui juridique lié à des ajustements TP; Connaissances de logiciels professionnels dans le domaine des prix de transfert. Conditions d’admission Diplômes Vous êtes titulaire d’un grade ou diplôme délivré par un établissement d’enseignement supérieur reconnu par l’Etat du siège de l’établissement et sanctionnant l’accomplissement avec succès d’un master dans le domaine droit ou économie avec spécialisation en droit fiscal ou de son équivalent. Expérience Vous avez une expérience d'au moins 3 ans dans le domaine. Nationalité Vous avez la nationalité luxembourgeoise. Documents à fournir Lettre de motivation pour le poste brigué et CV; La lettre de motivation et le CV sont à introduire via MyGuichet en format pdf (taille maximale 20 Mo).",
        "Informations générales": "StatutFonctionnaireGroupe de traitementA1Date limite de candidature27/06/2025MinistèreMinistère des FinancesAdministration/OrganismeAdministration des contributions directesLieuHesperangeTâcheTâche complèteNombre de postes vacants2NationalitéAvoir la nationalité luxembourgeoiseCatégorie de métiersFiscalitéRéf.M00036234",
        "Qui recrute ?": " Vous êtes passionné(e) par la fiscalité internationale, vous disposez d’une solide expertise en matière de prix de transfert et vous êtes prêt(e) à relever des défis techniques et stratégiques dans un environnement en constante évolution ?Rejoignez l’Administration des contributions directes et participez à la création d’un centre de compétence novateur en matière de prix de transfert.Dans un contexte de mondialisation croissante et de complexification des opérations transfrontalières, ce nouveau centre de compétence jouera un rôle central dans le renforcement de l’expertise interne et dans l’assurance d’une application cohérente, rigoureuse et équitable des règles en matière de prix de transfert.Ce poste offre une opportunité unique de contribuer activement à l’élaboration d’une approche nationale structurée et à la gestion de dossiers complexes, tout en travaillant en étroite collaboration avec les bureaux d’imposition, les divisions contentieuse et juridique, ainsi que les partenaires internationaux.En participant à la création de ce centre de compétences, vous serez au cœur des enjeux fiscaux actuels, dans un cadre stimulant, où expertise technique, rigueur analytique et esprit de collaboration sont les maîtres-mots.Ce centre de compétence sera composé de 3 à 4 experts issus de parcours divers (fiscalité, finance, audit), animés par un objectif commun : veiller à l’application rigoureuse et équitable des règles TP, tout en fournissant un appui stratégique aux bureaux d’imposition, ainsi qu’aux divisions contentieuse et juridique. ",
        "Missions": "Analyse et traitement de dossiers complexes relatifs aux transactions intragroupes;Rédaction, revue critique et validation de rapports de prix de transfert;Conseil et accompagnement des agents des bureaux d’imposition sur les problématiques TP;Assistance technique dans le cadre de procédures contentieuses liées aux ajustements TP;Participation à des contrôles fiscaux ciblés, y compris sur place;Point de contact pour toute communication externe sur l’approche générale en matière TP (p.ex. LTPA);Suivi régulier de l’évolution des pratiques internationales et des techniques de vérification;Contribution active à la documentation, la structuration et la diffusion du savoir-faire au sein de l’ACD;Échanges périodiques avec les autres cellules spécialisées (y compris la division économique) pour assurer une cohérence des approches et partager les retours d’expérience;Déplacements à l’étranger non périodiques dans le cadre de contrôles multilatéraux.",
        "Profil": "Compétences techniques Connaissance approfondie du droit fiscal et/ou de la fiscalité internationale;Solide maîtrise des normes comptables nationales et internationales;Connaissance approfondie des principes de prix de transfert (OCDE, BEPS) et des pratiques de documentation;Maîtrise de l’anglais;Bonne maîtrise de la comptabilité et de l’analyse financière;Très bonne maîtrise d’Excel. Compétences comportementales Sens de l’analyse, de la rigueur et de la synthèse;Très bonnes capacités rédactionnelles;Autonomie et sens du travail collaboratif. Atouts Avoir travaillé sur l’analyse de rapports TP, la mise en œuvre de contrôles fiscaux sur opérations intragroupes, ou l’appui juridique lié à des ajustements TP;Connaissances de logiciels professionnels dans le domaine des prix de transfert.",
        "Conditions d’admission": "Diplômes Vous êtes titulaire d’un grade ou diplôme délivré par un établissement d’enseignement supérieur reconnu par l’Etat du siège de l’établissement et sanctionnant l’accomplissement avec succès d’un master dans le domaine droit ou économie avec spécialisation en droit fiscal ou de son équivalent. Expérience Vous avez une expérience d'au moins 3 ans dans le domaine. Nationalité Vous avez la nationalité luxembourgeoise.",
        "Documents à fournir": "Lettre de motivation pour le poste brigué et CV;La lettre de motivation et le CV sont à introduire via MyGuichet en format pdf (taille maximale 20 Mo). ",
        "Group Classification": "A1",
        "adding_date": "2025-06-13T02:00:16.279910"
    },
    {
        "Title": "Administrateur Azure AD & AD on-premise (m/f) (réf. E00036227)",
        "Link": "https://govjobs.public.lu/fr/postuler/postes-ouverts/postes-vacants/employes/2025/A1/Juin/20250612-administrateurazureadadonpremi-373182.html",
        "Education Level": "Master",
        "Job Category": "Technologie de l'information et de la communication",
        "Status": "Employé de l'État",
        "Task": "Tâche complète",
        "Ministry": "Ministère de la Digitalisation",
        "Administration/Organization": "Centre des technologies de l'information de l'État",
        "Application Deadline": "11/07/2025",
        "Nationality": "Être ressortissant UE",
        "Number of Vacancies": "1",
        "Contract Type": "CDI",
        "Full Description": "Informations générales Statut Employé de l'État Groupe d'indemnité A1 Date limite de candidature 11/07/2025 Ministère Ministère de la Digitalisation Administration/Organisme Centre des technologies de l'information de l'État Lieu Luxembourg-Neudorf Tâche Tâche complète Nombre de postes vacants 1 Type de contrat CDI Nationalité Être ressortissant UE Catégorie de métiers Technologie de l'information et de la communication Réf. E00036227 Qui recrute ? Le Centre des technologies de l'information de l'État (CTIE) est l'administration luxembourgeoise en charge des services IT pour le gouvernement, les ministères et les administrations luxembourgeoises et un des acteurs centraux en matière d'eGovernment. Nos services couvrent tous les domaines IT, découvrez nos missions sur notre site internet https://ctie.gouvernement.lu/fr/l-administration.html . Nous offrons : un environnement technologique varié et favorable à l’innovation ; des projets d’envergure nationale / européenne au service des citoyens ; des projets centrés sur les utilisateurs ; une atmosphère collégiale, dynamique et multilingue ; une administration qui valorise les compétences des collaborateurs et encourage la mobilité interne. Missions Vous intégrerez la cellule « Services d’Identité» de la division Systèmes distribué et Bureautique. Cette équipe multinationale et multi compétence est en charge de l’infrastructure Active Directory mais aussi des services Cloud Azure. Vos missions seront : Gérer et améliorer l’infrastructure Active Directory du CTIE, y compris les services de fédération Active Directory (ADFS) et les autorités de certification (ADCS); Synchroniser les utilisateurs via MS Entra Connect; Analyser, concevoir et standardiser les stratégies globales pour les services cloud mentionnés; Mettre en œuvre les politiques de sécurité conformément à la politique SMSI du CTIE, et rédiger les documents et manuels de procédures nécessaires pour s’y conformer; Implémenter la sécurité en suivant les recommandations de sécurité fournie par des organismes tiers reconnus et/ou de l’éditeur; Administrer Entra ID et effectuer les tâches nécessitant le rôle de « Global Admin »; Collaborer avec les autres administrations pour répondre à leurs besoins en matière d’infrastructure Windows; Gérer les incidents et les demandes de service liés à l’environnement géré par l’équipe. Profil Compétences techniques Connaissances avancées dans l’administration des plateformes On Premises Active Directory; Connaissances avancées dans l’administration et la gestion de Entra ID (Azure AD); Maîtrise des environnements Windows Server, incluant la configuration, la gestion et le dépannage, ainsi qu’une connaissance des technologies associées telles que ADFS, ADCS, DFS, etc; Expertise en sécurité informatique; Connaissance d’outils d’audit tels que ManageEngine, Varonis, PingCastle ou autres; Connaissances des réseaux et infrastructures d’entreprises; Gestion de l’infrastructure suivant la méthodologie ITIL. Compétences comportementales Polyvalence, Esprit d’équipe mais capacité à travailler en toute autonomie; Capacité d'analyse structurée; Approche méthodologique; Capacité d'organisation et de communication; Précision dans l'exécution des travaux; Très bonne capacité rédactionnelle. Atouts Connaissances d’autres produits Microsoft tels que SQL Server, SCOM, DSC; Connaissances générales sur les principes d’authentifications moderne type ADFS; Connaissance d’un ou plusieurs langages de Scripting (Idéalement PowerShell). Conditions d’admission Poste d'employé de l'État Obtenez plus de détails sur les conditions d'admission des employés de l'État . Diplômes Vous êtes titulaire d’un grade ou diplôme délivré par un établissement d’enseignement supérieur reconnu par l’Etat du siège de l’établissement et sanctionnant l’accomplissement avec succès d’un master en informatique ou de son équivalent. Expérience Vous avez une expérience d'au moins 3 ans dans le domaine. Langues Vous répondez aux exigences des connaissances de 3 langues administratives pour le groupe d'indemnité A1. Une dispense de deux des trois langues administratives peut être accordée sous certaines conditions. Nationalité Vous êtes ressortissant d’un État membre de l’Union européenne. Documents à fournir Lettre de motivation, copie du diplôme et CV renseignant les informations suivantes: Nom(s) et prénom(s) Numéro d’identification (càd. le numéro de matricule nationale ou, à défaut, la date de naissance) Nationalité Adresse électronique Liste des établissements d’enseignement fréquentés et leur pays d’implantation (veuillez indiquer le nom complet des établissements, les abréviations n'étant pas permises) Diplômes (veuillez indiquer l'intitulé des diplômes) Expérience professionnelle Connaissances en langues parlées et écrites Pour ce poste, vous devez obligatoirement postuler en ligne via MyGuichet, les candidatures via courriel ou via courrier postal n’étant pas acceptées. Les documents sont à introduire via MyGuichet en format pdf (taille maximale 20 Mo).",
        "Informations générales": "StatutEmployé de l'ÉtatGroupe d'indemnitéA1Date limite de candidature11/07/2025MinistèreMinistère de la DigitalisationAdministration/OrganismeCentre des technologies de l'information de l'ÉtatLieuLuxembourg-NeudorfTâcheTâche complèteNombre de postes vacants1Type de contratCDINationalitéÊtre ressortissant UECatégorie de métiersTechnologie de l'information et de la communicationRéf.E00036227",
        "Qui recrute ?": " Le Centre des technologies de l'information de l'État (CTIE) est l'administration luxembourgeoise en charge des services IT pour le gouvernement, les ministères et les administrations luxembourgeoises et un des acteurs centraux en matière d'eGovernment.Nos services couvrent tous les domaines IT, découvrez nos missions sur notre site internethttps://ctie.gouvernement.lu/fr/l-administration.html.Nous offrons :un environnement technologique varié et favorable à l’innovation ;des projets d’envergure nationale / européenne au service des citoyens ;des projets centrés sur les utilisateurs ;une atmosphère collégiale, dynamique et multilingue ;une administration qui valorise les compétences des collaborateurs et encourage la mobilité interne. ",
        "Missions": "Vous intégrerez la cellule « Services d’Identité» de la division Systèmes distribué et Bureautique.Cette équipe multinationale et multi compétence est en charge de l’infrastructure Active Directory mais aussi des services Cloud Azure. Vos missions seront :Gérer et améliorer l’infrastructure Active Directory du CTIE, y compris les services de fédération Active Directory (ADFS) et les autorités de certification (ADCS);Synchroniser les utilisateurs via MS Entra Connect;Analyser, concevoir et standardiser les stratégies globales pour les services cloud mentionnés;Mettre en œuvre les politiques de sécurité conformément à la politique SMSI du CTIE, et rédiger les documents et manuels de procédures nécessaires pour s’y conformer;Implémenter la sécurité en suivant les recommandations de sécurité fournie par des organismes tiers reconnus et/ou de l’éditeur;Administrer Entra ID et effectuer les tâches nécessitant le rôle de « Global Admin »;Collaborer avec les autres administrations pour répondre à leurs besoins en matière d’infrastructure Windows;Gérer les incidents et les demandes de service liés à l’environnement géré par l’équipe.",
        "Profil": "Compétences techniques Connaissances avancées dans l’administration des plateformes On Premises Active Directory;Connaissances avancées dans l’administration et la gestion de Entra ID (Azure AD);Maîtrise des environnements Windows Server, incluant la configuration, la gestion et le dépannage, ainsi qu’une connaissance des technologies associées telles que ADFS, ADCS, DFS, etc;Expertise en sécurité informatique;Connaissance d’outils d’audit tels que ManageEngine, Varonis, PingCastle ou autres;Connaissances des réseaux et infrastructures d’entreprises;Gestion de l’infrastructure suivant la méthodologie ITIL. Compétences comportementales Polyvalence, Esprit d’équipe mais capacité à travailler en toute autonomie;Capacité d'analyse structurée;Approche méthodologique;Capacité d'organisation et de communication;Précision dans l'exécution des travaux;Très bonne capacité rédactionnelle. Atouts Connaissances d’autres produits Microsoft tels que SQL Server, SCOM, DSC;Connaissances générales sur les principes d’authentifications moderne type ADFS;Connaissance d’un ou plusieurs langages de Scripting (Idéalement PowerShell).",
        "Conditions d’admission": "Poste d'employé de l'État Obtenez plus de détails sur lesconditions d'admission des employés de l'État. Diplômes Vous êtes titulaire d’un grade ou diplôme délivré par un établissement d’enseignement supérieur reconnu par l’Etat du siège de l’établissement et sanctionnant l’accomplissement avec succès d’un master en informatique ou de son équivalent. Expérience Vous avez une expérience d'au moins 3 ans dans le domaine. Langues Vous répondez aux exigences des connaissances de 3 langues administratives pour le groupe d'indemnité A1. Une dispense de deux des trois langues administratives peut être accordée sous certaines conditions. Nationalité Vous êtes ressortissant d’un État membre de l’Union européenne.",
        "Documents à fournir": "Lettre de motivation, copie du diplôme et CV renseignant les informations suivantes: Nom(s) et prénom(s)Numéro d’identification (càd. le numéro de matricule nationale ou, à défaut, la date de naissance)NationalitéAdresse électroniqueListe des établissements d’enseignement fréquentés et leur pays d’implantation (veuillez indiquer le nom complet des établissements, les abréviations n'étant pas permises)Diplômes (veuillez indiquer l'intitulé des diplômes)Expérience professionnelleConnaissances en langues parlées et écrites Pour ce poste, vous devez obligatoirement postuler en ligne via MyGuichet, les candidatures via courriel ou via courrier postal n’étant pas acceptées. Les documents sont à introduire via MyGuichet en format pdf (taille maximale 20 Mo).",
        "Group Classification": "A1",
        "adding_date": "2025-06-13T02:00:16.280116"
    },
    {
        "Title": "Métrologue et analyste de données (m/f) (réf. M00036217) - Recrutement interne",
        "Link": "https://govjobs.public.lu/fr/postuler/mobilite-interne/changement-administration/2025/A1/Juin/20250612-mtrologueetanalystededonnesmfr-372932.html",
        "Education Level": "Master",
        "Job Category": "Agriculture et Viticulture",
        "Status": "Fonctionnaire",
        "Task": "Tâche complète",
        "Ministry": "Ministère de l'Agriculture, de l'Alimentation et de la Viticulture",
        "Administration/Organization": "Administration luxembourgeoise vétérinaire et alimentaire",
        "Application Deadline": "27/06/2025",
        "Nationality": "Être ressortissant UE",
        "Number of Vacancies": "1",
        "Full Description": "Informations générales Statut Fonctionnaire Groupe de traitement A1 Date limite de candidature 27/06/2025 Ministère Ministère de l'Agriculture, de l'Alimentation et de la Viticulture Administration/Organisme Administration luxembourgeoise vétérinaire et alimentaire Lieu Dudelange Tâche Tâche complète Nombre de postes vacants 1 Nationalité Être ressortissant UE Catégorie de métiers Agriculture et Viticulture Réf. M00036217 Qui recrute ? L'Administration luxembourgeoise vétérinaire et alimentaire (ALVA) a été créée en 2022 par le regroupement, au sein d'une administration unique, de la majeure partie des organes de contrôle de la chaîne alimentaire. Les missions de l'ALVA sont définies dans la loi du 8 septembre 2022 portant création et organisation de l'Administration luxembourgeoise vétérinaire et alimentaire. Lors de la mise en place du gouvernement actuel à la fin de l’année 2023, il avait été décidé de poursuivre la réforme de consolidation entamée par le gouvernement précédent dans le domaine du contrôle de la chaîne alimentaire avec la création de la nouvelle Administration luxembourgeoise vétérinaire et alimentaire (ALVA). Dans ce cadre, le gouvernement avait décidé que le Service de surveillance alimentaire (SSA) du Laboratoire national de santé (LNS), serait transféré vers l'ALVA afin de le fusionner avec le Laboratoire de médecine vétérinaire de l’État (LMVE). Cette fusion, effective depuis le 1er janvier 2025, a donné naissance au laboratoire vétérinaire et alimentaire (LVA), une division de l’ALVA placée sous la tutelle du ministère de l’Agriculture, de l’Alimentation et de la Viticulture. Elle constitue la dernière étape visant à centraliser l’ensemble du contrôle de la chaîne alimentaire, couvrant à la fois l’inspection, la surveillance et les analyses de laboratoire, sous l’autorité d’un seul ministère. Missions En tant que Métrologue et analyste de données, vous assurez la coordination, la supervision et la planification des activités de métrologie du laboratoire à Dudelange, en garantissant le bon fonctionnement quotidien et la conformité aux objectifs définis par la direction et le chef de division du laboratoire. Tâches prinicipales: Vous pilotez et encadrez l'ensemble de la métrologie du laboratoire de l'ALVA à Dudelange; Vous assurez le contrôle et la vérification régulière des équipements du laboratoire tels que les balances, thermomètres, masses de travail, pipettes/dispenseurs et enceintes; Vous établissez et maintenez à jour la documentation interne de métrologie en conformément à la norme ISO 17025; Vous identifiez les non conformités et veillez à la traçabilité des réclamations; Vous administrez les programmes informatiques utilisés en métrologie (par exemple Saveris) et gérez les droits d'accès du personnel; Vous organisez et suivez les vérifications et étalonnages réalisés par des prestataires externes et évaluez la qualité des fournisseurs; Vous assurez la gestion du parc d’instruments de la métrologie, planifiez les vérifications et pilotez le budget associé; Vous conseillez et assistez es services techniques dans le suivi métrologique de leurs équipements spécifiques (robots, etc.); Vos contribuez activement à la mise en œuvre, au maintien et amélioration du système qualité; Vous participez aux audits internes et externes et veillez à l’actualisation permanente de la documentation et à la conformité règlementaire; Vous réalisez des analyses de risque en métrologie et proposez des actions correctives et préventives adaptées; Vous animez les réunions métrologiques et contribuez à la communication interne et externe  du laboratoire;  Vous participez à la préparation  de la revue de direction en collaboration avec le service qualité; Vous organisez, analysez et exploitez les données du laboratoire en vue de leur utilisation (dossiers de vérification, divers rapports, etc.); Vous apportez votre expertise méthodologique et statistique; Vous développez, rédigez et évaluez des requêtes; Vous réalisez des analyses critiques, justifiez les résultats et proposez des pistes d’amélioration; Vous participez à l’activité métrologique de l’ALVA à Strassen. Profil Compétences techniques Vous êtes capable d’appliquer et de développer les procédures et processus internes; Vous conduisez des projets en assurant leur structuration, leur planification et leur suivi; Vous maîtrisez les outils de bureautique courants; Vous exploitez les logiciels et progiciels métiers mis en place au sein du le service; À court terme vous devrez être capable d’utiliser SharePoint et les outils de la gestion électronique des documents; A moyen terme, vous devrez connaître et appliquer la législation et la réglementation relatives à la métrologie; À terme, vous devrez maîtriser la norme ISO/IEC 17025:2017. Compétences comportementales Vous assurez la gestion des projets en définissant des objectifs clairs, en organisant les ressources et en garantissant la réalisation des livrables dans les délais et le cadre prévus; Vous savez gérer les priorités en organisant vos activités de manière méthodique et en vous adaptant aux imprévus pour préserver la qualité du travail réalisé; Vous faites preuve de rigueur en veillant à l’exactitude des données, au respect des procédures et à la fiabilité des résultats communiqués; Vous travaillez de manière collaborative en favorisant les échanges, le partage des connaissances et l’entraide au sein de l’équipe pour atteindre les objectifs communs. Atouts La connaissance de la norme ISO/IEC 17025:2017 constitue un avantage; La maîtrise de la législation et de la réglementation en lien avec la métrologie est également un atout. Conditions d’admission Diplômes Vous êtes titulaire d’un grade ou diplôme délivré par un établissement d’enseignement supérieur reconnu par l’Etat du siège de l’établissement et sanctionnant l’accomplissement avec succès d’un master dans un domaine scientifique ou de son équivalent. Expérience Vous avez une expérience d'au moins 3 ans dans le domaine. Nationalité Vous êtes ressortissant d’un État membre de l’Union européenne. Documents à fournir Lettre de motivation pour le poste brigué et CV; La lettre de motivation et le CV sont à introduire via MyGuichet en format pdf (taille maximale 20 Mo).",
        "Informations générales": "StatutFonctionnaireGroupe de traitementA1Date limite de candidature27/06/2025MinistèreMinistère de l'Agriculture, de l'Alimentation et de la ViticultureAdministration/OrganismeAdministration luxembourgeoise vétérinaire et alimentaireLieuDudelangeTâcheTâche complèteNombre de postes vacants1NationalitéÊtre ressortissant UECatégorie de métiersAgriculture et ViticultureRéf.M00036217",
        "Qui recrute ?": " L'Administration luxembourgeoise vétérinaire et alimentaire (ALVA) a été créée en 2022 par le regroupement, au sein d'une administration unique, de la majeure partie des organes de contrôle de la chaîne alimentaire.Les missions de l'ALVA sont définies dans la loi du 8 septembre 2022 portant création et organisation de l'Administration luxembourgeoise vétérinaire et alimentaire.Lors de la mise en place du gouvernement actuel à la fin de l’année 2023, il avait été décidé de poursuivre la réforme de consolidation entamée par le gouvernement précédent dans le domaine du contrôle de la chaîne alimentaire avec la création de la nouvelle Administration luxembourgeoise vétérinaire et alimentaire (ALVA).Dans ce cadre, le gouvernement avait décidé que le Service de surveillance alimentaire (SSA) du Laboratoire national de santé (LNS), serait transféré vers l'ALVA afin de le fusionner avec le Laboratoire de médecine vétérinaire de l’État (LMVE).Cette fusion, effective depuis le 1er janvier 2025, a donné naissance au laboratoire vétérinaire et alimentaire (LVA), une division de l’ALVA placée sous la tutelle du ministère de l’Agriculture, de l’Alimentation et de la Viticulture. Elle constitue la dernière étape visant à centraliser l’ensemble du contrôle de la chaîne alimentaire, couvrant à la fois l’inspection, la surveillance et les analyses de laboratoire, sous l’autorité d’un seul ministère. ",
        "Missions": "En tant que Métrologue et analyste de données, vous assurez la coordination, la supervision et la planification des activités de métrologie du laboratoire à Dudelange, en garantissant le bon fonctionnement quotidien et la conformité aux objectifs définis par la direction et le chef de division du laboratoire. Tâches prinicipales:Vous pilotez et encadrez l'ensemble de la métrologie du laboratoire de l'ALVA à Dudelange;Vous assurez le contrôle et la vérification régulière des équipements du laboratoire tels que les balances, thermomètres, masses de travail, pipettes/dispenseurs et enceintes;Vous établissez et maintenez à jour la documentation interne de métrologie en conformément à la norme ISO 17025;Vous identifiez les non conformités et veillez à la traçabilité des réclamations;Vous administrez les programmes informatiques utilisés en métrologie (par exemple Saveris) et gérez les droits d'accès du personnel;Vous organisez et suivez les vérifications et étalonnages réalisés par des prestataires externes et évaluez la qualité des fournisseurs;Vous assurez la gestion du parc d’instruments de la métrologie, planifiez les vérifications et pilotez le budget associé;Vous conseillez et assistez es services techniques dans le suivi métrologique de leurs équipements spécifiques (robots, etc.);Vos contribuez activement à la mise en œuvre, au maintien et amélioration du système qualité;Vous participez aux audits internes et externes et veillez à l’actualisation permanente de la documentation et à la conformité règlementaire;Vous réalisez des analyses de risque en métrologie et proposez des actions correctives et préventives adaptées;Vous animez les réunions métrologiques et contribuez à la communication interne et externe  du laboratoire;  Vous participez à la préparation  de la revue de direction en collaboration avec le service qualité;Vous organisez, analysez et exploitez les données du laboratoire en vue de leur utilisation (dossiers de vérification, divers rapports, etc.);Vous apportez votre expertise méthodologique et statistique;Vous développez, rédigez et évaluez des requêtes;Vous réalisez des analyses critiques, justifiez les résultats et proposez des pistes d’amélioration;Vous participez à l’activité métrologique de l’ALVA à Strassen.",
        "Profil": "Compétences techniques Vous êtes capable d’appliquer et de développer les procédures et processus internes;Vous conduisez des projets en assurant leur structuration, leur planification et leur suivi;Vous maîtrisez les outils de bureautique courants;Vous exploitez les logiciels et progiciels métiers mis en place au sein du le service;À court terme vous devrez être capable d’utiliser SharePoint et les outils de la gestion électronique des documents;A moyen terme, vous devrez connaître et appliquer la législation et la réglementation relatives à la métrologie;À terme, vous devrez maîtriser la norme ISO/IEC 17025:2017. Compétences comportementales Vous assurez la gestion des projets en définissant des objectifs clairs, en organisant les ressources et en garantissant la réalisation des livrables dans les délais et le cadre prévus;Vous savez gérer les priorités en organisant vos activités de manière méthodique et en vous adaptant aux imprévus pour préserver la qualité du travail réalisé;Vous faites preuve de rigueur en veillant à l’exactitude des données, au respect des procédures et à la fiabilité des résultats communiqués;Vous travaillez de manière collaborative en favorisant les échanges, le partage des connaissances et l’entraide au sein de l’équipe pour atteindre les objectifs communs. Atouts La connaissance de la norme ISO/IEC 17025:2017 constitue un avantage;La maîtrise de la législation et de la réglementation en lien avec la métrologie est également un atout.",
        "Conditions d’admission": "Diplômes Vous êtes titulaire d’un grade ou diplôme délivré par un établissement d’enseignement supérieur reconnu par l’Etat du siège de l’établissement et sanctionnant l’accomplissement avec succès d’un master dans un domaine scientifique ou de son équivalent. Expérience Vous avez une expérience d'au moins 3 ans dans le domaine. Nationalité Vous êtes ressortissant d’un État membre de l’Union européenne.",
        "Documents à fournir": "Lettre de motivation pour le poste brigué et CV;La lettre de motivation et le CV sont à introduire via MyGuichet en format pdf (taille maximale 20 Mo). ",
        "Group Classification": "A1",
        "adding_date": "2025-06-13T02:00:16.280269"
    },
    {
        "Title": "Agent d'accueil - Agent de surveillance (Poste d’employé-étudiant) (m/f) (réf. E00036222)",
        "Link": "https://govjobs.public.lu/fr/postuler/postes-ouverts/postes-vacants/employes/2025/D3/Juin/20250612-agentdaccueilagentdesurveillan-373044.html",
        "Education Level": "Moins de 2 années ES",
        "Job Category": "Environnement et Aménagement du territoire",
        "Status": "Employé de l'État",
        "Task": "Tâche à temps partiel (20%)",
        "Ministry": "Ministère de l'Environnement, du Climat et de la Biodiversité",
        "Administration/Organization": "Administration de la nature et des forêts",
        "Application Deadline": "27/06/2025",
        "Nationality": "Être ressortissant UE",
        "Number of Vacancies": "1",
        "Contract Type": "CDD",
        "Full Description": "Informations générales Statut Employé de l'État Groupe d'indemnité D3 Date limite de candidature 27/06/2025 Ministère Ministère de l'Environnement, du Climat et de la Biodiversité Administration/Organisme Administration de la nature et des forêts Lieu Remerschen Tâche Tâche à temps partiel (20%) Nombre de postes vacants 1 Type de contrat CDD Nationalité Être ressortissant UE Catégorie de métiers Environnement et Aménagement du territoire Réf. E00036222 Qui recrute ? Administration de la nature et des forêts Missions Accueillir, renseigner et orienter les clients; Prendre en charge les appels téléphoniques; Assister à la gestion logistique des événements et des réunions; Participer activement aux visites guidées; Assurer le remplacement des surveillants en cas d'absences imprévues. Le futur titulaire travaillera sous forme d’un roulement hebdomadaire comprenant des heures de service le samedi/dimanche et les jours fériés Profil Compétences techniques Maîtrise des applications bureautiques et des logiciels spécifiques; Connaissances du contexte de l'environnement professionnel; Maîtrise des langues et des techniques d'expression écrite et orale. Compétences comportementales Contact aisé avec les visiteurs en luxembourgeois, allemand, français, l‘anglais étant un atout ; Bon esprit d'équipe et qualités relationnelles ; Sens de l’organisation et des responsabilités; Disponibilité et flexibilité (travailler régulièrement le weekend et les jours fériés). Atouts Connaître les enjeux de la protection de la nature; Avoir de bonnes connaissances de la faune et de la flore nationales ainsi que de l’écologie et de la conservation de la nature. Conditions d’admission Poste d'employé de l'État Obtenez plus de détails sur les conditions d'admission des employés de l'État . Diplômes Être inscrit auprès d’un établissement scolaire, soit l’enseignement secondaire ou secondaire technique soit auprès d'une université. Langues Vous répondez aux exigences des connaissances de 3 langues administratives pour le groupe d'indemnité D3. Nationalité Vous êtes ressortissant d’un État membre de l’Union européenne. Documents à fournir Lettre de motivation, copie du diplôme et CV renseignant les informations suivantes: Nom(s) et prénom(s) Numéro d’identification (càd. le numéro de matricule nationale ou, à défaut, la date de naissance) Nationalité Adresse électronique Liste des établissements d’enseignement fréquentés et leur pays d’implantation (veuillez indiquer le nom complet des établissements, les abréviations n'étant pas permises) Diplômes (veuillez indiquer l'intitulé des diplômes) Expérience professionnelle Connaissances en langues parlées et écrites Pour ce poste, vous devez obligatoirement postuler en ligne via MyGuichet, les candidatures via courriel ou via courrier postal n’étant pas acceptées. Les documents sont à introduire via MyGuichet en format pdf (taille maximale 20 Mo).",
        "Informations générales": "StatutEmployé de l'ÉtatGroupe d'indemnitéD3Date limite de candidature27/06/2025MinistèreMinistère de l'Environnement, du Climat et de la BiodiversitéAdministration/OrganismeAdministration de la nature et des forêtsLieuRemerschenTâcheTâche à temps partiel (20%)Nombre de postes vacants1Type de contratCDDNationalitéÊtre ressortissant UECatégorie de métiersEnvironnement et Aménagement du territoireRéf.E00036222",
        "Qui recrute ?": " Administration de la nature et des forêts ",
        "Missions": "Accueillir, renseigner et orienter les clients;Prendre en charge les appels téléphoniques;Assister à la gestion logistique des événements et des réunions;Participer activement aux visites guidées;Assurer le remplacement des surveillants en cas d'absences imprévues. Le futur titulaire travaillera sous forme d’un roulement hebdomadaire comprenant des heures de service le samedi/dimanche et les jours fériés",
        "Profil": "Compétences techniques Maîtrise des applications bureautiques et des logiciels spécifiques;Connaissances du contexte de l'environnement professionnel;Maîtrise des langues et des techniques d'expression écrite et orale. Compétences comportementales Contact aisé avec les visiteurs en luxembourgeois, allemand, français, l‘anglais étant un atout ;Bon esprit d'équipe et qualités relationnelles ;Sens de l’organisation et des responsabilités;Disponibilité et flexibilité (travailler régulièrement le weekend et les jours fériés). Atouts Connaître les enjeux de la protection de la nature;Avoir de bonnes connaissances de la faune et de la flore nationales ainsi que de l’écologie et de la conservation de la nature.",
        "Conditions d’admission": "Poste d'employé de l'État Obtenez plus de détails sur lesconditions d'admission des employés de l'État. Diplômes Être inscrit auprès d’un établissement scolaire, soit l’enseignement secondaire ou secondaire technique soit auprès d'une université. Langues Vous répondez aux exigences des connaissances de 3 langues administratives pour le groupe d'indemnité D3. Nationalité Vous êtes ressortissant d’un État membre de l’Union européenne.",
        "Documents à fournir": "Lettre de motivation, copie du diplôme et CV renseignant les informations suivantes: Nom(s) et prénom(s)Numéro d’identification (càd. le numéro de matricule nationale ou, à défaut, la date de naissance)NationalitéAdresse électroniqueListe des établissements d’enseignement fréquentés et leur pays d’implantation (veuillez indiquer le nom complet des établissements, les abréviations n'étant pas permises)Diplômes (veuillez indiquer l'intitulé des diplômes)Expérience professionnelleConnaissances en langues parlées et écrites Pour ce poste, vous devez obligatoirement postuler en ligne via MyGuichet, les candidatures via courriel ou via courrier postal n’étant pas acceptées. Les documents sont à introduire via MyGuichet en format pdf (taille maximale 20 Mo).",
        "Group Classification": "D3",
        "adding_date": "2025-06-13T02:00:16.280663"
    },
    {
        "Title": "Chargé de Pharmacovigilance (PhV) (m/f) (réf. E00036218)",
        "Link": "https://govjobs.public.lu/fr/postuler/postes-ouverts/postes-vacants/employes/2025/A1/Juin/20250612-chargdepharmacovigilancephvmfr-372934.html",
        "Education Level": "Master",
        "Job Category": "Santé et sécurité sociale",
        "Status": "Employé de l'État",
        "Task": "Tâche complète",
        "Ministry": "Ministère de la Santé et de la Sécurité sociale",
        "Administration/Organization": "Direction de la santé",
        "Application Deadline": "27/06/2025",
        "Nationality": "Être ressortissant UE",
        "Number of Vacancies": "1",
        "Contract Type": "CDD jusqu'au 30 juin 2026",
        "Full Description": "Informations générales Statut Employé de l'État Groupe d'indemnité A1 Date limite de candidature 27/06/2025 Ministère Ministère de la Santé et de la Sécurité sociale Administration/Organisme Direction de la santé Lieu Strassen Tâche Tâche complète Nombre de postes vacants 1 Type de contrat CDD jusqu'au 30 juin 2026 Nationalité Être ressortissant UE Catégorie de métiers Santé et sécurité sociale Réf. E00036218 Qui recrute ? La division de la pharmacie et des médicaments Missions Participation à la gestion de la sécurité d’emploi des médicaments et autres produits de santé: Gestion des cas de pharmacovigilance (PhV) entrants; Collaboration avec le Centre Régional de Pharmacovigilance (CRPV) de Nancy pour le recueil, l’évaluation médicale et la documentation des cas de PhV; Réconciliation des cas de pharmacovigilance avec les partenaires; Monitoring de la boite email générique; Mise en place des procédures en lien avec ses activités; Traitement des questions réglementaires; Communication : promotion du bon usage des médicaments auprès de patients et professionnels de santé; Production de contenu sur thématiques émergentes et alertes de sécurité; Participation à la formation des collaborateurs internes et acteurs externes de santé; Participation à la veille scientifique, réglementaire et technique; Participation aux travaux transversaux entre la Division de la pharmacie et des médicaments et les partenaires internes et externes en vue de l’organisation du pilier des vigilances; Back-up sur les activités spécifiques de collègues du service de PhV. Profil Compétences techniques Expérience préalable en pharmacovigilance des médicaments et/ou vigilance d’autres produits de santé, auprès d’une autorité de réglementation, d’un organisme de surveillance ou de contrôle ou industrielle; Connaissances réglementaires pharmaceutiques larges (cadre national et Européen); Analyse du cadre réglementaire pour les produits de santé; Communication adaptée au contexte; Appétence pour la digitalisation; Maitrise des logiciels informatiques Word, Access, Excel et Powerpoint; Maitrise du français et de l’anglais (lu, écrit, parlé); Connaissances approfondies en pharmacovigilance; Pharmacie Clinique. Compétences comportementales Rigueur et méthode; Sens des responsabilités; Résistance au stress; Savoir allier autonomie et travail d’équipe; Ouverture d’esprit. Esprit de synthèse et réactivité. Conditions d’admission Poste d'employé de l'État Obtenez plus de détails sur les conditions d'admission des employés de l'État . Diplômes Vous êtes titulaire d’un grade ou diplôme délivré par un établissement d’enseignement supérieur reconnu par l’Etat du siège de l’établissement et sanctionnant l’accomplissement avec succès d’un master dans le domaine de la santé ou des sciences de la vie ou de son équivalent. Expérience Vous avez une expérience d'au moins 3 ans dans le domaine. Langues Vous répondez aux exigences des connaissances de 3 langues administratives pour le groupe d'indemnité A1. Une dispense de deux des trois langues administratives peut être accordée sous certaines conditions. Nationalité Vous êtes ressortissant d’un État membre de l’Union européenne. Documents à fournir Lettre de motivation, copie du diplôme et CV renseignant les informations suivantes: Nom(s) et prénom(s) Numéro d’identification (càd. le numéro de matricule nationale ou, à défaut, la date de naissance) Nationalité Adresse électronique Liste des établissements d’enseignement fréquentés et leur pays d’implantation (veuillez indiquer le nom complet des établissements, les abréviations n'étant pas permises) Diplômes (veuillez indiquer l'intitulé des diplômes) Expérience professionnelle Connaissances en langues parlées et écrites Pour ce poste, vous devez obligatoirement postuler en ligne via MyGuichet, les candidatures via courriel ou via courrier postal n’étant pas acceptées. Les documents sont à introduire via MyGuichet en format pdf (taille maximale 20 Mo).",
        "Informations générales": "StatutEmployé de l'ÉtatGroupe d'indemnitéA1Date limite de candidature27/06/2025MinistèreMinistère de la Santé et de la Sécurité socialeAdministration/OrganismeDirection de la santéLieuStrassenTâcheTâche complèteNombre de postes vacants1Type de contratCDD jusqu'au 30 juin 2026NationalitéÊtre ressortissant UECatégorie de métiersSanté et sécurité socialeRéf.E00036218",
        "Qui recrute ?": " La division de la pharmacie et des médicaments ",
        "Missions": "Participation à la gestion de la sécurité d’emploi des médicaments et autres produits de santé:Gestion des cas de pharmacovigilance (PhV) entrants;Collaboration avec le Centre Régional de Pharmacovigilance (CRPV) de Nancy pour le recueil, l’évaluation médicale et la documentation des cas de PhV;Réconciliation des cas de pharmacovigilance avec les partenaires;Monitoring de la boite email générique;Mise en place des procédures en lien avec ses activités;Traitement des questions réglementaires;Communication : promotion du bon usage des médicaments auprès de patients et professionnels de santé;Production de contenu sur thématiques émergentes et alertes de sécurité;Participation à la formation des collaborateurs internes et acteurs externes de santé;Participation à la veille scientifique, réglementaire et technique;Participation aux travaux transversaux entre la Division de la pharmacie et des médicaments et les partenaires internes et externes en vue de l’organisation du pilier des vigilances;Back-up sur les activités spécifiques de collègues du service de PhV.",
        "Profil": "Compétences techniques Expérience préalable en pharmacovigilance des médicaments et/ou vigilance d’autres produits de santé, auprès d’une autorité de réglementation, d’un organisme de surveillance ou de contrôle ou industrielle;Connaissances réglementaires pharmaceutiques larges (cadre national et Européen);Analyse du cadre réglementaire pour les produits de santé;Communication adaptée au contexte;Appétence pour la digitalisation;Maitrise des logiciels informatiques Word, Access, Excel et Powerpoint;Maitrise du français et de l’anglais (lu, écrit, parlé);Connaissances approfondies en pharmacovigilance;Pharmacie Clinique. Compétences comportementales Rigueur et méthode;Sens des responsabilités;Résistance au stress;Savoir allier autonomie et travail d’équipe;Ouverture d’esprit.Esprit de synthèse et réactivité.",
        "Conditions d’admission": "Poste d'employé de l'État Obtenez plus de détails sur lesconditions d'admission des employés de l'État. Diplômes Vous êtes titulaire d’un grade ou diplôme délivré par un établissement d’enseignement supérieur reconnu par l’Etat du siège de l’établissement et sanctionnant l’accomplissement avec succès d’un master dans le domaine de la santé ou des sciences de la vie ou de son équivalent. Expérience Vous avez une expérience d'au moins 3 ans dans le domaine. Langues Vous répondez aux exigences des connaissances de 3 langues administratives pour le groupe d'indemnité A1. Une dispense de deux des trois langues administratives peut être accordée sous certaines conditions. Nationalité Vous êtes ressortissant d’un État membre de l’Union européenne.",
        "Documents à fournir": "Lettre de motivation, copie du diplôme et CV renseignant les informations suivantes: Nom(s) et prénom(s)Numéro d’identification (càd. le numéro de matricule nationale ou, à défaut, la date de naissance)NationalitéAdresse électroniqueListe des établissements d’enseignement fréquentés et leur pays d’implantation (veuillez indiquer le nom complet des établissements, les abréviations n'étant pas permises)Diplômes (veuillez indiquer l'intitulé des diplômes)Expérience professionnelleConnaissances en langues parlées et écrites Pour ce poste, vous devez obligatoirement postuler en ligne via MyGuichet, les candidatures via courriel ou via courrier postal n’étant pas acceptées. Les documents sont à introduire via MyGuichet en format pdf (taille maximale 20 Mo).",
        "Group Classification": "A1",
        "adding_date": "2025-06-13T02:00:16.280677"
    },
    {
        "Title": "Administrateur de bases de données (DBA) (m/f) (réf. M00036236) - Recrutement interne",
        "Link": "https://govjobs.public.lu/fr/postuler/mobilite-interne/changement-administration/2025/A1/Juin/20250612-administrateurdebasesdedonnesd-373341.html",
        "Education Level": "Master",
        "Job Category": "Technologie de l'information et de la communication",
        "Status": "Fonctionnaire",
        "Task": "Tâche complète",
        "Ministry": "Ministère de la Santé et de la Sécurité sociale",
        "Administration/Organization": "Centre commun de la sécurité sociale",
        "Application Deadline": "30/06/2025",
        "Nationality": "Être ressortissant UE",
        "Number of Vacancies": "1",
        "Full Description": "Informations générales Statut Fonctionnaire Groupe de traitement A1 Date limite de candidature 30/06/2025 Ministère Ministère de la Santé et de la Sécurité sociale Administration/Organisme Centre commun de la sécurité sociale Lieu Luxembourg-Gare Tâche Tâche complète Nombre de postes vacants 1 Nationalité Être ressortissant UE Catégorie de métiers Technologie de l'information et de la communication Réf. M00036236 Qui recrute ? Le Centre commun de la sécurité sociale (CCSS) est un établissement public en charge notamment : de l'affiliation à la sécurité sociale des salariés, travailleurs indépendants et assurés volontaires ; du calcul, de la perception et du recouvrement des cotisations sociales ; de la répartition des cotisations sociales entre les différentes institutions de la sécurité sociale telles que l’AAA, la CNS, la CNAP. Le CCSS offre un cadre de travail motivant : en mettant en œuvre une mission légale essentielle pour le Luxembourg ; en étant installé dans un bâtiment moderne ; en étant localisé idéalement en face de la gare de Luxembourg à proximité immédiate de tous les moyens de transports, dans un quartier en renouveau et facile d'accès ; en offrant la formation initiale complétée par la formation continue offerte à tous les agents du service public ; en offrant une rémunération en ligne avec les conditions de la Fonction publique. Missions Le département informatique du Centre commun de la sécurité sociale a comme mission principale de fournir aux institutions de la sécurité sociale les applications de gestion spécifiques à la législation en la matière. Vous serez intégrés dans une de nos équipes et vos missions principales seront: La gestion d'un parc de base de données \"Oracle\" au sein d'une équipe déjà existante; Le support DB pour les équipes développeurs; La conduite de projets de migration de grande envergure; La participation dans des projets de sécurisation des données et accès; La sauvegarde et la restauration des données; La mise en place de solutions à haute disponibilité; La surveillance et optimisation des performances; La gestion d'outils pour les environnements de type \"Datawarehouse\". Profil Compétences techniques Expériences dans la gestion de bases de données \"Oracle\"; Maîtrise des modèles relationnels de données; Développements en langage PL/SQL; Automatisation de tâches via des scripts BASH/Python et Ansible; Bonne connaissance des environnements Linux/Shell; Bonnes capacités rédactionnelles et orales en français et en anglais. Compétences comportementales Sens de la rigueur, de la logique et de l'organisation; Sens de l'initiative; Capacité à travailler en autonomie, tout en étant capable de travailler en équipe; Capacité à communiquer et à rédiger. Atouts Notions sur les bases de type \"Datawarehouse\" (datamart, star schéma, etc.); Expériences dans le domaine de la sécurité informatique; Expériences avec l'approche \"DevOps\". Conditions d’admission Diplômes Vous êtes titulaire d’un grade ou diplôme délivré par un établissement d’enseignement supérieur reconnu par l’Etat du siège de l’établissement et sanctionnant l’accomplissement avec succès d’un master en informatique, diplôme d’ingénieur ou de son équivalent. Expérience Vous avez une expérience d'au moins 3 ans dans le domaine. Nationalité Vous êtes ressortissant d’un État membre de l’Union européenne. Documents à fournir Lettre de motivation pour le poste brigué et CV; La lettre de motivation et le CV sont à introduire via MyGuichet en format pdf (taille maximale 20 Mo).",
        "Informations générales": "StatutFonctionnaireGroupe de traitementA1Date limite de candidature30/06/2025MinistèreMinistère de la Santé et de la Sécurité socialeAdministration/OrganismeCentre commun de la sécurité socialeLieuLuxembourg-GareTâcheTâche complèteNombre de postes vacants1NationalitéÊtre ressortissant UECatégorie de métiersTechnologie de l'information et de la communicationRéf.M00036236",
        "Qui recrute ?": " Le Centre commun de la sécurité sociale (CCSS) est un établissement public en charge notamment :de l'affiliation à la sécurité sociale des salariés, travailleurs indépendants et assurés volontaires ;du calcul, de la perception et du recouvrement des cotisations sociales ;de la répartition des cotisations sociales entre les différentes institutions de la sécurité sociale telles que l’AAA, la CNS, la CNAP.Le CCSS offre un cadre de travail motivant :en mettant en œuvre une mission légale essentielle pour le Luxembourg ;en étant installé dans un bâtiment moderne ;en étant localisé idéalement en face de la gare de Luxembourg à proximité immédiate de tous les moyens de transports, dans un quartier en renouveau et facile d'accès ;en offrant la formation initiale complétée par la formation continue offerte à tous les agents du service public ;en offrant une rémunération en ligne avec les conditions de la Fonction publique. ",
        "Missions": "Le département informatique du Centre commun de la sécurité sociale a comme mission principale de fournir aux institutions de la sécurité sociale les applications de gestion spécifiques à la législation en la matière. Vous serez intégrés dans une de nos équipes et vos missions principales seront:La gestion d'un parc de base de données \"Oracle\" au sein d'une équipe déjà existante;Le support DB pour les équipes développeurs;La conduite de projets de migration de grande envergure;La participation dans des projets de sécurisation des données et accès;La sauvegarde et la restauration des données;La mise en place de solutions à haute disponibilité;La surveillance et optimisation des performances;La gestion d'outils pour les environnements de type \"Datawarehouse\".",
        "Profil": "Compétences techniques Expériences dans la gestion de bases de données \"Oracle\";Maîtrise des modèles relationnels de données;Développements en langage PL/SQL;Automatisation de tâches via des scripts BASH/Python et Ansible;Bonne connaissance des environnements Linux/Shell;Bonnes capacités rédactionnelles et orales en français et en anglais. Compétences comportementales Sens de la rigueur, de la logique et de l'organisation;Sens de l'initiative;Capacité à travailler en autonomie, tout en étant capable de travailler en équipe;Capacité à communiquer et à rédiger. Atouts Notions sur les bases de type \"Datawarehouse\" (datamart, star schéma, etc.);Expériences dans le domaine de la sécurité informatique;Expériences avec l'approche \"DevOps\".",
        "Conditions d’admission": "Diplômes Vous êtes titulaire d’un grade ou diplôme délivré par un établissement d’enseignement supérieur reconnu par l’Etat du siège de l’établissement et sanctionnant l’accomplissement avec succès d’un master en informatique, diplôme d’ingénieur ou de son équivalent. Expérience Vous avez une expérience d'au moins 3 ans dans le domaine. Nationalité Vous êtes ressortissant d’un État membre de l’Union européenne.",
        "Documents à fournir": "Lettre de motivation pour le poste brigué et CV;La lettre de motivation et le CV sont à introduire via MyGuichet en format pdf (taille maximale 20 Mo). ",
        "Group Classification": "A1",
        "adding_date": "2025-06-13T02:00:16.280863"
    },
    {
        "Title": "Responsable d'unité (m/f)",
        "Link": "https://govjobs.public.lu/fr/postuler/mobilite-interne/carriere-ouverte/employes/2025/A2/Juin/20250612-responsabledunitmf-372917.html",
        "Education Level": "Bachelor",
        "Job Category": "Technologie de l'information et de la communication",
        "Status": "Employé de l'État",
        "Task": "Tâche complète",
        "Ministry": "Ministère de l'Éducation nationale, de l'Enfance et de la Jeunesse",
        "Administration/Organization": "Centre de gestion informatique de l'éducation (CGIE)",
        "Application Deadline": "19/06/2025",
        "Nationality": "Être ressortissant UE",
        "Number of Vacancies": "1",
        "Full Description": "Informations générales Statut Employé de l'État Groupe d'indemnité A2 Date limite de candidature 19/06/2025 Ministère Ministère de l'Éducation nationale, de l'Enfance et de la Jeunesse Administration/Organisme Centre de gestion informatique de l'éducation (CGIE) Lieu eduPôle Walferdange Tâche Tâche complète Nombre de postes vacants 1 Nationalité Être ressortissant UE Catégorie de métiers Technologie de l'information et de la communication Qui recrute ? Le Centre de Gestion Informatique de l’Éducation (CGIE) est l'administration luxembourgeoise en charge de la gestion et du développement des services IT pour l'éducation nationale, y compris les établissements secondaires publics, les enseignants et les élèves. Nos services couvrent un large éventail de solutions et d'infrastructures numériques dédiées à l'éducation. Découvrez nos missions sur notre site internet : https://www.cgie.lu. En tant que responsable d’unité, vous jouez un rôle central dans la gestion, l’optimisation et le développement des infrastructures techniques et informatiques de notre administration. Vous êtes le garant du bon fonctionnement et de l’évolution des infrastructures informatiques, tout en participant activement à la transformation numérique des services au sein du CGIE et du MENJE. Missions Gestion d’équipe et coordination opérationnelle : Superviser les techniciens déployés dans les administrations externes ainsi que l’équipe mobile dédiée; Assurer le bon fonctionnement de l’unité « Centre d’assistance technique – administrations et services ». Planification et conception des infrastructures : Concevoir et planifier de nouvelles infrastructures informatiques, en veillant à leur alignement avec les besoins stratégiques et opérationnels du CGIE et du MENJE; Contribuer à la modernisation et à l’évolution des systèmes distribués et bureautiques (Active Directory, SCCM, automatisation via scripting, etc.). Expertise technique et accompagnement des équipes : Encadrer les problématiques liées aux réseaux sans fil, en apportant une expertise pointue et un soutien technique; Superviser la maintenance des systèmes, et développer des scripts PowerShell afin d’automatiser et de sécuriser les processus. Support technique et assistance aux utilisateurs : Garantir un support technique efficace et adapté aux besoins métiers et assurer la qualité du service rendu. Participation stratégique : Participer activement aux projets stratégiques visant à aligner les services informatiques avec les objectifs du CGIE et du MENJE; Contribuer à la sécurisation et à l’optimisation des processus techniques, et jouer un rôle moteur dans l’innovation et l’amélioration continue. Profil Compétences techniques avoir une expérience professionnelle d'au moins 5 ans dans un poste similaire au cours de laquelle vous avez acquis une expertise dans la gestion, l’optimisation et le développement des infrastructures techniques et informatiques; solides compétences en planification, conception et mise en œuvre d'infrastructures informatiques complexes; Maîtrise approfondie des infrastructures IT : Active Directory, SCCM, systèmes distribués, etc.; Expertise en scripting (notamment PowerShell) pour l’automatisation et la sécurisation des processus; Solides compétences en architecture des systèmes informatiques et réseaux sans fil ; Capacité à résoudre les problèmes techniques de manière proactive et à prendre des décisions stratégiques pour améliorer l'efficacité et la fiabilité de l'infrastructure informatique; Excellentes compétences en gestion d'équipe, en communication et en leadership; Excellentes capacités de rédaction technique et de communication pour faciliter le transfert de connaissances. Compétences comportementales Communication : Avoir d'excellentes compétences en communication pour échanger des idées, résoudre des problèmes et informer les parties prenantes de manière claire et concise; Gestion du temps : Savoir gérer efficacement son temps pour respecter les délais et les échéances; Capacité à résoudre des problèmes : Être capable d'analyser des situations complexes, de prendre des décisions rapides et de trouver des solutions innovantes aux problèmes rencontrés; Esprit d'équipe : Travailler efficacement en équipe, en encourageant la collaboration et en favorisant un environnement de travail positif; Adaptabilité : Être flexible et capable de s'adapter rapidement aux changements, qu'il s'agisse de nouvelles technologies, de modifications des exigences ou d'autres facteurs externes; Gestion du stress : Savoir gérer la pression et le stress inhérents mise en œuvre d’infrastructures informatiques pour maintenir la concentration et la productivité; Résolution de conflits : Être capable de gérer et de résoudre les conflits qui pourraient surgir au sein des équipes ou entre les parties prenantes du projet; Orientation utilisateur : Maintenir une orientation utilisateur forte pour s'assurer que les résultats du projet répondent aux besoins et aux attentes des utilisateurs finaux; Capacité d'écoute : Être un bon auditeur pour comprendre les besoins des membres de l'équipe, des parties prenantes et pour recueillir des informations importantes pour la réussite du projet. Atouts maîtrise des trois langues administratives (français, allemand, anglais); Expérience dans le domaine de l’éducation. Conditions d’admission Le poste est réservé à l'employé au service de l’Etat qui: Compte au moins 10 années de service depuis la date de sa nomination ou de son début de carrière; A réussi à l'examen de promotion de son sous-groupe de traitement initial, si un tel examen est prévu; A suivi et passé avec succès les cours et épreuves du cycle de formation préparatoire au groupe de traitement et d'indemnité supérieur organisés par l'INAP. Documents à fournir Le poste sera occupé en application de la procédure de la carrière ouverte et conformément aux dispositions de la loi du 25 mars 2015 fixant les conditions et modalités de l’accès du fonctionnaire à un groupe de traitement supérieur au sien et de l’employé de l’Etat à un groupe d’indemnité supérieur au sien. Si vous êtes intéressé par cette fonction, portez-vous candidat jusqu’au 12 juillet 2025 avec CV et lettre de motivation en adressant votre demande à Monsieur le Ministre de la Fonction publique - Carrière ouverte - B.P. 1807 L-1018 Luxembourg et en copie par courrier postale à l'adresse : Route de Diekrich, 28 L-7220 Walferdange Luxembourg ainsi qu’au ministre du ressort et au chef d’administration dont fait partie l'employé.",
        "Informations générales": "StatutEmployé de l'ÉtatGroupe d'indemnitéA2Date limite de candidature19/06/2025MinistèreMinistère de l'Éducation nationale, de l'Enfance et de la JeunesseAdministration/OrganismeCentre de gestion informatique de l'éducation (CGIE)LieueduPôle WalferdangeTâcheTâche complèteNombre de postes vacants1NationalitéÊtre ressortissant UECatégorie de métiersTechnologie de l'information et de la communication",
        "Qui recrute ?": " Le Centre de Gestion Informatique de l’Éducation (CGIE) est l'administration luxembourgeoise en charge de la gestion et du développement des services IT pour l'éducation nationale, y compris les établissements secondaires publics, les enseignants et les élèves.Nos services couvrent un large éventail de solutions et d'infrastructures numériques dédiées à l'éducation. Découvrez nos missions sur notre site internet : https://www.cgie.lu.En tant que responsable d’unité, vous jouez un rôle central dans la gestion, l’optimisation et le développement des infrastructures techniques et informatiques de notre administration. Vous êtes le garant du bon fonctionnement et de l’évolution des infrastructures informatiques, tout en participant activement à la transformation numérique des services au sein du CGIE et du MENJE. ",
        "Missions": "Gestion d’équipe et coordination opérationnelle :Superviser les techniciens déployés dans les administrations externes ainsi que l’équipe mobile dédiée;Assurer le bon fonctionnement de l’unité « Centre d’assistance technique – administrations et services ».Planification et conception des infrastructures :Concevoir et planifier de nouvelles infrastructures informatiques, en veillant à leur alignement avec les besoins stratégiques et opérationnels du CGIE et du MENJE;Contribuer à la modernisation et à l’évolution des systèmes distribués et bureautiques (Active Directory, SCCM, automatisation via scripting, etc.).Expertise technique et accompagnement des équipes :Encadrer les problématiques liées aux réseaux sans fil, en apportant une expertise pointue et un soutien technique;Superviser la maintenance des systèmes, et développer des scripts PowerShell afin d’automatiser et de sécuriser les processus.Support technique et assistance aux utilisateurs :Garantir un support technique efficace et adapté aux besoins métiers et assurer la qualité du service rendu.Participation stratégique :Participer activement aux projets stratégiques visant à aligner les services informatiques avec les objectifs du CGIE et du MENJE;Contribuer à la sécurisation et à l’optimisation des processus techniques, et jouer un rôle moteur dans l’innovation et l’amélioration continue.",
        "Profil": "Compétences techniques avoir une expérience professionnelle d'au moins 5 ans dans un poste similaire au cours de laquelle vous avez acquis une expertise dans la gestion, l’optimisation et le développement des infrastructures techniques et informatiques;solides compétences en planification, conception et mise en œuvre d'infrastructures informatiques complexes;Maîtrise approfondie des infrastructures IT : Active Directory, SCCM, systèmes distribués, etc.;Expertise en scripting (notamment PowerShell) pour l’automatisation et la sécurisation des processus;Solides compétences en architecture des systèmes informatiques et réseaux sans fil ;Capacité à résoudre les problèmes techniques de manière proactive et à prendre des décisions stratégiques pour améliorer l'efficacité et la fiabilité de l'infrastructure informatique;Excellentes compétences en gestion d'équipe, en communication et en leadership;Excellentes capacités de rédaction technique et de communication pour faciliter le transfert de connaissances. Compétences comportementales Communication : Avoir d'excellentes compétences en communication pour échanger des idées, résoudre des problèmes et informer les parties prenantes de manière claire et concise;Gestion du temps : Savoir gérer efficacement son temps pour respecter les délais et les échéances;Capacité à résoudre des problèmes : Être capable d'analyser des situations complexes, de prendre des décisions rapides et de trouver des solutions innovantes aux problèmes rencontrés;Esprit d'équipe : Travailler efficacement en équipe, en encourageant la collaboration et en favorisant un environnement de travail positif;Adaptabilité : Être flexible et capable de s'adapter rapidement aux changements, qu'il s'agisse de nouvelles technologies, de modifications des exigences ou d'autres facteurs externes;Gestion du stress : Savoir gérer la pression et le stress inhérents mise en œuvre d’infrastructures informatiques pour maintenir la concentration et la productivité;Résolution de conflits : Être capable de gérer et de résoudre les conflits qui pourraient surgir au sein des équipes ou entre les parties prenantes du projet;Orientation utilisateur : Maintenir une orientation utilisateur forte pour s'assurer que les résultats du projet répondent aux besoins et aux attentes des utilisateurs finaux;Capacité d'écoute : Être un bon auditeur pour comprendre les besoins des membres de l'équipe, des parties prenantes et pour recueillir des informations importantes pour la réussite du projet. Atouts maîtrise des trois langues administratives (français, allemand, anglais);Expérience dans le domaine de l’éducation.",
        "Conditions d’admission": "Le poste est réservé à l'employé au service de l’Etat qui: Compte au moins 10 années de service depuis la date de sa nomination ou de son début de carrière;A réussi à l'examen de promotion de son sous-groupe de traitement initial, si un tel examen est prévu;A suivi et passé avec succès les cours et épreuves du cycle de formation préparatoire au groupe de traitement et d'indemnité supérieur organisés par l'INAP.",
        "Documents à fournir": "Le poste sera occupé en application de la procédure de la carrière ouverte et conformément aux dispositions de la loi du 25 mars 2015 fixant les conditions et modalités de l’accès du fonctionnaire à un groupe de traitement supérieur au sien et de l’employé de l’Etat à un groupe d’indemnité supérieur au sien.  Si vous êtes intéressé par cette fonction, portez-vous candidat jusqu’au12 juillet 2025avec CV et lettre de motivation en adressant votre demande à  Monsieur le Ministre de la Fonction publique- Carrière ouverte -B.P. 1807L-1018 Luxembourg et en copie par courrier postale à l'adresse : Route de Diekrich, 28 L-7220 Walferdange Luxembourg  ainsi qu’au ministre du ressort et au chef d’administration dont fait partie l'employé.",
        "Group Classification": "A2",
        "adding_date": "2025-06-13T02:00:16.281029"
    },
    {
        "Title": "Agent administratif - Intégration linguistique / Instruction de base pour adultes (m/f) (réf. E00036219)",
        "Link": "https://govjobs.public.lu/fr/postuler/postes-ouverts/postes-vacants/employes/2025/B1/Juin/20250612-agentadministratifintgrationli-373088.html",
        "Education Level": "Diplôme de fin d’études secondaires ou diplôme de technicien",
        "Job Category": "Education et Formation tout au long de la vie",
        "Status": "Employé de l'État",
        "Task": "Tâche complète",
        "Ministry": "Ministère de l'Éducation nationale, de l'Enfance et de la Jeunesse",
        "Administration/Organization": "Service de la formation des adultes",
        "Application Deadline": "19/06/2025",
        "Nationality": "Être ressortissant UE",
        "Number of Vacancies": "1",
        "Contract Type": "CDD jusqu'au 3 avril 2026",
        "Full Description": "Informations générales Statut Employé de l'État Groupe d'indemnité B1 Date limite de candidature 19/06/2025 Ministère Ministère de l'Éducation nationale, de l'Enfance et de la Jeunesse Administration/Organisme Service de la formation des adultes Lieu Belval Tâche Tâche complète Nombre de postes vacants 1 Type de contrat CDD jusqu'au 3 avril 2026 Nationalité Être ressortissant UE Catégorie de métiers Education et Formation tout au long de la vie Réf. E00036219 Qui recrute ? Service de la formation des adultes Missions Gestion des cours de l'intégration linguistique (IL) et de I'instruction de base pour Adultes (IBA) : création de cours, inscriptions, présences, émission de certificats, préparation des déclarations mensuelles des experts-externes; Accueil des nouveaux/elles apprenants/es; Encadrement des formateurs/trices; Accueil téléphonique et correspondance en relation avec l'IL et IBA; Contact avec les partenaires extérieurs (foyers, assistant(e)s sociales, etc.); Conseil, information et orientation des adultes/apprenants en terme de formation d'adultes. Profil Compétences techniques Bonne connaissance de l'anglais; Connaissance des outils Office365; Capacités d'organisation et de coordination; Bonnes capacités rédactionnelles; Comprendre et savoir appliquer les réglementations en relation avec les missions; Maîtriser les applications bureautiques courantes. Compétences comportementales Bonnes capacités relationelles; Aisance de contact; Esprit d'équipe; Discrétion; Disponibilité. Atouts Expérience du travail en équipe; Expérience du contact avec des personnes primo-arrivantes; Connaissances du GICEA; Connaissances en matière de formation d'adultes. Conditions d’admission Poste d'employé de l'État Obtenez plus de détails sur les conditions d'admission des employés de l'État . Diplômes Vous êtes détenteur soit du diplôme luxembourgeois de fin d’études secondaires, soit du diplôme luxembourgeois de fin d’études secondaires techniques, soit d’un certificat sanctionnant des études reconnues équivalentes. Langues Vous répondez aux exigences des connaissances de 3 langues administratives pour le groupe d'indemnité B1. Nationalité Vous êtes ressortissant d’un État membre de l’Union européenne. Documents à fournir Lettre de motivation, copie du diplôme et CV renseignant les informations suivantes: Nom(s) et prénom(s) Numéro d’identification (càd. le numéro de matricule nationale ou, à défaut, la date de naissance) Nationalité Adresse électronique Liste des établissements d’enseignement fréquentés et leur pays d’implantation (veuillez indiquer le nom complet des établissements, les abréviations n'étant pas permises) Diplômes (veuillez indiquer l'intitulé des diplômes) Expérience professionnelle Connaissances en langues parlées et écrites Pour ce poste, vous devez obligatoirement postuler en ligne via MyGuichet, les candidatures via courriel ou via courrier postal n’étant pas acceptées. Les documents sont à introduire via MyGuichet en format pdf (taille maximale 20 Mo).",
        "Informations générales": "StatutEmployé de l'ÉtatGroupe d'indemnitéB1Date limite de candidature19/06/2025MinistèreMinistère de l'Éducation nationale, de l'Enfance et de la JeunesseAdministration/OrganismeService de la formation des adultesLieuBelvalTâcheTâche complèteNombre de postes vacants1Type de contratCDD jusqu'au 3 avril 2026NationalitéÊtre ressortissant UECatégorie de métiersEducation et Formation tout au long de la vieRéf.E00036219",
        "Qui recrute ?": " Service de la formation des adultes ",
        "Missions": "Gestion des cours de l'intégration linguistique (IL) et de I'instruction de base pour Adultes (IBA) : création de cours, inscriptions, présences, émission de certificats, préparation des déclarations mensuelles des experts-externes;Accueil des nouveaux/elles apprenants/es;Encadrement des formateurs/trices;Accueil téléphonique et correspondance en relation avec l'IL et IBA;Contact avec les partenaires extérieurs (foyers, assistant(e)s sociales, etc.);Conseil, information et orientation des adultes/apprenants en terme de formation d'adultes.",
        "Profil": "Compétences techniques Bonne connaissance de l'anglais;Connaissance des outils Office365;Capacités d'organisation et de coordination;Bonnes capacités rédactionnelles;Comprendre et savoir appliquer les réglementations en relation avec les missions;Maîtriser les applications bureautiques courantes. Compétences comportementales Bonnes capacités relationelles;Aisance de contact;Esprit d'équipe;Discrétion;Disponibilité. Atouts Expérience du travail en équipe;Expérience du contact avec des personnes primo-arrivantes;Connaissances du GICEA;Connaissances en matière de formation d'adultes.",
        "Conditions d’admission": "Poste d'employé de l'État Obtenez plus de détails sur lesconditions d'admission des employés de l'État. Diplômes Vous êtes détenteur soit du diplôme luxembourgeois de fin d’études secondaires, soit du diplôme luxembourgeois de fin d’études secondaires techniques, soit d’un certificat sanctionnant des études reconnues équivalentes. Langues Vous répondez aux exigences des connaissances de 3 langues administratives pour le groupe d'indemnité B1. Nationalité Vous êtes ressortissant d’un État membre de l’Union européenne.",
        "Documents à fournir": "Lettre de motivation, copie du diplôme et CV renseignant les informations suivantes: Nom(s) et prénom(s)Numéro d’identification (càd. le numéro de matricule nationale ou, à défaut, la date de naissance)NationalitéAdresse électroniqueListe des établissements d’enseignement fréquentés et leur pays d’implantation (veuillez indiquer le nom complet des établissements, les abréviations n'étant pas permises)Diplômes (veuillez indiquer l'intitulé des diplômes)Expérience professionnelleConnaissances en langues parlées et écrites Pour ce poste, vous devez obligatoirement postuler en ligne via MyGuichet, les candidatures via courriel ou via courrier postal n’étant pas acceptées. Les documents sont à introduire via MyGuichet en format pdf (taille maximale 20 Mo).",
        "Group Classification": "B1",
        "adding_date": "2025-06-13T02:00:16.281082"
    },
    {
        "Title": "Project Management Officer (m/f) (réf. E00036223) (réf. F00036224)",
        "Link": "https://govjobs.public.lu/fr/postuler/postes-ouverts/postes-vacants/fonctionnaires/2025/A1/Juin/20250612-projectmanagementofficermfrfe0-373167.html",
        "Education Level": "Master",
        "Job Category": "Personnel et Organisation",
        "Status": "Fonctionnaire, Employé de l'État",
        "Task": "Tâche complète",
        "Ministry": "Ministère de l'Environnement, du Climat et de la Biodiversité",
        "Administration/Organization": "Administration de la gestion de l'eau",
        "Application Deadline": "04/07/2025",
        "Nationality": "Être ressortissant UE",
        "Number of Vacancies": "1",
        "Contract Type": "Admission au stage (fonctionnaire) ou CDI (employé de l’État)",
        "Full Description": "Informations générales Statut Fonctionnaire, Employé de l'État Groupe A1 Date limite de candidature 04/07/2025 Ministère Ministère de l'Environnement, du Climat et de la Biodiversité Administration/Organisme Administration de la gestion de l'eau Lieu Esch-sur-Alzette (Belval) Tâche Tâche complète Nombre de postes vacants 1 Nationalité Être ressortissant UE Catégorie de métiers Personnel et Organisation Réf. F00036224 Qui recrute ? Administration de la gestion de l'eau - Service Projet et coordination Administration de la gestion de l'eau Missions Implémenter et suivre le programme de travail de l’administration; Veiller à la cohérence des projets y figurant avec les différents plans de gestion développés par l’administration et les priorités gouvernementales; Accompagner les chefs de projet dans la conduite de leurs projets ainsi que dans l'application de la méthode de gestion de projets; Définir et exécuter les processus de sélection des projets et conseiller la direction; Consolider et présenter les analyses des projets du programme de travail pour la présentation régulière à la direction et au ministère de tutelle; Initier les revues de projet et coordonner l'évaluation des indicateurs de performance des projets; Supporter les équipes dans la résolution des difficultés rencontrées par la recherche de synergies, de coordination et compréhension fine du contexte; Coordonner les différentes unités et services dans l'optique d'une gestion optimale de projets; Faire le lien entre les différentes parties prenantes pour l'atteinte des objectifs de l'administration. Profil Compétences techniques Comprendre la vision et la stratégie de l’administration déclinée à travers le programme de travail; Savoir appliquer l'ensemble des techniques de la gestion de portefeuille de projets; Savoir décliner une stratégie au niveau de l’organisation des projets; Se prévaloir d'une expérience professionnelle confirmée en gestion de projets; Avoir de l'expérience dans le développement et la dispense de formations internes; Maîtriser la suite Microsoft Office; Savoir utiliser de manière avancée les feuilles de calculs afin d’élaborer des matrices d’analyse. Compétences comportementales Organiser et maintenir un échange constructif avec les parties prenantes internes et externes de l’administration et travailler en réseau; Avoir une appétence pour les matières techniques et scientifiques; Savoir fédérer et motiver les parties prenantes internes autour d'un objectif commun; Disposer d'une capacité d'analyse critique et de synthèse; Savoir travailler en équipe avec le PMO existant tout en sachant travailler de façon autonome, proactive, efficace et pragmatique; Montrer de la rigueur et un sens d'organisation pour la conduite simultanée de plusieurs projets ; Savoir gérer les changements et les priorités; Avoir une culture du résultat solidement ancrée. Atouts Avoir une certification en gestion de projet; Avoir une expérience en matière d'organisation administrative et procédurale. Conditions d’admission Le poste peut être brigué sous le statut du fonctionnaire ou de l’employé de l’État. Si vous souhaitez postuler sous le statut du fonctionnaire, vous devrez au préalable avoir réussi l’épreuve d’aptitude générale (EAG). Les candidats ayant réussi à l’EAG restent admissibles aux épreuves spéciales pendant une durée de 5 ans (à compter à partir de la décision de la commission d’examen). Obtenez plus de détails sur les conditions d'admission des fonctionnaires de l'État ainsi que sur les conditions d'admission des employés de l'État . Diplômes Vous êtes titulaire d’un grade ou diplôme délivré par un établissement d’enseignement supérieur reconnu par l’Etat du siège de l’établissement et sanctionnant l’accomplissement avec succès d’un master en gestion de projets ou de son équivalent. Expérience Vous avez une expérience d'au moins 3 ans dans le domaine. Langues Vous répondez aux exigences des connaissances de 3 langues administratives pour le groupe A1. Nationalité Vous êtes ressortissant d’un État membre de l’Union européenne. Documents à fournir Lettre de motivation, copie du diplôme, lettre de réussite à l’épreuve d’aptitude générale (uniquement pour le statut du fonctionnaire : joindre le document complet avec le relevé des notes par test et les annexes) et CV renseignant les informations suivantes: Nom(s) et prénom(s) Numéro d’identification (càd. le numéro de matricule nationale ou, à défaut, la date de naissance) Nationalité Adresse électronique Liste des établissements d’enseignement fréquentés et leur pays d’implantation (veuillez indiquer le nom complet des établissements, les abréviations n'étant pas permises) Diplômes (veuillez indiquer l'intitulé des diplômes) Expérience professionnelle Connaissances en langues parlées et écrites Pour ce poste, vous devez obligatoirement postuler en ligne via MyGuichet, les candidatures via courriel ou via courrier postal n’étant pas acceptées. Les documents sont à introduire via MyGuichet en format pdf (taille maximale 20 Mo).",
        "Informations générales": "StatutFonctionnaire, Employé de l'ÉtatGroupeA1Date limite de candidature04/07/2025MinistèreMinistère de l'Environnement, du Climat et de la BiodiversitéAdministration/OrganismeAdministration de la gestion de l'eauLieuEsch-sur-Alzette (Belval)TâcheTâche complèteNombre de postes vacants1NationalitéÊtre ressortissant UECatégorie de métiersPersonnel et OrganisationRéf.F00036224",
        "Qui recrute ?": "Administration de la gestion de l'eau - Service Projet et coordination",
        "Missions": "Implémenter et suivre le programme de travail de l’administration;Veiller à la cohérence des projets y figurant avec les différents plans de gestion développés par l’administration et les priorités gouvernementales;Accompagner les chefs de projet dans la conduite de leurs projets ainsi que dans l'application de la méthode de gestion de projets;Définir et exécuter les processus de sélection des projets et conseiller la direction;Consolider et présenter les analyses des projets du programme de travail pour la présentation régulière à la direction et au ministère de tutelle;Initier les revues de projet et coordonner l'évaluation des indicateurs de performance des projets;Supporter les équipes dans la résolution des difficultés rencontrées par la recherche de synergies, de coordination et compréhension fine du contexte;Coordonner les différentes unités et services dans l'optique d'une gestion optimale de projets;Faire le lien entre les différentes parties prenantes pour l'atteinte des objectifs de l'administration.",
        "Profil": "Compétences techniques Comprendre la vision et la stratégie de l’administration déclinée à travers le programme de travail;Savoir appliquer l'ensemble des techniques de la gestion de portefeuille de projets;Savoir décliner une stratégie au niveau de l’organisation des projets;Se prévaloir d'une expérience professionnelle confirmée en gestion de projets;Avoir de l'expérience dans le développement et la dispense de formations internes;Maîtriser la suite Microsoft Office;Savoir utiliser de manière avancée les feuilles de calculs afin d’élaborer des matrices d’analyse. Compétences comportementales Organiser et maintenir un échange constructif avec les parties prenantes internes et externes de l’administration et travailler en réseau;Avoir une appétence pour les matières techniques et scientifiques;Savoir fédérer et motiver les parties prenantes internes autour d'un objectif commun;Disposer d'une capacité d'analyse critique et de synthèse;Savoir travailler en équipe avec le PMO existant tout en sachant travailler de façon autonome, proactive, efficace et pragmatique;Montrer de la rigueur et un sens d'organisation pour la conduite simultanée de plusieurs projets ;Savoir gérer les changements et les priorités;Avoir une culture du résultat solidement ancrée. Atouts Avoir une certification en gestion de projet;Avoir une expérience en matière d'organisation administrative et procédurale.",
        "Conditions d’admission": "Le poste peut être brigué sous le statut du fonctionnaire ou de l’employé de l’État. Si vous souhaitez postuler sous le statut du fonctionnaire, vous devrez au préalable avoir réussi l’épreuve d’aptitude générale (EAG). Les candidats ayant réussi à l’EAG restent admissibles aux épreuves spéciales pendant une durée de 5 ans (à compter à partir de la décision de la commission d’examen). Obtenez plus de détails sur lesconditions d'admission des fonctionnaires de l'Étatainsi que sur lesconditions d'admission des employés de l'État. Diplômes Vous êtes titulaire d’un grade ou diplôme délivré par un établissement d’enseignement supérieur reconnu par l’Etat du siège de l’établissement et sanctionnant l’accomplissement avec succès d’un master en gestion de projets ou de son équivalent. Expérience Vous avez une expérience d'au moins 3 ans dans le domaine. Langues Vous répondez aux exigences des connaissances de 3 langues administratives pour le groupe A1. Nationalité Vous êtes ressortissant d’un État membre de l’Union européenne.",
        "Documents à fournir": "Lettre de motivation, copie du diplôme, lettre de réussite à l’épreuve d’aptitude générale (uniquement pour le statut du fonctionnaire : joindre le document complet avec le relevé des notes par test et les annexes) et CV renseignant les informations suivantes: Nom(s) et prénom(s)Numéro d’identification (càd. le numéro de matricule nationale ou, à défaut, la date de naissance)NationalitéAdresse électroniqueListe des établissements d’enseignement fréquentés et leur pays d’implantation (veuillez indiquer le nom complet des établissements, les abréviations n'étant pas permises)Diplômes (veuillez indiquer l'intitulé des diplômes)Expérience professionnelleConnaissances en langues parlées et écrites Pour ce poste, vous devez obligatoirement postuler en ligne via MyGuichet, les candidatures via courriel ou via courrier postal n’étant pas acceptées. Les documents sont à introduire via MyGuichet en format pdf (taille maximale 20 Mo).",
        "Group Classification": "A1",
        "adding_date": "2025-06-13T02:00:16.281207"
    },
    {
        "Title": "Surveillant dans les salles de musée (m/f) (réf. E00036226)",
        "Link": "https://govjobs.public.lu/fr/postuler/postes-ouverts/postes-vacants/employes/2025/D3/Juin/20250612-surveillantdanslessallesdemuse-373176.html",
        "Education Level": "Moins de 2 années ES",
        "Job Category": "Arts, Culture et Patrimoine",
        "Status": "Employé de l'État",
        "Task": "Tâche à temps partiel (40%)",
        "Ministry": "Ministère de la Culture",
        "Administration/Organization": "Musée national d’archéologie, d’histoire et d’art",
        "Application Deadline": "27/06/2025",
        "Nationality": "Être ressortissant UE",
        "Number of Vacancies": "5",
        "Contract Type": "CDD jusqu'au 28 juin 2026",
        "Full Description": "Informations générales Statut Employé de l'État Groupe d'indemnité D3 Date limite de candidature 27/06/2025 Ministère Ministère de la Culture Administration/Organisme Musée national d’archéologie, d’histoire et d’art Lieu Luxembourg ville Tâche Tâche à temps partiel (40%) Nombre de postes vacants 5 Type de contrat CDD jusqu'au 28 juin 2026 Nationalité Être ressortissant UE Catégorie de métiers Arts, Culture et Patrimoine Réf. E00036226 Qui recrute ? Musée national d’archéologie, d’histoire et d’art Missions Surveillance dans les salles de musée; Garantir la sécurité des visiteurs en cas d'alarme incendie, de malaise etc. Garantir la sécurité des objets d'exposition (vol, vandalisme, humidité etc.); Travail uniquement le weekend (samedi 7 heures et dimanche 8 heures); Poste idéal pour étudiants inscrits dans un établissement au Luxembourg. Profil Compétences techniques Fiabilité; Sens de la responsabilité; Ponctualite. Compétences comportementales Savoir communiquer; Aimer le contact avec le public; Savoir travailler en équipe et respecter le travail des autres; Bonne présentation. Atouts Connaissances linguistiques en luxembourgeois, français, allemand et anglais. Conditions d’admission Poste d'employé de l'État Obtenez plus de détails sur les conditions d'admission des employés de l'État . Diplômes Aucune condition d’études n’est requise pour ce poste. Langues Vous répondez aux exigences des connaissances de 3 langues administratives pour le groupe d'indemnité D3. Nationalité Vous êtes ressortissant d’un État membre de l’Union européenne. Documents à fournir Lettre de motivation, copie du diplôme et CV renseignant les informations suivantes: Nom(s) et prénom(s) Numéro d’identification (càd. le numéro de matricule nationale ou, à défaut, la date de naissance) Nationalité Adresse électronique Liste des établissements d’enseignement fréquentés et leur pays d’implantation (veuillez indiquer le nom complet des établissements, les abréviations n'étant pas permises) Diplômes (veuillez indiquer l'intitulé des diplômes) Expérience professionnelle Connaissances en langues parlées et écrites Pour ce poste, vous devez obligatoirement postuler en ligne via MyGuichet, les candidatures via courriel ou via courrier postal n’étant pas acceptées. Les documents sont à introduire via MyGuichet en format pdf (taille maximale 20 Mo).",
        "Informations générales": "StatutEmployé de l'ÉtatGroupe d'indemnitéD3Date limite de candidature27/06/2025MinistèreMinistère de la CultureAdministration/OrganismeMusée national d’archéologie, d’histoire et d’artLieuLuxembourg villeTâcheTâche à temps partiel (40%)Nombre de postes vacants5Type de contratCDD jusqu'au 28 juin 2026NationalitéÊtre ressortissant UECatégorie de métiersArts, Culture et PatrimoineRéf.E00036226",
        "Qui recrute ?": " Musée national d’archéologie, d’histoire et d’art ",
        "Missions": "Surveillance dans les salles de musée;Garantir la sécurité des visiteurs en cas d'alarme incendie, de malaise etc.Garantir la sécurité des objets d'exposition (vol, vandalisme, humidité etc.);Travail uniquement le weekend (samedi 7 heures et dimanche 8 heures);Poste idéal pour étudiants inscrits dans un établissement au Luxembourg.",
        "Profil": "Compétences techniques Fiabilité;Sens de la responsabilité;Ponctualite. Compétences comportementales Savoir communiquer;Aimer le contact avec le public;Savoir travailler en équipe et respecter le travail des autres;Bonne présentation. Atouts Connaissances linguistiques en luxembourgeois, français, allemand et anglais.",
        "Conditions d’admission": "Poste d'employé de l'État Obtenez plus de détails sur lesconditions d'admission des employés de l'État. Diplômes Aucune condition d’études n’est requise pour ce poste. Langues Vous répondez aux exigences des connaissances de 3 langues administratives pour le groupe d'indemnité D3. Nationalité Vous êtes ressortissant d’un État membre de l’Union européenne.",
        "Documents à fournir": "Lettre de motivation, copie du diplôme et CV renseignant les informations suivantes: Nom(s) et prénom(s)Numéro d’identification (càd. le numéro de matricule nationale ou, à défaut, la date de naissance)NationalitéAdresse électroniqueListe des établissements d’enseignement fréquentés et leur pays d’implantation (veuillez indiquer le nom complet des établissements, les abréviations n'étant pas permises)Diplômes (veuillez indiquer l'intitulé des diplômes)Expérience professionnelleConnaissances en langues parlées et écrites Pour ce poste, vous devez obligatoirement postuler en ligne via MyGuichet, les candidatures via courriel ou via courrier postal n’étant pas acceptées. Les documents sont à introduire via MyGuichet en format pdf (taille maximale 20 Mo).",
        "Group Classification": "D3",
        "adding_date": "2025-06-13T02:00:16.281301"
    },
    {
        "Title": "Assistant régional (m/f) (réf. E00036231)",
        "Link": "https://govjobs.public.lu/fr/postuler/postes-ouverts/postes-vacants/employes/2025/B1/Juin/20250612-assistantrgionalmfrfe00036231-373312.html",
        "Education Level": "Diplôme de fin d’études secondaires ou diplôme de technicien",
        "Job Category": "Environnement et Aménagement du territoire",
        "Status": "Employé de l'État",
        "Task": "Tâche complète",
        "Ministry": "Ministère de l'Environnement, du Climat et de la Biodiversité",
        "Administration/Organization": "Administration de la nature et des forêts",
        "Application Deadline": "27/06/2025",
        "Nationality": "Être ressortissant UE",
        "Number of Vacancies": "1",
        "Contract Type": "CDD jusqu'au 14 mai 2026",
        "Full Description": "Informations générales Statut Employé de l'État Groupe d'indemnité B1 Date limite de candidature 27/06/2025 Ministère Ministère de l'Environnement, du Climat et de la Biodiversité Administration/Organisme Administration de la nature et des forêts Lieu Leudelange Tâche Tâche complète Nombre de postes vacants 1 Type de contrat CDD jusqu'au 14 mai 2026 Nationalité Être ressortissant UE Catégorie de métiers Environnement et Aménagement du territoire Réf. E00036231 Qui recrute ? Administration de la nature et des forêts Missions Remplacement des postes vacants et des absences de longue durée aux triages ; Mise en œuvre et suivi de dossiers thématiques au niveau régional ; Travaux de surveillance de gestion et d’exploitation de la forêt et de conservation de la nature ; Encadrement des activités dans le domaine de la sensibilisation environnementale ; Support dans l'organisation du service d'Arrondissement Sud et assurer tous les travaux assignés par les chefs d'arrondissement ; Travaux administratifs au niveau de l’Arrondissement en remplaçant le poste de secrétaire actuellement vacant. Profil Compétences techniques Bonne maîtrise de la technique de la communication orale et écrite ; Bonnes capacités rédactionnelles ; Aisance dans l'utilisation des programmes informatiques courants. Compétences comportementales Développer une vue d'ensemble : Vous développez une vue d’ensemble, vous générez des alternatives et tirez des conclusions nuancées et éclairées ; S'organiser : Vous vous organisez en fixant les priorités, vous planifiez le travail et gérez les imprévus, vous travaillez de façon autonome en utilisant les moyens disponibles ; Soutenir : Vous agissez comme référence, vous accompagnez les collègues, vous les guidez et les soutenez en stimulant la coopération autour de l’objectif commun ; Servir le client-usager : Vous accompagnez le client-usager de manière personnalisée, vous entretenez des contacts réguliers et constructifs, vous appliquez les lignes de bonne conduite administrative ; Faire preuve d'ouverture : Vous êtes ouvert au changement et à l’innovation, vous vous ouvrez à la diversité et vous vous intéressez à d’autres disciplines que les vôtres ; Gérer le stress : Vous gardez votre calme face à la pression, vous restez constructif face à la critique et vous agissez de façon constante malgré les difficultés ; S'autodévelopper : Vous vous remettez en question de façon régulière, vous apprenez de vos erreurs et vous apprenez continuellement ; S'impliquer : Vous vous engagez pour générer des résultats, vous assumez la responsabilité et la qualité des actions entreprises, vous vous engagez pour le bien commun. Conditions d’admission Poste d'employé de l'État Obtenez plus de détails sur les conditions d'admission des employés de l'État . Diplômes Vous êtes titulaire du diplôme luxembourgeois de fin d’études secondaires, section C, soit du diplôme luxembourgeois de fin d’études secondaires techniques, section sciences naturelles ou section technicien en environnement naturel, soit présenter un certificat sanctionnant des études équivalentes. Langues Vous répondez aux exigences des connaissances de 3 langues administratives pour le groupe d'indemnité B1. Nationalité Vous êtes ressortissant d’un État membre de l’Union européenne. Documents à fournir Lettre de motivation, copie du diplôme et CV renseignant les informations suivantes: Nom(s) et prénom(s) Numéro d’identification (càd. le numéro de matricule nationale ou, à défaut, la date de naissance) Nationalité Adresse électronique Liste des établissements d’enseignement fréquentés et leur pays d’implantation (veuillez indiquer le nom complet des établissements, les abréviations n'étant pas permises) Diplômes (veuillez indiquer l'intitulé des diplômes) Expérience professionnelle Connaissances en langues parlées et écrites Pour ce poste, vous devez obligatoirement postuler en ligne via MyGuichet, les candidatures via courriel ou via courrier postal n’étant pas acceptées. Les documents sont à introduire via MyGuichet en format pdf (taille maximale 20 Mo).",
        "Informations générales": "StatutEmployé de l'ÉtatGroupe d'indemnitéB1Date limite de candidature27/06/2025MinistèreMinistère de l'Environnement, du Climat et de la BiodiversitéAdministration/OrganismeAdministration de la nature et des forêtsLieuLeudelangeTâcheTâche complèteNombre de postes vacants1Type de contratCDD jusqu'au 14 mai 2026NationalitéÊtre ressortissant UECatégorie de métiersEnvironnement et Aménagement du territoireRéf.E00036231",
        "Qui recrute ?": " Administration de la nature et des forêts ",
        "Missions": "Remplacement des postes vacants et des absences de longue durée aux triages ;Mise en œuvre et suivi de dossiers thématiques au niveau régional ;Travaux de surveillance de gestion et d’exploitation de la forêt et de conservation de la nature ;Encadrement des activités dans le domaine de la sensibilisation environnementale ;Support dans l'organisation du service d'Arrondissement Sud et assurer tous les travaux assignés par les chefs d'arrondissement ;Travaux administratifs au niveau de l’Arrondissement en remplaçant le poste de secrétaire actuellement vacant.",
        "Profil": "Compétences techniques Bonne maîtrise de la technique de la communication orale et écrite ;Bonnes capacités rédactionnelles ;Aisance dans l'utilisation des programmes informatiques courants. Compétences comportementales Développer une vue d'ensemble : Vous développez une vue d’ensemble, vous générez des alternatives et tirez des conclusions nuancées et éclairées ;S'organiser : Vous vous organisez en fixant les priorités, vous planifiez le travail et gérez les imprévus, vous travaillez de façon autonome en utilisant les moyens disponibles ;Soutenir : Vous agissez comme référence, vous accompagnez les collègues, vous les guidez et les soutenez en stimulant la coopération autour de l’objectif commun ;Servir le client-usager : Vous accompagnez le client-usager de manière personnalisée, vous entretenez des contacts réguliers et constructifs, vous appliquez les lignes de bonne conduite administrative ;Faire preuve d'ouverture : Vous êtes ouvert au changement et à l’innovation, vous vous ouvrez à la diversité et vous vous intéressez à d’autres disciplines que les vôtres ;Gérer le stress : Vous gardez votre calme face à la pression, vous restez constructif face à la critique et vous agissez de façon constante malgré les difficultés ;S'autodévelopper : Vous vous remettez en question de façon régulière, vous apprenez de vos erreurs et vous apprenez continuellement ;S'impliquer : Vous vous engagez pour générer des résultats, vous assumez la responsabilité et la qualité des actions entreprises, vous vous engagez pour le bien commun.",
        "Conditions d’admission": "Poste d'employé de l'État Obtenez plus de détails sur lesconditions d'admission des employés de l'État. Diplômes Vous êtes titulaire du diplôme luxembourgeois de fin d’études secondaires, section C, soit du diplôme luxembourgeois de fin d’études secondaires techniques, section sciences naturelles ou section technicien en environnement naturel, soit présenter un certificat sanctionnant des études équivalentes. Langues Vous répondez aux exigences des connaissances de 3 langues administratives pour le groupe d'indemnité B1. Nationalité Vous êtes ressortissant d’un État membre de l’Union européenne.",
        "Documents à fournir": "Lettre de motivation, copie du diplôme et CV renseignant les informations suivantes: Nom(s) et prénom(s)Numéro d’identification (càd. le numéro de matricule nationale ou, à défaut, la date de naissance)NationalitéAdresse électroniqueListe des établissements d’enseignement fréquentés et leur pays d’implantation (veuillez indiquer le nom complet des établissements, les abréviations n'étant pas permises)Diplômes (veuillez indiquer l'intitulé des diplômes)Expérience professionnelleConnaissances en langues parlées et écrites Pour ce poste, vous devez obligatoirement postuler en ligne via MyGuichet, les candidatures via courriel ou via courrier postal n’étant pas acceptées. Les documents sont à introduire via MyGuichet en format pdf (taille maximale 20 Mo).",
        "Group Classification": "B1",
        "adding_date": "2025-06-13T02:00:16.281331"
    },
    {
        "Title": "Agent de rétention (m/f) (réf. E00036237)",
        "Link": "https://govjobs.public.lu/fr/postuler/postes-ouverts/postes-vacants/employes/2025/D1/Juin/20250612-agentdertentionmfrfe00036237-373344.html",
        "Education Level": "3 années ES",
        "Job Category": "Population, Défense et Sécurité",
        "Status": "Employé de l'État",
        "Task": "Tâche complète",
        "Ministry": "Ministère des Affaires intérieures",
        "Administration/Organization": "Centre de rétention",
        "Application Deadline": "19/06/2025",
        "Nationality": "Être ressortissant UE",
        "Number of Vacancies": "1",
        "Contract Type": "CDD jusqu'au 30 avril 2027",
        "Full Description": "Informations générales Statut Employé de l'État Groupe d'indemnité D1 Date limite de candidature 19/06/2025 Ministère Ministère des Affaires intérieures Administration/Organisme Centre de rétention Lieu Centre de rétention Tâche Tâche complète Nombre de postes vacants 1 Type de contrat CDD jusqu'au 30 avril 2027 Nationalité Être ressortissant UE Catégorie de métiers Population, Défense et Sécurité Réf. E00036237 Qui recrute ? Centre de rétention Missions Encadrer des personnes placées sous la responsabilité du Centre de rétention; Collaborer à la prévention des incidents et à la gestion de risque; Gérer le déroulement quotidien dans les établissements placés sous la responsabilité du Centre de rétention. Profil Compétences techniques Appliquer les règles de sécurité et avoir les gestes et postures adaptés; Maîtriser les techniques d'intervention en cas d'incidents; Savoir manier les moyens techniques d'intervention et de contrainte. Compétences comportementales Analyser : Vous évaluez les informations, données et contenus de manière critique, le cas échéant dans un environnement digital, vous identifiez les liens logiques et restituez l’information dans une synthèse complète et cohérente; Mettre en œuvre des solutions : Vous prenez l’initiative de résoudre les problèmes, vous mettez en oeuvre les solutions et vous agissez pour améliorer les processus et les méthodes de travail en tenant compte des évolutions technologiques; Soutenir : Vous agissez comme référence, vous accompagnez les collègues, vous les guidez et les soutenez en stimulant la coopération autour de l’objectif commun; Servir le client-usager : Vous accompagnez le client-usager de manière personnalisée, vous entretenez des contacts réguliers et constructifs, vous appliquez les lignes de bonne conduite administrative; Faire preuve d'ouverture : Vous êtes ouvert au changement et à l’innovation, vous vous ouvrez à la diversité et vous vous intéressez à d’autres disciplines que les vôtres; Gérer le stress : Vous gardez votre calme face à la pression, vous restez constructif face à la critique et vous agissez de façon constante malgré les difficultés; S'autodévelopper : Vous vous remettez en question de façon régulière, vous apprenez de vos erreurs et vous apprenez continuellement; S'impliquer : Vous vous engagez pour générer des résultats, vous assumez la responsabilité et la qualité des actions entreprises, vous vous engagez pour le bien commun. Atouts Maîtrise d'une ou de plusieurs langues autres que les langues officielles. Conditions d’admission Poste d'employé de l'État Obtenez plus de détails sur les conditions d'admission des employés de l'État . Diplômes Vous avez accompli avec succès 3 années d'études dans l'enseignement public luxembourgeois, soit dans l'enseignement secondaire, soit dans l'enseignement secondaire technique ou présentez un certificat reconnu comme équivalent. Langues Vous répondez aux exigences des connaissances de 3 langues administratives pour le groupe d'indemnité D1. Nationalité Vous êtes ressortissant d’un État membre de l’Union européenne. Documents à fournir Lettre de motivation, copie du diplôme et CV renseignant les informations suivantes: Nom(s) et prénom(s) Numéro d’identification (càd. le numéro de matricule nationale ou, à défaut, la date de naissance) Nationalité Adresse électronique Liste des établissements d’enseignement fréquentés et leur pays d’implantation (veuillez indiquer le nom complet des établissements, les abréviations n'étant pas permises) Diplômes (veuillez indiquer l'intitulé des diplômes) Expérience professionnelle Connaissances en langues parlées et écrites Pour ce poste, vous devez obligatoirement postuler en ligne via MyGuichet, les candidatures via courriel ou via courrier postal n’étant pas acceptées. Les documents sont à introduire via MyGuichet en format pdf (taille maximale 20 Mo).",
        "Informations générales": "StatutEmployé de l'ÉtatGroupe d'indemnitéD1Date limite de candidature19/06/2025MinistèreMinistère des Affaires intérieuresAdministration/OrganismeCentre de rétentionLieuCentre de rétentionTâcheTâche complèteNombre de postes vacants1Type de contratCDD jusqu'au 30 avril 2027NationalitéÊtre ressortissant UECatégorie de métiersPopulation, Défense et SécuritéRéf.E00036237",
        "Qui recrute ?": " Centre de rétention ",
        "Missions": "Encadrer des personnes placées sous la responsabilité du Centre de rétention;Collaborer à la prévention des incidents et à la gestion de risque;Gérer le déroulement quotidien dans les établissements placés sous la responsabilité du Centre de rétention.",
        "Profil": "Compétences techniques Appliquer les règles de sécurité et avoir les gestes et postures adaptés;Maîtriser les techniques d'intervention en cas d'incidents;Savoir manier les moyens techniques d'intervention et de contrainte. Compétences comportementales Analyser : Vous évaluez les informations, données et contenus de manière critique, le cas échéant dans un environnement digital, vous identifiez les liens logiques et restituez l’information dans une synthèse complète et cohérente;Mettre en œuvre des solutions : Vous prenez l’initiative de résoudre les problèmes, vous mettez en oeuvre les solutions et vous agissez pour améliorer les processus et les méthodes de travail en tenant compte des évolutions technologiques;Soutenir : Vous agissez comme référence, vous accompagnez les collègues, vous les guidez et les soutenez en stimulant la coopération autour de l’objectif commun;Servir le client-usager : Vous accompagnez le client-usager de manière personnalisée, vous entretenez des contacts réguliers et constructifs, vous appliquez les lignes de bonne conduite administrative;Faire preuve d'ouverture : Vous êtes ouvert au changement et à l’innovation, vous vous ouvrez à la diversité et vous vous intéressez à d’autres disciplines que les vôtres;Gérer le stress : Vous gardez votre calme face à la pression, vous restez constructif face à la critique et vous agissez de façon constante malgré les difficultés;S'autodévelopper : Vous vous remettez en question de façon régulière, vous apprenez de vos erreurs et vous apprenez continuellement;S'impliquer : Vous vous engagez pour générer des résultats, vous assumez la responsabilité et la qualité des actions entreprises, vous vous engagez pour le bien commun. Atouts Maîtrise d'une ou de plusieurs langues autres que les langues officielles.",
        "Conditions d’admission": "Poste d'employé de l'État Obtenez plus de détails sur lesconditions d'admission des employés de l'État. Diplômes Vous avez accompli avec succès 3 années d'études dans l'enseignement public luxembourgeois, soit dans l'enseignement secondaire, soit dans l'enseignement secondaire technique ou présentez un certificat reconnu comme équivalent. Langues Vous répondez aux exigences des connaissances de 3 langues administratives pour le groupe d'indemnité D1. Nationalité Vous êtes ressortissant d’un État membre de l’Union européenne.",
        "Documents à fournir": "Lettre de motivation, copie du diplôme et CV renseignant les informations suivantes: Nom(s) et prénom(s)Numéro d’identification (càd. le numéro de matricule nationale ou, à défaut, la date de naissance)NationalitéAdresse électroniqueListe des établissements d’enseignement fréquentés et leur pays d’implantation (veuillez indiquer le nom complet des établissements, les abréviations n'étant pas permises)Diplômes (veuillez indiquer l'intitulé des diplômes)Expérience professionnelleConnaissances en langues parlées et écrites Pour ce poste, vous devez obligatoirement postuler en ligne via MyGuichet, les candidatures via courriel ou via courrier postal n’étant pas acceptées. Les documents sont à introduire via MyGuichet en format pdf (taille maximale 20 Mo).",
        "Group Classification": "D1",
        "adding_date": "2025-06-13T02:00:16.281467"
    }
]